<!DOCTYPE html>
<html   lang="en-US" >
<head id="head"><title>
	Nuclear Regulatory Commission
</title><meta name="description" content="Nuclear Regulatory Commission" /> 
<meta charset="UTF-8" /> 
<meta name="robots" content="noindex,nofollow" /> 
<script async type="text/javascript" id="_fed_an_ua_tag" src="https://dap.digitalgov.gov/Universal-Federated-Analytics-Min.js?agency=NRC"></script>

<meta name="apple-mobile-web-app-title" content="NRC Web">
<meta name="application-name" content="NRC Web">
<meta name="msapplication-TileColor" content="#ffffff">
<meta name="theme-color" content="#ffffff">
<meta http-equiv="X-UA-Compatible" content="IE=edge">
<meta name="viewport" content="width=device-width, initial-scale=1.0">
<meta property="og:image:width" content="279">
<meta property="og:image:height" content="279">
<meta property="og:title" content="home">
 
<meta property="og:image" content='/cdn/site/logo/og-image.jpg'>

<meta property="og:description" content="home">
<meta property="og:url" content="https://www.nrc.gov/">
<meta property="og:image:alt" content="U.S. Nuclear Regulatory Commission Web Site Banner">

<meta property="og:site_name" content='NRC Web'>
<meta name="twitter:card" content="summary">
<meta name="twitter:creator" content="@NRC">
<meta name="twitter:site" content="@NRCgov">
<meta property="og:type" content="website">
<meta property="og:locale" content="en-US" />
<meta name="msapplication-config" content="/cdn/site/logo/browserconfig.xml">

<link rel="apple-touch-icon" sizes="180x180" href="/cdn/site/logo/apple-touch-icon.png">
<link rel="shortcut icon" href="/cdn/site/logo/favicon.ico">
<link rel="icon" type="image/png" sizes="32x32" href="/cdn/site/logo/favicon-32x32.png">
<link rel="icon" type="image/png" sizes="16x16" href="/cdn/site/logo/favicon-16x16.png">
<link rel="manifest" href="/cdn/site/logo/manifest.json">
<link rel="mask-icon" href="/cdn/site/logo/safari-pinned-tab.svg" color="#ffffff">
<script>(function() { 
var a = document.createElement('script');
a.type = 'text/javascript';
a.async = true;
a.src = 'https://cdn.gov.cfigroup.com/webmon/s/source/webmon/9de8b1c6db1117/webmon.js';;
var b = document.getElementsByTagName('script')[0];
b.parentNode.insertBefore(a, b);
})();
</script>
<!-- CORE CSS -->
<link href="/working/nrcweb/css/bundler.2E4B1EEFF01525F32233DDCD7B9B4A2D.css" rel="stylesheet" type="text/css" />
<link rel="canonical" href='https://www.nrc.gov/' /> 

                              <script>!function(e){var n="https://s.go-mpulse.net/boomerang/";if("True"=="True")e.BOOMR_config=e.BOOMR_config||{},e.BOOMR_config.PageParams=e.BOOMR_config.PageParams||{},e.BOOMR_config.PageParams.pci=!0,n="https://s2.go-mpulse.net/boomerang/";if(window.BOOMR_API_key="NY72W-PC7AC-AHREW-9TAVJ-VGMAW",function(){function e(){if(!r){var e=document.createElement("script");e.id="boomr-scr-as",e.src=window.BOOMR.url,e.async=!0,o.appendChild(e),r=!0}}function t(e){r=!0;var n,t,a,i,d=document,O=window;if(window.BOOMR.snippetMethod=e?"if":"i",t=function(e,n){var t=d.createElement("script");t.id=n||"boomr-if-as",t.src=window.BOOMR.url,BOOMR_lstart=(new Date).getTime(),e=e||d.body,e.appendChild(t)},!window.addEventListener&&window.attachEvent&&navigator.userAgent.match(/MSIE [67]\./))return window.BOOMR.snippetMethod="s",void t(o,"boomr-async");a=document.createElement("IFRAME"),a.src="about:blank",a.title="",a.role="presentation",a.loading="eager",i=(a.frameElement||a).style,i.width=0,i.height=0,i.border=0,i.display="none",o.appendChild(a);try{O=a.contentWindow,d=O.document.open()}catch(_){n=document.domain,a.src="javascript:var d=document.open();d.domain='"+n+"';void 0;",O=a.contentWindow,d=O.document.open()}if(n)d._boomrl=function(){this.domain=n,t()},d.write("<bo"+"dy onload='document._boomrl();'>");else if(O._boomrl=function(){t()},O.addEventListener)O.addEventListener("load",O._boomrl,!1);else if(O.attachEvent)O.attachEvent("onload",O._boomrl);d.close()}function a(e){window.BOOMR_onload=e&&e.timeStamp||(new Date).getTime()}if(!window.BOOMR||!window.BOOMR.version&&!window.BOOMR.snippetExecuted){window.BOOMR=window.BOOMR||{},window.BOOMR.snippetStart=(new Date).getTime(),window.BOOMR.snippetExecuted=!0,window.BOOMR.snippetVersion=14,window.BOOMR.url=n+"NY72W-PC7AC-AHREW-9TAVJ-VGMAW";var i=document.currentScript||document.getElementsByTagName("script")[0],o=i.parentNode,r=!1,d=document.createElement("link");if(d.relList&&"function"==typeof d.relList.supports&&d.relList.supports("preload")&&"as"in d)window.BOOMR.snippetMethod="p",d.href=window.BOOMR.url,d.rel="preload",d.as="script",d.addEventListener("load",e),d.addEventListener("error",function(){t(!0)}),setTimeout(function(){if(!r)t(!0)},3e3),BOOMR_lstart=(new Date).getTime(),o.appendChild(d);else t(!1);if(window.addEventListener)window.addEventListener("load",a,!1);else if(window.attachEvent)window.attachEvent("onload",a)}}(),"".length>0)if(e&&"performance"in e&&e.performance&&"function"==typeof e.performance.setResourceTimingBufferSize)e.performance.setResourceTimingBufferSize();!function(){if(BOOMR=e.BOOMR||{},BOOMR.plugins=BOOMR.plugins||{},!BOOMR.plugins.AK){var n=""=="true"?1:0,t="",a="eptzex5yk4qbgz62xzia-f-bb0703ca9-clientnsv4-s.akamaihd.net",i="false"=="true"?2:1,o={"ak.v":"39","ak.cp":"1135018","ak.ai":parseInt("670380",10),"ak.ol":"0","ak.cr":11,"ak.ipv":4,"ak.proto":"http/1.1","ak.rid":"1751f31d","ak.r":40932,"ak.a2":n,"ak.m":"dsca","ak.n":"essl","ak.bpcip":"35.231.146.0","ak.cport":57802,"ak.gh":"23.56.236.59","ak.quicv":"","ak.tlsv":"tls1.3","ak.0rtt":"","ak.0rtt.ed":"","ak.csrc":"-","ak.acc":"reno","ak.t":"1742388816","ak.ak":"hOBiQwZUYzCg5VSAfCLimQ==d1VceRwGUytikcytRCPwwtz6UO0mjxhXtwJwk1kPIwpKhamxMlcJr/yK3VzFVqlD2VJpccRKqV8g/f+iuvG8rmd/TnaHXxNVYLUdRgJEhv1aiAGvPwFVUo3HnjucSzzggB8oOADI3gYRMHyvEu5LwH6VHZ9Qv+gtu92cp8MS+SYGXcwDg8B/QNckfuLKFNhI3Ar6m4pkRt26A7Jjsc8OChtcSkl/r7u6ZzkgW+Mz960HvqEe4o9zCOarx0glTaf8HY/euQchkad/Xx59s2U7gwfCmvuN+R96QdIaL0kMNWqhjzq0hVkQcjGsk9ozCDJenvbt8qdgG7U9bbn3/YdAkm0mVTONVC5GUFG20HUmzoF6pC7bi6HzYwwVfnMr4CfIMuiEbgR1nTYX8nIKzLdUESJNMpmrzamgT0Hu1gVQpOM=","ak.pv":"149","ak.dpoabenc":"","ak.tf":i};if(""!==t)o["ak.ruds"]=t;var r={i:!1,av:function(n){var t="http.initiator";if(n&&(!n[t]||"spa_hard"===n[t]))o["ak.feo"]=void 0!==e.aFeoApplied?1:0,BOOMR.addVar(o)},rv:function(){var e=["ak.bpcip","ak.cport","ak.cr","ak.csrc","ak.gh","ak.ipv","ak.m","ak.n","ak.ol","ak.proto","ak.quicv","ak.tlsv","ak.0rtt","ak.0rtt.ed","ak.r","ak.acc","ak.t","ak.tf"];BOOMR.removeVar(e)}};BOOMR.plugins.AK={akVars:o,akDNSPreFetchDomain:a,init:function(){if(!r.i){var e=BOOMR.subscribe;e("before_beacon",r.av,null,null),e("onbeacon",r.rv,null,null),r.i=!0}return this},is_complete:function(){return!0}}}}()}(window);</script></head>
<body class="LTR Chrome ENUS ContentBody" >
    
    <form method="post" action="/" id="form">
<div class="aspNetHidden">
<input type="hidden" name="__EVENTTARGET" id="__EVENTTARGET" value="" />
<input type="hidden" name="__EVENTARGUMENT" id="__EVENTARGUMENT" value="" />

</div>

<script type="text/javascript">
//<![CDATA[
var theForm = document.forms['form'];
if (!theForm) {
    theForm = document.form;
}
function __doPostBack(eventTarget, eventArgument) {
    if (!theForm.onsubmit || (theForm.onsubmit() != false)) {
        theForm.__EVENTTARGET.value = eventTarget;
        theForm.__EVENTARGUMENT.value = eventArgument;
        theForm.submit();
    }
}
//]]>
</script>


<script src="/WebResource.axd?d=pynGkmcFUV13He1Qd6_TZNyrqkTFBLVH56uyeCoMaUYaY9bSM0aV9VynHtxJo91FwpABBsU-rkHbUFRdWULW4Q2&amp;t=638628224627334853" type="text/javascript"></script>

<input type="hidden" name="lng" id="lng" value="en-US" />
<script type="text/javascript">
	//<![CDATA[

function PM_Postback(param) { if (window.top.HideScreenLockWarningAndSync) { window.top.HideScreenLockWarningAndSync(1080); } if(window.CMSContentManager) { CMSContentManager.allowSubmit = true; }; __doPostBack('m$am',param); }
function PM_Callback(param, callback, ctx) { if (window.top.HideScreenLockWarningAndSync) { window.top.HideScreenLockWarningAndSync(1080); }if (window.CMSContentManager) { CMSContentManager.storeContentChangedStatus(); };WebForm_DoCallback('m$am',param,callback,ctx,null,true); }
//]]>
</script>
<script type="text/javascript">
	//<![CDATA[

var CMS = CMS || {};
CMS.Application = {
  "language": "en",
  "imagesUrl": "/CMSPages/GetResource.ashx?image=%5bImages.zip%5d%2f",
  "isDebuggingEnabled": false,
  "applicationUrl": "/",
  "isDialog": false,
  "isRTL": "false"
};

//]]>
</script>
<div class="aspNetHidden">

	<input type="hidden" name="__VIEWSTATEGENERATOR" id="__VIEWSTATEGENERATOR" value="A5343185" />
	<input type="hidden" name="__SCROLLPOSITIONX" id="__SCROLLPOSITIONX" value="0" />
	<input type="hidden" name="__SCROLLPOSITIONY" id="__SCROLLPOSITIONY" value="0" />
</div> 
    
    <div id="ctxM">

</div>
    <a href="#" class="scrollToTop" title="Back to top">
  <i class="icon-fontello-up-open-mini"></i>
</a>
<div class="main-header">
  <div class="container">
    <div class="row">
      <div class="col-12">
        <button id="top-links-button" role="button" type="button"
        class="main-header-top-links-toggle btn  d-lg-none">Other Links</button>
        <div id="top-links" class="main-header-top-links d-none d-lg-block">
          <ul>
            
<li><a href="/reading-rm/doc-collections/faq/index.html" rel="noopener noreferrer" target="_self">FAQ</a></li><li><a href="/agreement-states.html" rel="noopener noreferrer" target="_self">Agreement States</a></li><li><a href="/info-finder.html" rel="noopener noreferrer" target="_self">Facility Locator</a></li><li><a href="/site-help/new-content.html" rel="noopener noreferrer" target="_self">What's New</a></li><li><a href="/site-help.html" rel="noopener noreferrer" target="_self">Site Help</a></li><li><a href="/site-help/index-az.html" rel="noopener noreferrer" target="_self">Index A-Z</a></li><li><a href="/about-nrc/contactus.html" rel="noopener noreferrer" target="_self">Contact Us</a></li><li><a href="/public-involve/listserver.html" rel="noopener noreferrer" target="_self">Email Updates</a></li>

          </ul>
        </div>
      </div>
    </div>
    <div class="row">
      <div class="col-12">
        <button class="navbar-toggler collapsed" type="button" data-bs-toggle="collapse" data-bs-target="#main_nav" data-bs-target="#main_nav" aria-label="Mobile Navigation Trigger" role="button">
          <div class="hamburger-toggle">
            <div class="hamburger">
              <i class="icon-fontello-menu-1"></i>
            </div>
          </div>
        </button>
        <a href="/" rel="noopener noreferrer" class="main-header-logo"
        title="United States Nuclear Regulatory Commission Home Page">
          <img class="img-responsive" src="https://nrcgovsamediadev.blob.core.windows.net/dev/libraries/media/nrcweb/site/logo/logo.png"
          alt="United States Nuclear Regulatory Commission Logo">
        </a>
        <div class="main-header-content">
          <a href="/about-nrc/regulatory/allegations/safety-concern.html" class="btn quaternary-bg" rel="noopener noreferrer" title="Report a Safety Concern">Report a
            Safety Concern</a>
          <div class="content">
            <input type="search" id="master-search" class="search-input form-control" aria-label="Master site search">
            <a href="/site-help/Search-Results?site=AllSites" id="master-search-btn" class="search-btn btn"
            aria-label="Master site search">Search</a>
          </div>
          <div class="main-header-content-social-media">
            <ul>
              
<!--Twitter-->
<li><a class='header-twitter' href='https://twitter.com/nrcgov' target='_blank' title='NRC X Feed' rel='noopener noreferrer'><svg xmlns=https://www.w3.org/2000/svg height='1em' viewBox='0 0 512 512'><path d='M389.2 48h70.6L305.6 224.2 487 464H345L233.7 318.6 106.5 464H35.8L200.7 275.5 26.8 48H172.4L272.9 180.9 389.2 48zM364.4 421.8h39.1L151.1 88h-42L364.4 421.8z'/></svg></a></li>
<!--Instagram-->
<li><a href='https://www.instagram.com/nrcgov' target='_blank' title='NRC Instagram' rel='noopener noreferrer'><i class='icon-fontello-s-instagram'></i></a></li>
<!--Facebook-->
<li><a href='https://www.facebook.com/nrcgov/' target='_blank' title='NRC Facebook' rel='noopener noreferrer'><i class='icon-fontello-s-facebook'></i></a></li>
<!-- YouTube -->
<li><a href='https://www.youtube.com/user/NRCgov' target='_blank' title='NRC YouTube Channel' rel='noopener noreferrer'><i class='icon-fontello-s-youtube'></i></a></li>
<!--Linkedin-->
<li><a href='https://www.linkedin.com/company/u-s--nuclear-regulatory-commission/' target='_blank' title='NRC Linkedin' rel='noopener noreferrer'><i class='icon-fontello-s-linkedin'></i></a></li>
<!--Flickr-->
<li><a href='https://www.flickr.com/photos/nrcgov/sets' target='_blank' title='NRC Flickr Gallery' rel='noopener noreferrer'><i class='icon-fontello-s-flickr'></i></a></li>
<!--Subscribe-->
<li><a href='https://service.govdelivery.com/service/multi_subscribe.html?code=USNRC' target='_blank' title='NRC Email Subscriptions - GovDelivery' rel='noopener noreferrer'><i class='icon-fontello-comment'></i></a></li>
<!--RSS-->
<li><a href='/public-involve/rss-feeds.html' target='_self' title='NRC RSS Feed'><i class='icon-fontello-rss'></i></a></li>
<!--Pinterest-->


            </ul>
          </div>
        </div>
      </div>
    </div>
  </div>
</div>

<nav class="navbar navbar-expand-lg bg-primary" role="menu">
  <div class="collapse navbar-collapse" id="main_nav">
    <ul class="navbar-nav">
      <li class="nav-item dropdown has-megamenu">
  <a class="nav-link dropdown-toggle" href="#" data-bs-toggle="dropdown" aria-expanded="false">Nuclear Reactors</a>
  <div class="dropdown-menu megamenu">
    <div class="container">
      <div class="row">
        <div class="col-12">
          <h5><a href="/reactors.html">Nuclear Reactors</a></h5>
        </div>
      </div>
<div class="container"><div class="row inner-top-xs general-content  "><div class="mb-pd-btm col-sm-4"><a id="p_lt_WebPartZone3_zMainNav_CORE_V1_MegaMenuPlaceholder_p_lt_WebPartZone1_zC_CORE_V1_Three_Column_Layout_CORE_V1_Three_Column_Layout_1_CORE_V1_InPageLink_btnElem_hyperLink" href="/reactors/power.html" target="_self"><span id="p_lt_WebPartZone3_zMainNav_CORE_V1_MegaMenuPlaceholder_p_lt_WebPartZone1_zC_CORE_V1_Three_Column_Layout_CORE_V1_Three_Column_Layout_1_CORE_V1_InPageLink_btnElem_lblText">Power Reactors</span></a>
<a id="p_lt_WebPartZone3_zMainNav_CORE_V1_MegaMenuPlaceholder_p_lt_WebPartZone1_zC_CORE_V1_Three_Column_Layout_CORE_V1_Three_Column_Layout_1_CORE_V1_InPageLink1_btnElem_hyperLink" href="/reactors/non-power.html" target="_self"><span id="p_lt_WebPartZone3_zMainNav_CORE_V1_MegaMenuPlaceholder_p_lt_WebPartZone1_zC_CORE_V1_Three_Column_Layout_CORE_V1_Three_Column_Layout_1_CORE_V1_InPageLink1_btnElem_lblText">Research &amp; Test Reactors</span></a>
</div><div class="mb-pd-btm col-sm-4"><a id="p_lt_WebPartZone3_zMainNav_CORE_V1_MegaMenuPlaceholder_p_lt_WebPartZone1_zC_CORE_V1_Three_Column_Layout_CORE_V1_Three_Column_Layout_2_CORE_V1_InPageLink2_btnElem_hyperLink" href="/reactors/operating.html" target="_self"><span id="p_lt_WebPartZone3_zMainNav_CORE_V1_MegaMenuPlaceholder_p_lt_WebPartZone1_zC_CORE_V1_Three_Column_Layout_CORE_V1_Three_Column_Layout_2_CORE_V1_InPageLink2_btnElem_lblText">Operating Reactors</span></a>
<a id="p_lt_WebPartZone3_zMainNav_CORE_V1_MegaMenuPlaceholder_p_lt_WebPartZone1_zC_CORE_V1_Three_Column_Layout_CORE_V1_Three_Column_Layout_2_CORE_V1_InPageLink3_btnElem_hyperLink" href="/reactors/new-reactors.html" target="_self"><span id="p_lt_WebPartZone3_zMainNav_CORE_V1_MegaMenuPlaceholder_p_lt_WebPartZone1_zC_CORE_V1_Three_Column_Layout_CORE_V1_Three_Column_Layout_2_CORE_V1_InPageLink3_btnElem_lblText">New Reactors</span></a>
</div><div class="mb-pd-btm col-sm-4"><a id="p_lt_WebPartZone3_zMainNav_CORE_V1_MegaMenuPlaceholder_p_lt_WebPartZone1_zC_CORE_V1_Three_Column_Layout_CORE_V1_Three_Column_Layout_3_CORE_V1_InPageLink4_btnElem_hyperLink" href="/reactors/operator-licensing.html" target="_self"><span id="p_lt_WebPartZone3_zMainNav_CORE_V1_MegaMenuPlaceholder_p_lt_WebPartZone1_zC_CORE_V1_Three_Column_Layout_CORE_V1_Three_Column_Layout_3_CORE_V1_InPageLink4_btnElem_lblText">Operator Licensing</span></a>
<a id="p_lt_WebPartZone3_zMainNav_CORE_V1_MegaMenuPlaceholder_p_lt_WebPartZone1_zC_CORE_V1_Three_Column_Layout_CORE_V1_Three_Column_Layout_3_CORE_V1_InPageLink5_btnElem_hyperLink" href="/about-nrc/regulatory/research.html" target="_self"><span id="p_lt_WebPartZone3_zMainNav_CORE_V1_MegaMenuPlaceholder_p_lt_WebPartZone1_zC_CORE_V1_Three_Column_Layout_CORE_V1_Three_Column_Layout_3_CORE_V1_InPageLink5_btnElem_lblText">Research Activities</span></a>
</div></div></div><div class="container"><div class="row  inner-top-xs general-content  "><div class="col-md-12"><hr class="line dashed-line-brand-color-yellow"/><a id="p_lt_WebPartZone3_zMainNav_CORE_V1_MegaMenuPlaceholder_p_lt_WebPartZone1_zC_CORE_V1_Single_Column_Layout_CORE_V1_Single_Column_Layout_1_CORE_V1_InPageLink6_btnElem_hyperLink" class="quick-link" href="/reactors/ql-reactors.html" target="_self"><span id="p_lt_WebPartZone3_zMainNav_CORE_V1_MegaMenuPlaceholder_p_lt_WebPartZone1_zC_CORE_V1_Single_Column_Layout_CORE_V1_Single_Column_Layout_1_CORE_V1_InPageLink6_btnElem_lblText">Nuclear Reactor Quick Links</span></a>
</div></div></div></div>
</div> 
</li><li class="nav-item dropdown has-megamenu">
  <a class="nav-link dropdown-toggle" href="#" data-bs-toggle="dropdown" aria-expanded="false">Nuclear Materials</a>
  <div class="dropdown-menu megamenu">
    <div class="container">
      <div class="row">
        <div class="col-12">
          <h5><a href="/materials.html">Nuclear Materials</a></h5>
        </div>
      </div>
<div class="container"><div class="row inner-top-xs general-content  "><div class="mb-pd-btm col-sm-4"><a id="p_lt_WebPartZone3_zMainNav_CORE_V1_MegaMenuPlaceholder1_p_lt_WebPartZone1_zC_CORE_V1_Three_Column_Layout_CORE_V1_Three_Column_Layout_1_CORE_V1_InPageLink_btnElem_hyperLink" href="/materials/types.html" target="_self"><span id="p_lt_WebPartZone3_zMainNav_CORE_V1_MegaMenuPlaceholder1_p_lt_WebPartZone1_zC_CORE_V1_Three_Column_Layout_CORE_V1_Three_Column_Layout_1_CORE_V1_InPageLink_btnElem_lblText">Types of Nuclear Materials</span></a>
<a id="p_lt_WebPartZone3_zMainNav_CORE_V1_MegaMenuPlaceholder1_p_lt_WebPartZone1_zC_CORE_V1_Three_Column_Layout_CORE_V1_Three_Column_Layout_1_CORE_V1_InPageLink4_btnElem_hyperLink" href="/materials/fuel-cycle-fac.html" target="_self"><span id="p_lt_WebPartZone3_zMainNav_CORE_V1_MegaMenuPlaceholder1_p_lt_WebPartZone1_zC_CORE_V1_Three_Column_Layout_CORE_V1_Three_Column_Layout_1_CORE_V1_InPageLink4_btnElem_lblText">Fuel Cycle Facilities</span></a>
<a id="p_lt_WebPartZone3_zMainNav_CORE_V1_MegaMenuPlaceholder1_p_lt_WebPartZone1_zC_CORE_V1_Three_Column_Layout_CORE_V1_Three_Column_Layout_1_CORE_V1_InPageLink2_btnElem_hyperLink" href="/materials/medical.html" target="_self"><span id="p_lt_WebPartZone3_zMainNav_CORE_V1_MegaMenuPlaceholder1_p_lt_WebPartZone1_zC_CORE_V1_Three_Column_Layout_CORE_V1_Three_Column_Layout_1_CORE_V1_InPageLink2_btnElem_lblText">Medical, Industrial, &amp; Academic Uses</span></a>
</div><div class="mb-pd-btm col-sm-4"><a id="p_lt_WebPartZone3_zMainNav_CORE_V1_MegaMenuPlaceholder1_p_lt_WebPartZone1_zC_CORE_V1_Three_Column_Layout_CORE_V1_Three_Column_Layout_2_CORE_V1_InPageLink7_btnElem_hyperLink" href="/materials/uranium-recovery.html" target="_self"><span id="p_lt_WebPartZone3_zMainNav_CORE_V1_MegaMenuPlaceholder1_p_lt_WebPartZone1_zC_CORE_V1_Three_Column_Layout_CORE_V1_Three_Column_Layout_2_CORE_V1_InPageLink7_btnElem_lblText">Uranium Recovery</span></a>
<a id="p_lt_WebPartZone3_zMainNav_CORE_V1_MegaMenuPlaceholder1_p_lt_WebPartZone1_zC_CORE_V1_Three_Column_Layout_CORE_V1_Three_Column_Layout_2_CORE_V1_InPageLink5_btnElem_hyperLink" href="/materials/transportation.html" target="_self"><span id="p_lt_WebPartZone3_zMainNav_CORE_V1_MegaMenuPlaceholder1_p_lt_WebPartZone1_zC_CORE_V1_Three_Column_Layout_CORE_V1_Three_Column_Layout_2_CORE_V1_InPageLink5_btnElem_lblText">Materials Transportation</span></a>
</div><div class="mb-pd-btm col-sm-4"><a id="p_lt_WebPartZone3_zMainNav_CORE_V1_MegaMenuPlaceholder1_p_lt_WebPartZone1_zC_CORE_V1_Three_Column_Layout_CORE_V1_Three_Column_Layout_3_CORE_V1_InPageLink1_btnElem_hyperLink" href="/materials/active-nepa-reviews.html" target="_self"><span id="p_lt_WebPartZone3_zMainNav_CORE_V1_MegaMenuPlaceholder1_p_lt_WebPartZone1_zC_CORE_V1_Three_Column_Layout_CORE_V1_Three_Column_Layout_3_CORE_V1_InPageLink1_btnElem_lblText">Materials Environmental Reviews</span></a>
<a id="p_lt_WebPartZone3_zMainNav_CORE_V1_MegaMenuPlaceholder1_p_lt_WebPartZone1_zC_CORE_V1_Three_Column_Layout_CORE_V1_Three_Column_Layout_3_CORE_V1_InPageLink3_btnElem_hyperLink" href="/materials/nmp.html" target="_self"><span id="p_lt_WebPartZone3_zMainNav_CORE_V1_MegaMenuPlaceholder1_p_lt_WebPartZone1_zC_CORE_V1_Three_Column_Layout_CORE_V1_Three_Column_Layout_3_CORE_V1_InPageLink3_btnElem_lblText">National Materials Program</span></a>
</div></div></div><div class="container"><div class="row  inner-top-xs general-content  "><div class="col-md-12"><hr class="line dashed-line-brand-color-yellow"/><a id="p_lt_WebPartZone3_zMainNav_CORE_V1_MegaMenuPlaceholder1_p_lt_WebPartZone1_zC_CORE_V1_Single_Column_Layout_CORE_V1_Single_Column_Layout_1_CORE_V1_InPageLink9_btnElem_hyperLink" class="quick-link" href="/materials/ql-materials.html" target="_self"><span id="p_lt_WebPartZone3_zMainNav_CORE_V1_MegaMenuPlaceholder1_p_lt_WebPartZone1_zC_CORE_V1_Single_Column_Layout_CORE_V1_Single_Column_Layout_1_CORE_V1_InPageLink9_btnElem_lblText">Nuclear Materials Quick Links</span></a>
</div></div></div></div>
</div> 
</li><li class="nav-item dropdown has-megamenu">
  <a class="nav-link dropdown-toggle" href="#" data-bs-toggle="dropdown" aria-expanded="false">Radioactive Waste</a>
  <div class="dropdown-menu megamenu">
    <div class="container">
      <div class="row">
        <div class="col-12">
          <h5><a href="/waste.html">Radioactive Waste</a></h5>
        </div>
      </div>
<div class="container"><div class="row inner-top-xs general-content  "><div class="mb-pd-btm col-sm-4"><a id="p_lt_WebPartZone3_zMainNav_CORE_V1_MegaMenuPlaceholder2_p_lt_WebPartZone1_zC_CORE_V1_Three_Column_Layout_CORE_V1_Three_Column_Layout_1_CORE_V1_InPageLink_btnElem_hyperLink" href="/waste/decommissioning.html" target="_self"><span id="p_lt_WebPartZone3_zMainNav_CORE_V1_MegaMenuPlaceholder2_p_lt_WebPartZone1_zC_CORE_V1_Three_Column_Layout_CORE_V1_Three_Column_Layout_1_CORE_V1_InPageLink_btnElem_lblText">Decommissioning of Nuclear Facilities</span></a>
<a id="p_lt_WebPartZone3_zMainNav_CORE_V1_MegaMenuPlaceholder2_p_lt_WebPartZone1_zC_CORE_V1_Three_Column_Layout_CORE_V1_Three_Column_Layout_1_CORE_V1_InPageLink1_btnElem_hyperLink" href="/waste/low-level-waste.html" target="_self"><span id="p_lt_WebPartZone3_zMainNav_CORE_V1_MegaMenuPlaceholder2_p_lt_WebPartZone1_zC_CORE_V1_Three_Column_Layout_CORE_V1_Three_Column_Layout_1_CORE_V1_InPageLink1_btnElem_lblText">Low-Level Waste</span></a>
<a id="p_lt_WebPartZone3_zMainNav_CORE_V1_MegaMenuPlaceholder2_p_lt_WebPartZone1_zC_CORE_V1_Three_Column_Layout_CORE_V1_Three_Column_Layout_1_CORE_V1_InPageLink6_btnElem_hyperLink" href="/waste/incidental-waste.html" target="_self"><span id="p_lt_WebPartZone3_zMainNav_CORE_V1_MegaMenuPlaceholder2_p_lt_WebPartZone1_zC_CORE_V1_Three_Column_Layout_CORE_V1_Three_Column_Layout_1_CORE_V1_InPageLink6_btnElem_lblText">Waste Incidental to Reprocessing</span></a>
<a id="p_lt_WebPartZone3_zMainNav_CORE_V1_MegaMenuPlaceholder2_p_lt_WebPartZone1_zC_CORE_V1_Three_Column_Layout_CORE_V1_Three_Column_Layout_1_CORE_V1_InPageLink7_btnElem_hyperLink" href="/waste/high-level-waste.html" target="_self"><span id="p_lt_WebPartZone3_zMainNav_CORE_V1_MegaMenuPlaceholder2_p_lt_WebPartZone1_zC_CORE_V1_Three_Column_Layout_CORE_V1_Three_Column_Layout_1_CORE_V1_InPageLink7_btnElem_lblText">High-Level Waste</span></a>
</div><div class="mb-pd-btm col-sm-4"><a id="p_lt_WebPartZone3_zMainNav_CORE_V1_MegaMenuPlaceholder2_p_lt_WebPartZone1_zC_CORE_V1_Three_Column_Layout_CORE_V1_Three_Column_Layout_2_CORE_V1_InPageLink2_btnElem_hyperLink" href="/waste/mill-tailings.html" target="_self"><span id="p_lt_WebPartZone3_zMainNav_CORE_V1_MegaMenuPlaceholder2_p_lt_WebPartZone1_zC_CORE_V1_Three_Column_Layout_CORE_V1_Three_Column_Layout_2_CORE_V1_InPageLink2_btnElem_lblText">Uranium Mill Tailings</span></a>
<a id="p_lt_WebPartZone3_zMainNav_CORE_V1_MegaMenuPlaceholder2_p_lt_WebPartZone1_zC_CORE_V1_Three_Column_Layout_CORE_V1_Three_Column_Layout_2_CORE_V1_InPageLink3_btnElem_hyperLink" href="/waste/llw-disposal.html" target="_self"><span id="p_lt_WebPartZone3_zMainNav_CORE_V1_MegaMenuPlaceholder2_p_lt_WebPartZone1_zC_CORE_V1_Three_Column_Layout_CORE_V1_Three_Column_Layout_2_CORE_V1_InPageLink3_btnElem_lblText">Low-Level Waste Disposal</span></a>
<a id="p_lt_WebPartZone3_zMainNav_CORE_V1_MegaMenuPlaceholder2_p_lt_WebPartZone1_zC_CORE_V1_Three_Column_Layout_CORE_V1_Three_Column_Layout_2_CORE_V1_InPageLink9_btnElem_hyperLink" href="/waste/hlw-disposal.html" target="_self"><span id="p_lt_WebPartZone3_zMainNav_CORE_V1_MegaMenuPlaceholder2_p_lt_WebPartZone1_zC_CORE_V1_Three_Column_Layout_CORE_V1_Three_Column_Layout_2_CORE_V1_InPageLink9_btnElem_lblText">High-Level Waste Disposal</span></a>
</div><div class="mb-pd-btm col-sm-4"><a id="p_lt_WebPartZone3_zMainNav_CORE_V1_MegaMenuPlaceholder2_p_lt_WebPartZone1_zC_CORE_V1_Three_Column_Layout_CORE_V1_Three_Column_Layout_3_CORE_V1_InPageLink8_btnElem_hyperLink" href="/waste/spent-fuel-storage.html" target="_self"><span id="p_lt_WebPartZone3_zMainNav_CORE_V1_MegaMenuPlaceholder2_p_lt_WebPartZone1_zC_CORE_V1_Three_Column_Layout_CORE_V1_Three_Column_Layout_3_CORE_V1_InPageLink8_btnElem_lblText">Storage of Spent Nuclear Fuel</span></a>
<a id="p_lt_WebPartZone3_zMainNav_CORE_V1_MegaMenuPlaceholder2_p_lt_WebPartZone1_zC_CORE_V1_Three_Column_Layout_CORE_V1_Three_Column_Layout_3_CORE_V1_InPageLink4_btnElem_hyperLink" href="/waste/spent-fuel-transp.html" target="_self"><span id="p_lt_WebPartZone3_zMainNav_CORE_V1_MegaMenuPlaceholder2_p_lt_WebPartZone1_zC_CORE_V1_Three_Column_Layout_CORE_V1_Three_Column_Layout_3_CORE_V1_InPageLink4_btnElem_lblText">Transportation of Spent Nuclear Fuel</span></a>
<a id="p_lt_WebPartZone3_zMainNav_CORE_V1_MegaMenuPlaceholder2_p_lt_WebPartZone1_zC_CORE_V1_Three_Column_Layout_CORE_V1_Three_Column_Layout_3_CORE_V1_InPageLink5_btnElem_hyperLink" href="/about-nrc/regulatory/research.html" target="_self"><span id="p_lt_WebPartZone3_zMainNav_CORE_V1_MegaMenuPlaceholder2_p_lt_WebPartZone1_zC_CORE_V1_Three_Column_Layout_CORE_V1_Three_Column_Layout_3_CORE_V1_InPageLink5_btnElem_lblText">Research Activities</span></a>
</div></div></div><div class="container"><div class="row  inner-top-xs general-content  "><div class="col-md-12"><hr class="line dashed-line-brand-color-yellow"/><a id="p_lt_WebPartZone3_zMainNav_CORE_V1_MegaMenuPlaceholder2_p_lt_WebPartZone1_zC_CORE_V1_Single_Column_Layout_CORE_V1_Single_Column_Layout_1_CORE_V1_InPageLink10_btnElem_hyperLink" class="quick-link" href="/waste/ql-waste.html" target="_self"><span id="p_lt_WebPartZone3_zMainNav_CORE_V1_MegaMenuPlaceholder2_p_lt_WebPartZone1_zC_CORE_V1_Single_Column_Layout_CORE_V1_Single_Column_Layout_1_CORE_V1_InPageLink10_btnElem_lblText">Radioactive Waste Quick Links</span></a>
</div></div></div></div>
</div> 
</li><li class="nav-item dropdown has-megamenu">
  <a class="nav-link dropdown-toggle" href="#" data-bs-toggle="dropdown" aria-expanded="false">Nuclear Security</a>
  <div class="dropdown-menu megamenu">
    <div class="container">
      <div class="row">
        <div class="col-12">
          <h5><a href="/security.html">Nuclear Security</a></h5>
        </div>
      </div>
<div class="container"><div class="row inner-top-xs general-content  "><div class="mb-pd-btm col-sm-4"><a id="p_lt_WebPartZone3_zMainNav_CORE_V1_MegaMenuPlaceholder3_p_lt_WebPartZone1_zC_CORE_V1_Three_Column_Layout_CORE_V1_Three_Column_Layout_1_CORE_V1_InPageLink_btnElem_hyperLink" href="/security/domestic.html" target="_self"><span id="p_lt_WebPartZone3_zMainNav_CORE_V1_MegaMenuPlaceholder3_p_lt_WebPartZone1_zC_CORE_V1_Three_Column_Layout_CORE_V1_Three_Column_Layout_1_CORE_V1_InPageLink_btnElem_lblText">Domestic Safeguards</span></a>
<a id="p_lt_WebPartZone3_zMainNav_CORE_V1_MegaMenuPlaceholder3_p_lt_WebPartZone1_zC_CORE_V1_Three_Column_Layout_CORE_V1_Three_Column_Layout_1_CORE_V1_InPageLink1_btnElem_hyperLink" href="/security/info-security.html" target="_self"><span id="p_lt_WebPartZone3_zMainNav_CORE_V1_MegaMenuPlaceholder3_p_lt_WebPartZone1_zC_CORE_V1_Three_Column_Layout_CORE_V1_Three_Column_Layout_1_CORE_V1_InPageLink1_btnElem_lblText">Information Security</span></a>
<a id="p_lt_WebPartZone3_zMainNav_CORE_V1_MegaMenuPlaceholder3_p_lt_WebPartZone1_zC_CORE_V1_Three_Column_Layout_CORE_V1_Three_Column_Layout_1_CORE_V1_InPageLink6_btnElem_hyperLink" href="/security/byproduct.html" target="_self"><span id="p_lt_WebPartZone3_zMainNav_CORE_V1_MegaMenuPlaceholder3_p_lt_WebPartZone1_zC_CORE_V1_Three_Column_Layout_CORE_V1_Three_Column_Layout_1_CORE_V1_InPageLink6_btnElem_lblText">Radioactive Material Security</span></a>
</div><div class="mb-pd-btm col-sm-4"><a id="p_lt_WebPartZone3_zMainNav_CORE_V1_MegaMenuPlaceholder3_p_lt_WebPartZone1_zC_CORE_V1_Three_Column_Layout_CORE_V1_Three_Column_Layout_2_CORE_V1_InPageLink2_btnElem_hyperLink" href="/security/required-reporting-for-clearance-holders.html" target="_self"><span id="p_lt_WebPartZone3_zMainNav_CORE_V1_MegaMenuPlaceholder3_p_lt_WebPartZone1_zC_CORE_V1_Three_Column_Layout_CORE_V1_Three_Column_Layout_2_CORE_V1_InPageLink2_btnElem_lblText">Required Reporting for Clearance Holders</span></a>
<a id="p_lt_WebPartZone3_zMainNav_CORE_V1_MegaMenuPlaceholder3_p_lt_WebPartZone1_zC_CORE_V1_Three_Column_Layout_CORE_V1_Three_Column_Layout_2_CORE_V1_InPageLink3_btnElem_hyperLink" href="/security/insider-threat-program-for-licensees.html" target="_self"><span id="p_lt_WebPartZone3_zMainNav_CORE_V1_MegaMenuPlaceholder3_p_lt_WebPartZone1_zC_CORE_V1_Three_Column_Layout_CORE_V1_Three_Column_Layout_2_CORE_V1_InPageLink3_btnElem_lblText">Insider Threat Program for Licensees</span></a>
<a id="p_lt_WebPartZone3_zMainNav_CORE_V1_MegaMenuPlaceholder3_p_lt_WebPartZone1_zC_CORE_V1_Three_Column_Layout_CORE_V1_Three_Column_Layout_2_CORE_V1_InPageLink7_btnElem_hyperLink" href="/security/cybersecurity.html" target="_self"><span id="p_lt_WebPartZone3_zMainNav_CORE_V1_MegaMenuPlaceholder3_p_lt_WebPartZone1_zC_CORE_V1_Three_Column_Layout_CORE_V1_Three_Column_Layout_2_CORE_V1_InPageLink7_btnElem_lblText">Cybersecurity</span></a>
</div><div class="mb-pd-btm col-sm-4"><a id="p_lt_WebPartZone3_zMainNav_CORE_V1_MegaMenuPlaceholder3_p_lt_WebPartZone1_zC_CORE_V1_Three_Column_Layout_CORE_V1_Three_Column_Layout_3_CORE_V1_InPageLink4_btnElem_hyperLink" href="/security/chp.html" target="_self"><span id="p_lt_WebPartZone3_zMainNav_CORE_V1_MegaMenuPlaceholder3_p_lt_WebPartZone1_zC_CORE_V1_Three_Column_Layout_CORE_V1_Three_Column_Layout_3_CORE_V1_InPageLink4_btnElem_lblText">Criminal History &amp; Firearms Checks</span></a>
<a id="p_lt_WebPartZone3_zMainNav_CORE_V1_MegaMenuPlaceholder3_p_lt_WebPartZone1_zC_CORE_V1_Three_Column_Layout_CORE_V1_Three_Column_Layout_3_CORE_V1_InPageLink5_btnElem_hyperLink" href="/security/contactus.html" target="_self"><span id="p_lt_WebPartZone3_zMainNav_CORE_V1_MegaMenuPlaceholder3_p_lt_WebPartZone1_zC_CORE_V1_Three_Column_Layout_CORE_V1_Three_Column_Layout_3_CORE_V1_InPageLink5_btnElem_lblText">Contact Us</span></a>
</div></div></div></div>
</div> 
</li><li class="nav-item dropdown has-megamenu">
  <a class="nav-link dropdown-toggle" href="#" data-bs-toggle="dropdown" aria-expanded="false">Public Meetings & Involvement</a>
  <div class="dropdown-menu megamenu">
    <div class="container">
      <div class="row">
        <div class="col-12">
          <h5><a href="/public-involve.html">Public Meetings & Involvement</a></h5>
        </div>
      </div>
<div class="container"><div class="row inner-top-xs general-content  "><div class="mb-pd-btm col-sm-4"><a id="p_lt_WebPartZone3_zMainNav_CORE_V1_MegaMenuPlaceholder4_p_lt_WebPartZone1_zC_CORE_V1_Three_Column_Layout_CORE_V1_Three_Column_Layout_1_CORE_V1_InPageLink_btnElem_hyperLink" href="/public-involve/open.html" target="_self"><span id="p_lt_WebPartZone3_zMainNav_CORE_V1_MegaMenuPlaceholder4_p_lt_WebPartZone1_zC_CORE_V1_Three_Column_Layout_CORE_V1_Three_Column_Layout_1_CORE_V1_InPageLink_btnElem_lblText">The NRC Approach to Open Government</span></a>
<a id="p_lt_WebPartZone3_zMainNav_CORE_V1_MegaMenuPlaceholder4_p_lt_WebPartZone1_zC_CORE_V1_Three_Column_Layout_CORE_V1_Three_Column_Layout_1_CORE_V1_InPageLink1_btnElem_hyperLink" href="/public-involve/public-meetings.html" target="_self"><span id="p_lt_WebPartZone3_zMainNav_CORE_V1_MegaMenuPlaceholder4_p_lt_WebPartZone1_zC_CORE_V1_Three_Column_Layout_CORE_V1_Three_Column_Layout_1_CORE_V1_InPageLink1_btnElem_lblText">About Meetings Open to the Public</span></a>
<a id="p_lt_WebPartZone3_zMainNav_CORE_V1_MegaMenuPlaceholder4_p_lt_WebPartZone1_zC_CORE_V1_Three_Column_Layout_CORE_V1_Three_Column_Layout_1_CORE_V1_InPageLink6_btnElem_hyperLink" href="/public-involve/conferences.html" target="_self"><span id="p_lt_WebPartZone3_zMainNav_CORE_V1_MegaMenuPlaceholder4_p_lt_WebPartZone1_zC_CORE_V1_Three_Column_Layout_CORE_V1_Three_Column_Layout_1_CORE_V1_InPageLink6_btnElem_lblText">Conferences &amp; Symposia</span></a>
</div><div class="mb-pd-btm col-sm-4"><a id="p_lt_WebPartZone3_zMainNav_CORE_V1_MegaMenuPlaceholder4_p_lt_WebPartZone1_zC_CORE_V1_Three_Column_Layout_CORE_V1_Three_Column_Layout_2_CORE_V1_InPageLink7_btnElem_hyperLink" href="/public-involve/doc-comment.html" target="_self"><span id="p_lt_WebPartZone3_zMainNav_CORE_V1_MegaMenuPlaceholder4_p_lt_WebPartZone1_zC_CORE_V1_Three_Column_Layout_CORE_V1_Three_Column_Layout_2_CORE_V1_InPageLink7_btnElem_lblText">Documents for Comment</span></a>
<a id="p_lt_WebPartZone3_zMainNav_CORE_V1_MegaMenuPlaceholder4_p_lt_WebPartZone1_zC_CORE_V1_Three_Column_Layout_CORE_V1_Three_Column_Layout_2_CORE_V1_InPageLink8_btnElem_hyperLink" href="/public-involve/info-quality.html" target="_self"><span id="p_lt_WebPartZone3_zMainNav_CORE_V1_MegaMenuPlaceholder4_p_lt_WebPartZone1_zC_CORE_V1_Three_Column_Layout_CORE_V1_Three_Column_Layout_2_CORE_V1_InPageLink8_btnElem_lblText">NRC Information Quality Guidelines</span></a>
</div><div class="mb-pd-btm col-sm-4"><a id="p_lt_WebPartZone3_zMainNav_CORE_V1_MegaMenuPlaceholder4_p_lt_WebPartZone1_zC_CORE_V1_Three_Column_Layout_CORE_V1_Three_Column_Layout_3_CORE_V1_InPageLink9_btnElem_hyperLink" href="/public-involve/listserver.html" target="_self"><span id="p_lt_WebPartZone3_zMainNav_CORE_V1_MegaMenuPlaceholder4_p_lt_WebPartZone1_zC_CORE_V1_Three_Column_Layout_CORE_V1_Three_Column_Layout_3_CORE_V1_InPageLink9_btnElem_lblText">Subscribe to E-mail Updates</span></a>
<a id="p_lt_WebPartZone3_zMainNav_CORE_V1_MegaMenuPlaceholder4_p_lt_WebPartZone1_zC_CORE_V1_Three_Column_Layout_CORE_V1_Three_Column_Layout_3_CORE_V1_InPageLink3_btnElem_hyperLink" href="/public-involve/rss-feeds.html" target="_self"><span id="p_lt_WebPartZone3_zMainNav_CORE_V1_MegaMenuPlaceholder4_p_lt_WebPartZone1_zC_CORE_V1_Three_Column_Layout_CORE_V1_Three_Column_Layout_3_CORE_V1_InPageLink3_btnElem_lblText">Really Simple Syndication (RSS) Feeds</span></a>
</div></div></div><div class="container"><div class="row  inner-top-xs general-content  "><div class="col-md-12"><hr class="line dashed-line-brand-color-yellow"/></div></div></div><div class="container"><div class="row inner-top-xs general-content  "><div class="mb-pd-btm col-md-4"><a id="p_lt_WebPartZone3_zMainNav_CORE_V1_MegaMenuPlaceholder4_p_lt_WebPartZone1_zC_CORE_V1_Three_Column_Layout1_CORE_V1_Three_Column_Layout1_1_CORE_V1_InPageLink4_btnElem_hyperLink" class="quick-link" href="/public-involve/public-meetings/schedule.html" target="_self"><span id="p_lt_WebPartZone3_zMainNav_CORE_V1_MegaMenuPlaceholder4_p_lt_WebPartZone1_zC_CORE_V1_Three_Column_Layout1_CORE_V1_Three_Column_Layout1_1_CORE_V1_InPageLink4_btnElem_lblText">Commission Schedule</span></a>
<a id="p_lt_WebPartZone3_zMainNav_CORE_V1_MegaMenuPlaceholder4_p_lt_WebPartZone1_zC_CORE_V1_Three_Column_Layout1_CORE_V1_Three_Column_Layout1_1_CORE_V1_InPageLink5_btnElem_hyperLink" class="quick-link" href="/pmns/mtg" target="_self"><span id="p_lt_WebPartZone3_zMainNav_CORE_V1_MegaMenuPlaceholder4_p_lt_WebPartZone1_zC_CORE_V1_Three_Column_Layout1_CORE_V1_Three_Column_Layout1_1_CORE_V1_InPageLink5_btnElem_lblText">Public Meeting Schedule</span></a>
</div><div class="mb-pd-btm col-md-4"><a id="p_lt_WebPartZone3_zMainNav_CORE_V1_MegaMenuPlaceholder4_p_lt_WebPartZone1_zC_CORE_V1_Three_Column_Layout1_CORE_V1_Three_Column_Layout1_2_CORE_V1_InPageLink10_btnElem_hyperLink" class="quick-link" href="/about-nrc/regulatory/adjudicatory.html" target="_self"><span id="p_lt_WebPartZone3_zMainNav_CORE_V1_MegaMenuPlaceholder4_p_lt_WebPartZone1_zC_CORE_V1_Three_Column_Layout1_CORE_V1_Three_Column_Layout1_2_CORE_V1_InPageLink10_btnElem_lblText">Adjudications (Hearings)</span></a>
<a id="p_lt_WebPartZone3_zMainNav_CORE_V1_MegaMenuPlaceholder4_p_lt_WebPartZone1_zC_CORE_V1_Three_Column_Layout1_CORE_V1_Three_Column_Layout1_2_CORE_V1_InPageLink11_btnElem_hyperLink" class="quick-link" href="/site-help/e-submittals/adjudicatory-sub.html" target="_self"><span id="p_lt_WebPartZone3_zMainNav_CORE_V1_MegaMenuPlaceholder4_p_lt_WebPartZone1_zC_CORE_V1_Three_Column_Layout1_CORE_V1_Three_Column_Layout1_2_CORE_V1_InPageLink11_btnElem_lblText">Adjudicatory Submissions</span></a>
</div><div class="mb-pd-btm col-md-4"><a id="p_lt_WebPartZone3_zMainNav_CORE_V1_MegaMenuPlaceholder4_p_lt_WebPartZone1_zC_CORE_V1_Three_Column_Layout1_CORE_V1_Three_Column_Layout1_3_CORE_V1_InPageLink12_btnElem_hyperLink" class="quick-link" href="/about-nrc/regulatory/rulemaking/rules-petitions.html" target="_self"><span id="p_lt_WebPartZone3_zMainNav_CORE_V1_MegaMenuPlaceholder4_p_lt_WebPartZone1_zC_CORE_V1_Three_Column_Layout1_CORE_V1_Three_Column_Layout1_3_CORE_V1_InPageLink12_btnElem_lblText">NRC Rules and Petitions</span></a>
</div></div></div></div>
</div> 
</li><li class="nav-item dropdown has-megamenu">
  <a class="nav-link dropdown-toggle" href="#" data-bs-toggle="dropdown" aria-expanded="false">NRC Library</a>
  <div class="dropdown-menu megamenu">
    <div class="container">
      <div class="row">
        <div class="col-12">
          <h5><a href="/reading-rm.html">NRC Library</a></h5>
        </div>
      </div>
<div class="container"><div class="row inner-top-xs general-content  "><div class="mb-pd-btm col-sm-4"><a id="p_lt_WebPartZone3_zMainNav_CORE_V1_MegaMenuPlaceholder5_p_lt_WebPartZone1_zC_CORE_V1_Three_Column_Layout_CORE_V1_Three_Column_Layout_1_CORE_V1_InPageLink_btnElem_hyperLink" href="/reading-rm/basic-ref.html" target="_self"><span id="p_lt_WebPartZone3_zMainNav_CORE_V1_MegaMenuPlaceholder5_p_lt_WebPartZone1_zC_CORE_V1_Three_Column_Layout_CORE_V1_Three_Column_Layout_1_CORE_V1_InPageLink_btnElem_lblText">Basic References</span></a>
<a id="p_lt_WebPartZone3_zMainNav_CORE_V1_MegaMenuPlaceholder5_p_lt_WebPartZone1_zC_CORE_V1_Three_Column_Layout_CORE_V1_Three_Column_Layout_1_CORE_V1_InPageLink1_btnElem_hyperLink" href="/reading-rm/doc-collections/index.html" target="_self"><span id="p_lt_WebPartZone3_zMainNav_CORE_V1_MegaMenuPlaceholder5_p_lt_WebPartZone1_zC_CORE_V1_Three_Column_Layout_CORE_V1_Three_Column_Layout_1_CORE_V1_InPageLink1_btnElem_lblText">Document Collections</span></a>
<a id="p_lt_WebPartZone3_zMainNav_CORE_V1_MegaMenuPlaceholder5_p_lt_WebPartZone1_zC_CORE_V1_Three_Column_Layout_CORE_V1_Three_Column_Layout_1_CORE_V1_InPageLink6_btnElem_hyperLink" href="/reading-rm/adams.html" target="_self"><span id="p_lt_WebPartZone3_zMainNav_CORE_V1_MegaMenuPlaceholder5_p_lt_WebPartZone1_zC_CORE_V1_Three_Column_Layout_CORE_V1_Three_Column_Layout_1_CORE_V1_InPageLink6_btnElem_lblText">ADAMS Public Documents</span></a>
<a id="p_lt_WebPartZone3_zMainNav_CORE_V1_MegaMenuPlaceholder5_p_lt_WebPartZone1_zC_CORE_V1_Three_Column_Layout_CORE_V1_Three_Column_Layout_1_CORE_V1_InPageLink8_btnElem_hyperLink" href="/reading-rm/pdr.html" target="_self"><span id="p_lt_WebPartZone3_zMainNav_CORE_V1_MegaMenuPlaceholder5_p_lt_WebPartZone1_zC_CORE_V1_Three_Column_Layout_CORE_V1_Three_Column_Layout_1_CORE_V1_InPageLink8_btnElem_lblText">Public Document Room</span></a>
<a id="p_lt_WebPartZone3_zMainNav_CORE_V1_MegaMenuPlaceholder5_p_lt_WebPartZone1_zC_CORE_V1_Three_Column_Layout_CORE_V1_Three_Column_Layout_1_CORE_V1_InPageLink7_btnElem_hyperLink" href="/reading-rm/lsn/index.html" target="_self"><span id="p_lt_WebPartZone3_zMainNav_CORE_V1_MegaMenuPlaceholder5_p_lt_WebPartZone1_zC_CORE_V1_Three_Column_Layout_CORE_V1_Three_Column_Layout_1_CORE_V1_InPageLink7_btnElem_lblText">LSN Library</span></a>
</div><div class="mb-pd-btm col-sm-4"><a id="p_lt_WebPartZone3_zMainNav_CORE_V1_MegaMenuPlaceholder5_p_lt_WebPartZone1_zC_CORE_V1_Three_Column_Layout_CORE_V1_Three_Column_Layout_2_CORE_V1_InPageLink2_btnElem_hyperLink" href="/reading-rm/foia/foia-privacy.html" target="_self"><span id="p_lt_WebPartZone3_zMainNav_CORE_V1_MegaMenuPlaceholder5_p_lt_WebPartZone1_zC_CORE_V1_Three_Column_Layout_CORE_V1_Three_Column_Layout_2_CORE_V1_InPageLink2_btnElem_lblText">FOIA &amp; Privacy Act</span></a>
<a id="p_lt_WebPartZone3_zMainNav_CORE_V1_MegaMenuPlaceholder5_p_lt_WebPartZone1_zC_CORE_V1_Three_Column_Layout_CORE_V1_Three_Column_Layout_2_CORE_V1_InPageLink3_btnElem_hyperLink" href="/reading-rm/photo-gallery/index.html" target="_self"><span id="p_lt_WebPartZone3_zMainNav_CORE_V1_MegaMenuPlaceholder5_p_lt_WebPartZone1_zC_CORE_V1_Three_Column_Layout_CORE_V1_Three_Column_Layout_2_CORE_V1_InPageLink3_btnElem_lblText">Photos &amp; Videos</span></a>
<a id="p_lt_WebPartZone3_zMainNav_CORE_V1_MegaMenuPlaceholder5_p_lt_WebPartZone1_zC_CORE_V1_Three_Column_Layout_CORE_V1_Three_Column_Layout_2_CORE_V1_InPageLink9_btnElem_hyperLink" href="/reading-rm/records-mgmt.html" target="_self"><span id="p_lt_WebPartZone3_zMainNav_CORE_V1_MegaMenuPlaceholder5_p_lt_WebPartZone1_zC_CORE_V1_Three_Column_Layout_CORE_V1_Three_Column_Layout_2_CORE_V1_InPageLink9_btnElem_lblText">Records Management</span></a>
<a id="p_lt_WebPartZone3_zMainNav_CORE_V1_MegaMenuPlaceholder5_p_lt_WebPartZone1_zC_CORE_V1_Three_Column_Layout_CORE_V1_Three_Column_Layout_2_CORE_V1_InPageLink10_btnElem_hyperLink" href="/reading-rm/training.html" target="_self"><span id="p_lt_WebPartZone3_zMainNav_CORE_V1_MegaMenuPlaceholder5_p_lt_WebPartZone1_zC_CORE_V1_Three_Column_Layout_CORE_V1_Three_Column_Layout_2_CORE_V1_InPageLink10_btnElem_lblText">Training Courses</span></a>
</div><div class="mb-pd-btm col-sm-4"><a id="p_lt_WebPartZone3_zMainNav_CORE_V1_MegaMenuPlaceholder5_p_lt_WebPartZone1_zC_CORE_V1_Three_Column_Layout_CORE_V1_Three_Column_Layout_3_CORE_V1_InPageLink11_btnElem_hyperLink" href="/reading-rm/faqlist.html" target="_self"><span id="p_lt_WebPartZone3_zMainNav_CORE_V1_MegaMenuPlaceholder5_p_lt_WebPartZone1_zC_CORE_V1_Three_Column_Layout_CORE_V1_Three_Column_Layout_3_CORE_V1_InPageLink11_btnElem_lblText">FAQ Index</span></a>
<a id="p_lt_WebPartZone3_zMainNav_CORE_V1_MegaMenuPlaceholder5_p_lt_WebPartZone1_zC_CORE_V1_Three_Column_Layout_CORE_V1_Three_Column_Layout_3_CORE_V1_InPageLink4_btnElem_hyperLink" href="/reading-rm/copies-docs.html" target="_self"><span id="p_lt_WebPartZone3_zMainNav_CORE_V1_MegaMenuPlaceholder5_p_lt_WebPartZone1_zC_CORE_V1_Three_Column_Layout_CORE_V1_Three_Column_Layout_3_CORE_V1_InPageLink4_btnElem_lblText">Get Copies of Documents</span></a>
<a id="p_lt_WebPartZone3_zMainNav_CORE_V1_MegaMenuPlaceholder5_p_lt_WebPartZone1_zC_CORE_V1_Three_Column_Layout_CORE_V1_Three_Column_Layout_3_CORE_V1_InPageLink5_btnElem_hyperLink" href="/reading-rm/sensitive-info.html" target="_self"><span id="p_lt_WebPartZone3_zMainNav_CORE_V1_MegaMenuPlaceholder5_p_lt_WebPartZone1_zC_CORE_V1_Three_Column_Layout_CORE_V1_Three_Column_Layout_3_CORE_V1_InPageLink5_btnElem_lblText">Withholding of Sensitive Information</span></a>
<a id="p_lt_WebPartZone3_zMainNav_CORE_V1_MegaMenuPlaceholder5_p_lt_WebPartZone1_zC_CORE_V1_Three_Column_Layout_CORE_V1_Three_Column_Layout_3_CORE_V1_InPageLink12_btnElem_hyperLink" href="/reading-rm/cui.html" target="_self"><span id="p_lt_WebPartZone3_zMainNav_CORE_V1_MegaMenuPlaceholder5_p_lt_WebPartZone1_zC_CORE_V1_Three_Column_Layout_CORE_V1_Three_Column_Layout_3_CORE_V1_InPageLink12_btnElem_lblText">Controlled Unclassified Information Program (CUI)</span></a>
</div></div></div><div class="container"><div class="row  inner-top-xs general-content  "><div class="col-md-12"><hr class="line dashed-line-brand-color-yellow"/><a id="p_lt_WebPartZone3_zMainNav_CORE_V1_MegaMenuPlaceholder5_p_lt_WebPartZone1_zC_CORE_V1_Single_Column_Layout_CORE_V1_Single_Column_Layout_1_CORE_V1_InPageLink13_btnElem_hyperLink" class="quick-link" href="/about-nrc/regulatory/adjudicatory.html#ehd" target="_self"><span id="p_lt_WebPartZone3_zMainNav_CORE_V1_MegaMenuPlaceholder5_p_lt_WebPartZone1_zC_CORE_V1_Single_Column_Layout_CORE_V1_Single_Column_Layout_1_CORE_V1_InPageLink13_btnElem_lblText">Electronic Hearing Docket</span></a>
</div></div></div></div>
</div> 
</li><li class="nav-item dropdown has-megamenu">
  <a class="nav-link dropdown-toggle" href="#" data-bs-toggle="dropdown" aria-expanded="false">About NRC</a>
  <div class="dropdown-menu megamenu">
    <div class="container">
      <div class="row">
        <div class="col-12">
          <h5><a href="/about-nrc.html">About NRC</a></h5>
        </div>
      </div>
<div class="container"><div class="row inner-top-xs general-content  "><div class="mb-pd-btm col-sm-4"><a id="p_lt_WebPartZone3_zMainNav_CORE_V1_MegaMenuPlaceholder6_p_lt_WebPartZone1_zC_CORE_V1_Three_Column_Layout_CORE_V1_Three_Column_Layout_1_CORE_V1_InPageLink_btnElem_hyperLink" href="/about-nrc/organization/commfuncdesc.html" target="_self"><span id="p_lt_WebPartZone3_zMainNav_CORE_V1_MegaMenuPlaceholder6_p_lt_WebPartZone1_zC_CORE_V1_Three_Column_Layout_CORE_V1_Three_Column_Layout_1_CORE_V1_InPageLink_btnElem_lblText">The Commission</span></a>
<a id="p_lt_WebPartZone3_zMainNav_CORE_V1_MegaMenuPlaceholder6_p_lt_WebPartZone1_zC_CORE_V1_Three_Column_Layout_CORE_V1_Three_Column_Layout_1_CORE_V1_InPageLink1_btnElem_hyperLink" href="/about-nrc/organization.html" target="_self"><span id="p_lt_WebPartZone3_zMainNav_CORE_V1_MegaMenuPlaceholder6_p_lt_WebPartZone1_zC_CORE_V1_Three_Column_Layout_CORE_V1_Three_Column_Layout_1_CORE_V1_InPageLink1_btnElem_lblText">Organization &amp; Functions</span></a>
<a id="p_lt_WebPartZone3_zMainNav_CORE_V1_MegaMenuPlaceholder6_p_lt_WebPartZone1_zC_CORE_V1_Three_Column_Layout_CORE_V1_Three_Column_Layout_1_CORE_V1_InPageLink6_btnElem_hyperLink" href="/ai.html" target="_self"><span id="p_lt_WebPartZone3_zMainNav_CORE_V1_MegaMenuPlaceholder6_p_lt_WebPartZone1_zC_CORE_V1_Three_Column_Layout_CORE_V1_Three_Column_Layout_1_CORE_V1_InPageLink6_btnElem_lblText">Artificial Intelligence</span></a>
<a id="p_lt_WebPartZone3_zMainNav_CORE_V1_MegaMenuPlaceholder6_p_lt_WebPartZone1_zC_CORE_V1_Three_Column_Layout_CORE_V1_Three_Column_Layout_1_CORE_V1_InPageLink4_btnElem_hyperLink" href="/about-nrc/governing-laws.html" target="_self"><span id="p_lt_WebPartZone3_zMainNav_CORE_V1_MegaMenuPlaceholder6_p_lt_WebPartZone1_zC_CORE_V1_Three_Column_Layout_CORE_V1_Three_Column_Layout_1_CORE_V1_InPageLink4_btnElem_lblText">Governing Legislation</span></a>
<a id="p_lt_WebPartZone3_zMainNav_CORE_V1_MegaMenuPlaceholder6_p_lt_WebPartZone1_zC_CORE_V1_Three_Column_Layout_CORE_V1_Three_Column_Layout_1_CORE_V1_InPageLink7_btnElem_hyperLink" href="/about-nrc/plans-performance.html" target="_self"><span id="p_lt_WebPartZone3_zMainNav_CORE_V1_MegaMenuPlaceholder6_p_lt_WebPartZone1_zC_CORE_V1_Three_Column_Layout_CORE_V1_Three_Column_Layout_1_CORE_V1_InPageLink7_btnElem_lblText">Plans, Budget, &amp; Performance</span></a>
<a id="p_lt_WebPartZone3_zMainNav_CORE_V1_MegaMenuPlaceholder6_p_lt_WebPartZone1_zC_CORE_V1_Three_Column_Layout_CORE_V1_Three_Column_Layout_1_CORE_V1_InPageLink8_btnElem_hyperLink" href="/about-nrc/locations.html" target="_self"><span id="p_lt_WebPartZone3_zMainNav_CORE_V1_MegaMenuPlaceholder6_p_lt_WebPartZone1_zC_CORE_V1_Three_Column_Layout_CORE_V1_Three_Column_Layout_1_CORE_V1_InPageLink8_btnElem_lblText">Locations</span></a>
<a id="p_lt_WebPartZone3_zMainNav_CORE_V1_MegaMenuPlaceholder6_p_lt_WebPartZone1_zC_CORE_V1_Three_Column_Layout_CORE_V1_Three_Column_Layout_1_CORE_V1_InPageLink9_btnElem_hyperLink" href="/about-nrc/history.html" target="_self"><span id="p_lt_WebPartZone3_zMainNav_CORE_V1_MegaMenuPlaceholder6_p_lt_WebPartZone1_zC_CORE_V1_Three_Column_Layout_CORE_V1_Three_Column_Layout_1_CORE_V1_InPageLink9_btnElem_lblText">History</span></a>
<a id="p_lt_WebPartZone3_zMainNav_CORE_V1_MegaMenuPlaceholder6_p_lt_WebPartZone1_zC_CORE_V1_Three_Column_Layout_CORE_V1_Three_Column_Layout_1_CORE_V1_InPageLink10_btnElem_hyperLink" href="/about-nrc/values.html" target="_self"><span id="p_lt_WebPartZone3_zMainNav_CORE_V1_MegaMenuPlaceholder6_p_lt_WebPartZone1_zC_CORE_V1_Three_Column_Layout_CORE_V1_Three_Column_Layout_1_CORE_V1_InPageLink10_btnElem_lblText">Values</span></a>
<a id="p_lt_WebPartZone3_zMainNav_CORE_V1_MegaMenuPlaceholder6_p_lt_WebPartZone1_zC_CORE_V1_Three_Column_Layout_CORE_V1_Three_Column_Layout_1_CORE_V1_InPageLink2_btnElem_hyperLink" href="/about-nrc/policymaking.html" target="_self"><span id="p_lt_WebPartZone3_zMainNav_CORE_V1_MegaMenuPlaceholder6_p_lt_WebPartZone1_zC_CORE_V1_Three_Column_Layout_CORE_V1_Three_Column_Layout_1_CORE_V1_InPageLink2_btnElem_lblText">Direction-Setting &amp; Policymaking</span></a>
<a id="p_lt_WebPartZone3_zMainNav_CORE_V1_MegaMenuPlaceholder6_p_lt_WebPartZone1_zC_CORE_V1_Three_Column_Layout_CORE_V1_Three_Column_Layout_1_CORE_V1_InPageLink3_btnElem_hyperLink" href="/about-nrc/regulatory/research.html" target="_self"><span id="p_lt_WebPartZone3_zMainNav_CORE_V1_MegaMenuPlaceholder6_p_lt_WebPartZone1_zC_CORE_V1_Three_Column_Layout_CORE_V1_Three_Column_Layout_1_CORE_V1_InPageLink3_btnElem_lblText">Research Activities</span></a>
</div><div class="mb-pd-btm col-sm-4"><a id="p_lt_WebPartZone3_zMainNav_CORE_V1_MegaMenuPlaceholder6_p_lt_WebPartZone1_zC_CORE_V1_Three_Column_Layout_CORE_V1_Three_Column_Layout_2_CORE_V1_InPageLink11_btnElem_hyperLink" href="/about-nrc/radiation.html" target="_self"><span id="p_lt_WebPartZone3_zMainNav_CORE_V1_MegaMenuPlaceholder6_p_lt_WebPartZone1_zC_CORE_V1_Three_Column_Layout_CORE_V1_Three_Column_Layout_2_CORE_V1_InPageLink11_btnElem_lblText">Radiation Protection</span></a>
<a id="p_lt_WebPartZone3_zMainNav_CORE_V1_MegaMenuPlaceholder6_p_lt_WebPartZone1_zC_CORE_V1_Three_Column_Layout_CORE_V1_Three_Column_Layout_2_CORE_V1_InPageLink12_btnElem_hyperLink" href="/about-nrc/fire-protection.html" target="_self"><span id="p_lt_WebPartZone3_zMainNav_CORE_V1_MegaMenuPlaceholder6_p_lt_WebPartZone1_zC_CORE_V1_Three_Column_Layout_CORE_V1_Three_Column_Layout_2_CORE_V1_InPageLink12_btnElem_lblText">Fire Protection</span></a>
<a id="p_lt_WebPartZone3_zMainNav_CORE_V1_MegaMenuPlaceholder6_p_lt_WebPartZone1_zC_CORE_V1_Three_Column_Layout_CORE_V1_Three_Column_Layout_2_CORE_V1_InPageLink13_btnElem_hyperLink" href="/about-nrc/safety-culture.html" target="_self"><span id="p_lt_WebPartZone3_zMainNav_CORE_V1_MegaMenuPlaceholder6_p_lt_WebPartZone1_zC_CORE_V1_Three_Column_Layout_CORE_V1_Three_Column_Layout_2_CORE_V1_InPageLink13_btnElem_lblText">Safety Culture</span></a>
<a id="p_lt_WebPartZone3_zMainNav_CORE_V1_MegaMenuPlaceholder6_p_lt_WebPartZone1_zC_CORE_V1_Three_Column_Layout_CORE_V1_Three_Column_Layout_2_CORE_V1_InPageLink14_btnElem_hyperLink" href="/about-nrc/regulatory.html" target="_self"><span id="p_lt_WebPartZone3_zMainNav_CORE_V1_MegaMenuPlaceholder6_p_lt_WebPartZone1_zC_CORE_V1_Three_Column_Layout_CORE_V1_Three_Column_Layout_2_CORE_V1_InPageLink14_btnElem_lblText">How We Regulate</span></a>
<a id="p_lt_WebPartZone3_zMainNav_CORE_V1_MegaMenuPlaceholder6_p_lt_WebPartZone1_zC_CORE_V1_Three_Column_Layout_CORE_V1_Three_Column_Layout_2_CORE_V1_InPageLink15_btnElem_hyperLink" href="/about-nrc/emerg-preparedness.html" target="_self"><span id="p_lt_WebPartZone3_zMainNav_CORE_V1_MegaMenuPlaceholder6_p_lt_WebPartZone1_zC_CORE_V1_Three_Column_Layout_CORE_V1_Three_Column_Layout_2_CORE_V1_InPageLink15_btnElem_lblText">Emergency Preparedness &amp; Response</span></a>
<a id="p_lt_WebPartZone3_zMainNav_CORE_V1_MegaMenuPlaceholder6_p_lt_WebPartZone1_zC_CORE_V1_Three_Column_Layout_CORE_V1_Three_Column_Layout_2_CORE_V1_InPageLink5_btnElem_hyperLink" href="/about-nrc/congress-affairs.html" target="_self"><span id="p_lt_WebPartZone3_zMainNav_CORE_V1_MegaMenuPlaceholder6_p_lt_WebPartZone1_zC_CORE_V1_Three_Column_Layout_CORE_V1_Three_Column_Layout_2_CORE_V1_InPageLink5_btnElem_lblText">Congressional Affairs</span></a>
<a id="p_lt_WebPartZone3_zMainNav_CORE_V1_MegaMenuPlaceholder6_p_lt_WebPartZone1_zC_CORE_V1_Three_Column_Layout_CORE_V1_Three_Column_Layout_2_CORE_V1_InPageLink16_btnElem_hyperLink" href="/about-nrc/regulatory/enforcement.html" target="_self"><span id="p_lt_WebPartZone3_zMainNav_CORE_V1_MegaMenuPlaceholder6_p_lt_WebPartZone1_zC_CORE_V1_Three_Column_Layout_CORE_V1_Three_Column_Layout_2_CORE_V1_InPageLink16_btnElem_lblText">Enforcement</span></a>
<a id="p_lt_WebPartZone3_zMainNav_CORE_V1_MegaMenuPlaceholder6_p_lt_WebPartZone1_zC_CORE_V1_Three_Column_Layout_CORE_V1_Three_Column_Layout_2_CORE_V1_InPageLink17_btnElem_hyperLink" href="/about-nrc/international.html" target="_self"><span id="p_lt_WebPartZone3_zMainNav_CORE_V1_MegaMenuPlaceholder6_p_lt_WebPartZone1_zC_CORE_V1_Three_Column_Layout_CORE_V1_Three_Column_Layout_2_CORE_V1_InPageLink17_btnElem_lblText">International Programs</span></a>
<a id="p_lt_WebPartZone3_zMainNav_CORE_V1_MegaMenuPlaceholder6_p_lt_WebPartZone1_zC_CORE_V1_Three_Column_Layout_CORE_V1_Three_Column_Layout_2_CORE_V1_InPageLink18_btnElem_hyperLink" href="/about-nrc/state-tribal.html" target="_self"><span id="p_lt_WebPartZone3_zMainNav_CORE_V1_MegaMenuPlaceholder6_p_lt_WebPartZone1_zC_CORE_V1_Three_Column_Layout_CORE_V1_Three_Column_Layout_2_CORE_V1_InPageLink18_btnElem_lblText">State &amp; Tribal Programs</span></a>
</div><div class="mb-pd-btm col-sm-4"><a id="p_lt_WebPartZone3_zMainNav_CORE_V1_MegaMenuPlaceholder6_p_lt_WebPartZone1_zC_CORE_V1_Three_Column_Layout_CORE_V1_Three_Column_Layout_3_CORE_V1_InPageLink19_btnElem_hyperLink" href="/about-nrc/alt-dispute-resolution.html" target="_self"><span id="p_lt_WebPartZone3_zMainNav_CORE_V1_MegaMenuPlaceholder6_p_lt_WebPartZone1_zC_CORE_V1_Three_Column_Layout_CORE_V1_Three_Column_Layout_3_CORE_V1_InPageLink19_btnElem_lblText">Alternative Dispute Resolution Programs</span></a>
<a id="p_lt_WebPartZone3_zMainNav_CORE_V1_MegaMenuPlaceholder6_p_lt_WebPartZone1_zC_CORE_V1_Three_Column_Layout_CORE_V1_Three_Column_Layout_3_CORE_V1_InPageLink20_btnElem_hyperLink" href="/privacy/index.html" target="_self"><span id="p_lt_WebPartZone3_zMainNav_CORE_V1_MegaMenuPlaceholder6_p_lt_WebPartZone1_zC_CORE_V1_Three_Column_Layout_CORE_V1_Three_Column_Layout_3_CORE_V1_InPageLink20_btnElem_lblText">Privacy Program</span></a>
<a id="p_lt_WebPartZone3_zMainNav_CORE_V1_MegaMenuPlaceholder6_p_lt_WebPartZone1_zC_CORE_V1_Three_Column_Layout_CORE_V1_Three_Column_Layout_3_CORE_V1_InPageLink21_btnElem_hyperLink" href="/about-nrc/civil-rights.html" target="_self"><span id="p_lt_WebPartZone3_zMainNav_CORE_V1_MegaMenuPlaceholder6_p_lt_WebPartZone1_zC_CORE_V1_Three_Column_Layout_CORE_V1_Three_Column_Layout_3_CORE_V1_InPageLink21_btnElem_lblText">Civil Rights Program</span></a>
<a id="p_lt_WebPartZone3_zMainNav_CORE_V1_MegaMenuPlaceholder6_p_lt_WebPartZone1_zC_CORE_V1_Three_Column_Layout_CORE_V1_Three_Column_Layout_3_CORE_V1_InPageLink22_btnElem_hyperLink" href="/about-nrc/contactus.html" target="_self"><span id="p_lt_WebPartZone3_zMainNav_CORE_V1_MegaMenuPlaceholder6_p_lt_WebPartZone1_zC_CORE_V1_Three_Column_Layout_CORE_V1_Three_Column_Layout_3_CORE_V1_InPageLink22_btnElem_lblText">Contact Us</span></a>
<a id="p_lt_WebPartZone3_zMainNav_CORE_V1_MegaMenuPlaceholder6_p_lt_WebPartZone1_zC_CORE_V1_Three_Column_Layout_CORE_V1_Three_Column_Layout_3_CORE_V1_InPageLink23_btnElem_hyperLink" href="/about-nrc/employment.html" target="_self"><span id="p_lt_WebPartZone3_zMainNav_CORE_V1_MegaMenuPlaceholder6_p_lt_WebPartZone1_zC_CORE_V1_Three_Column_Layout_CORE_V1_Three_Column_Layout_3_CORE_V1_InPageLink23_btnElem_lblText">Career Opportunities</span></a>
<a id="p_lt_WebPartZone3_zMainNav_CORE_V1_MegaMenuPlaceholder6_p_lt_WebPartZone1_zC_CORE_V1_Three_Column_Layout_CORE_V1_Three_Column_Layout_3_CORE_V1_InPageLink24_btnElem_hyperLink" href="/about-nrc/contracting.html" target="_self"><span id="p_lt_WebPartZone3_zMainNav_CORE_V1_MegaMenuPlaceholder6_p_lt_WebPartZone1_zC_CORE_V1_Three_Column_Layout_CORE_V1_Three_Column_Layout_3_CORE_V1_InPageLink24_btnElem_lblText">Contracting Opportunities</span></a>
<a id="p_lt_WebPartZone3_zMainNav_CORE_V1_MegaMenuPlaceholder6_p_lt_WebPartZone1_zC_CORE_V1_Three_Column_Layout_CORE_V1_Three_Column_Layout_3_CORE_V1_InPageLink25_btnElem_hyperLink" href="/about-nrc/contracting/small-business.html" target="_self"><span id="p_lt_WebPartZone3_zMainNav_CORE_V1_MegaMenuPlaceholder6_p_lt_WebPartZone1_zC_CORE_V1_Three_Column_Layout_CORE_V1_Three_Column_Layout_3_CORE_V1_InPageLink25_btnElem_lblText">Small Businesses</span></a>
<a id="p_lt_WebPartZone3_zMainNav_CORE_V1_MegaMenuPlaceholder6_p_lt_WebPartZone1_zC_CORE_V1_Three_Column_Layout_CORE_V1_Three_Column_Layout_3_CORE_V1_InPageLink26_btnElem_hyperLink" href="/about-nrc/grants.html" target="_self"><span id="p_lt_WebPartZone3_zMainNav_CORE_V1_MegaMenuPlaceholder6_p_lt_WebPartZone1_zC_CORE_V1_Three_Column_Layout_CORE_V1_Three_Column_Layout_3_CORE_V1_InPageLink26_btnElem_lblText">Grant Opportunities</span></a>
<a id="p_lt_WebPartZone3_zMainNav_CORE_V1_MegaMenuPlaceholder6_p_lt_WebPartZone1_zC_CORE_V1_Three_Column_Layout_CORE_V1_Three_Column_Layout_3_CORE_V1_InPageLink27_btnElem_hyperLink" href="/about-nrc/generic-schedules.html" target="_self"><span id="p_lt_WebPartZone3_zMainNav_CORE_V1_MegaMenuPlaceholder6_p_lt_WebPartZone1_zC_CORE_V1_Three_Column_Layout_CORE_V1_Three_Column_Layout_3_CORE_V1_InPageLink27_btnElem_lblText">Generic Schedules</span></a>
</div></div></div></div>
</div> 
</li>
    </ul>
  </div>
</nav>

<main>
  <p style="margin:15px;"><em>The U.S. Nuclear Regulatory Commission is in the process of rescinding or revising guidance and policies posted on this webpage in accordance with Executive Order 14151 
    <a href="https://www.federalregister.gov/documents/2025/01/29/2025-01953/ending-radical-and-wasteful-government-dei-programs-and-preferencing">Ending Radical and Wasteful Government DEI Programs and Preferencing</a>, and Executive Order 14168 <a href="https://www.federalregister.gov/documents/2025/01/30/2025-02090/defending-women-from-gender-ideology-extremism-and-restoring-biological-truth-to-the-federal">Defending Women From Gender Ideology Extremism and Restoring Biological Truth 
    to the Federal Government</a>. In the interim, any previously issued diversity, equity, inclusion, or gender-related guidance on this webpage should be considered rescinded that 
    is inconsistent with these Executive Orders.</em></p>
  
<section id="hero" class="content-width-hero-slider primary-background height-sm">
  <div class="container">
    <div id="owl-main" class="owl-carousel height-sm owl-inner-nav owl-ui-lg">
<div class="item heroBackground-59 img-bg img-bg-soft">
  <span role='img' aria-label='the words: &#39;Protecting People and the Environment&#39; on a light blue background, over a silhouette image of a city park with trees, a park bench and people walking, shown participating in activities, i.e., a person walking a dog, a family - parents and child walking together, a person reading book sitting nearby tree and a person feeding birds; the trees in the foreground are dark silhouettes, and the trees in the background are green silhouettes'></span>
  <style type="text/css">
    .heroBackground-59 {
      background: url(/cdn/opa-homepage-images/seasonal/q1-mobile.png);
      background-repeat: no-repeat !important;
    }
    
    @media only screen and (min-width: 62.5em) {
      .heroBackground-59 {
        background: url(/cdn/opa-homepage-images/seasonal/q1-hero.png);
      }
    }
  </style>
  <div class="container">
    <div class="caption vertical-center text-center">
      <h1 class="fadeInDown-1 white"></h1>
      
      <p class="fadeInDown-2 white"><div style="background-color: rgba(238, 238, 238, 0.75); position: absolute; bottom: 1em; left: 0px; padding: 6px 20px 6px 20px; width: 100%;text-align:center;"><!-- <p style="color:#425E71!important;font-weight:bold; font-size:1.6em; line-height:1.1;">NRC MISSION:</p> -->
<p style="color:#333!important;font-size:2em;font-weight:bold;"><u><em>UPDATED</em></u> NRC MISSION</p>
</div>
</p>
      
      <div class="fadeInDown-3">
        <a href='/about-nrc.html#142873' class='btn btn-medium primary-background'>Learn More</a>
      </div>
    </div>
  </div>
</div>
<div class="item heroBackground-402 img-bg img-bg-soft">
  <span role='img' aria-label='NRC Commissioner Christopher Hanson and NRC staff member get a briefing in the HQ Operations Center during Cobalt Magnet 2025, and interagency radiological exercise based on a simulated accident at a fictional nuclear power plant.'></span>
  <style type="text/css">
    .heroBackground-402 {
      background: url(/cdn/opa-homepage-images/2025-homepage/homepage-03182025-mobile.jpg);
      background-repeat: no-repeat !important;
    }
    
    @media only screen and (min-width: 62.5em) {
      .heroBackground-402 {
        background: url(/cdn/opa-homepage-images/2025-homepage/homepage-03182025.jpg);
      }
    }
  </style>
  <div class="container">
    <div class="caption vertical-center text-center">
      <h1 class="fadeInDown-1 black"></h1>
      
      <div class="fadeInDown-3">
        <a href='/homepage/features.html#150590' class='btn btn-medium primary-background'>Learn More</a>
      </div>
    </div>
  </div>
</div>
<div class="item heroBackground-382 img-bg img-bg-soft">
  <span role='img' aria-label='NRC staff who volunteered throughout the 2025 Regulatory Information Conference pause from their activities for a photo. The hybrid conference featured three days of presentations, plenary sessions and discussions among some 3,300 registrants. The 2026 conference is slated for March 10-12.'></span>
  <style type="text/css">
    .heroBackground-382 {
      background: url(/cdn/opa-homepage-images/2025-homepage/homepage-03132025-mobile.jpg);
      background-repeat: no-repeat !important;
    }
    
    @media only screen and (min-width: 62.5em) {
      .heroBackground-382 {
        background: url(/cdn/opa-homepage-images/2025-homepage/homepage-03142025.jpg);
      }
    }
  </style>
  <div class="container">
    <div class="caption vertical-center text-center">
      <h1 class="fadeInDown-1 black"></h1>
      
      <div class="fadeInDown-3">
        <a href='/homepage/features.html#149694' class='btn btn-medium primary-background'>Learn More</a>
      </div>
    </div>
  </div>
</div>
<div class="item heroBackground-356 img-bg img-bg-soft">
  <span role='img' aria-label='An audience of NRC staff and stakeholders listen as a panel discusses aspects of restarting decommissioning nuclear power plants during the NRCs Regulatory Information Conference.'></span>
  <style type="text/css">
    .heroBackground-356 {
      background: url(/cdn/opa-homepage-images/2025-homepage/homepage-03122025-mobile.jpg);
      background-repeat: no-repeat !important;
    }
    
    @media only screen and (min-width: 62.5em) {
      .heroBackground-356 {
        background: url(/cdn/opa-homepage-images/2025-homepage/homepage-03122025.jpg);
      }
    }
  </style>
  <div class="container">
    <div class="caption vertical-center text-center">
      <h1 class="fadeInDown-1 black"></h1>
      
      <div class="fadeInDown-3">
        <a href='/homepage/features.html#148412' class='btn btn-medium primary-background'>Learn More</a>
      </div>
    </div>
  </div>
</div>
<div class="item heroBackground-347 img-bg img-bg-soft">
  <span role='img' aria-label='NRC Chairman David Wright shares a light moment with U.S. Sen. Shelley Moore Capito during the Q&amp;A portion of her special plenary session at the 37th annual Regulatory Information Conference.'></span>
  <style type="text/css">
    .heroBackground-347 {
      background: url(/cdn/opa-homepage-images/2025-homepage/homepage-03112025a-mobile.jpg);
      background-repeat: no-repeat !important;
    }
    
    @media only screen and (min-width: 62.5em) {
      .heroBackground-347 {
        background: url(/cdn/opa-homepage-images/2025-homepage/homepage-03112025a.jpg);
      }
    }
  </style>
  <div class="container">
    <div class="caption vertical-center text-center">
      <h1 class="fadeInDown-1 black"></h1>
      
      <div class="fadeInDown-3">
        <a href='/homepage/features.html#148293' class='btn btn-medium primary-background'>Learn More</a>
      </div>
    </div>
  </div>
</div>
<div class="item heroBackground-393 img-bg img-bg-soft">
  <span role='img' aria-label='NRC Chairman David Wright shares a light moment with U.S. Sen. Shelley Moore Capito during the Q&amp;A portion of her special plenary session at the 37th annual Regulatory Information Conference.'></span>
  <style type="text/css">
    .heroBackground-393 {
      background: url(/cdn/opa-homepage-images/2025-homepage/homepage-03112025b-mobile.jpg);
      background-repeat: no-repeat !important;
    }
    
    @media only screen and (min-width: 62.5em) {
      .heroBackground-393 {
        background: url(/cdn/opa-homepage-images/2025-homepage/homepage-03112025b.jpg);
      }
    }
  </style>
  <div class="container">
    <div class="caption vertical-center text-center">
      <h1 class="fadeInDown-1 black"></h1>
      
      <div class="fadeInDown-3">
        <a href='/homepage/features.html#150159' class='btn btn-medium primary-background'>Learn More</a>
      </div>
    </div>
  </div>
</div>
<div class="item heroBackground-387 img-bg img-bg-soft">
  <span role='img' aria-label='NRC Commissioner Annie Caputo, center left, stands with panelists, including NRC staff and industry officials, who explored the topic Elevating NRC Safety and Efficiency Through Risk-Informed Decision-Making during a technical session she chaired at the NRCs Regulatory Information Conference. '></span>
  <style type="text/css">
    .heroBackground-387 {
      background: url(/cdn/opa-homepage-images/2025-homepage/homepage-03132025-mobile.jpg);
      background-repeat: no-repeat !important;
    }
    
    @media only screen and (min-width: 62.5em) {
      .heroBackground-387 {
        background: url(/cdn/opa-homepage-images/2025-homepage/homepage-03132025.jpg);
      }
    }
  </style>
  <div class="container">
    <div class="caption vertical-center text-center">
      <h1 class="fadeInDown-1 black"></h1>
      
      <div class="fadeInDown-3">
        <a href='/homepage/features.html#150063' class='btn btn-medium primary-background'>Learn More</a>
      </div>
    </div>
  </div>
</div>

</div>
</div>
</section>
<div class="container inner-top-xs">
  <div class="row">
    <div class="col-lg-4 mb-3">
      <h3 class='text-left white primary-background-heading' >Spotlight</h3>
      <div class="sidenav list home">
<ul >
<li><a href="/about-nrc/organization/commfuncdesc.html" target="_self">The Commission</a></li><li><a href="/about-nrc/governing-laws/advance-act.html" target="_self">ADVANCE Act</a></li><li><a href="/info-finder/decommissioning/index.html#restart" target="_self">Plant Restarts</a></li><li><a href="/ai.html" target="_self">Artificial Intelligence</a></li><li><a href="/reactors/new-reactors/advanced.html" target="_self">Advanced Reactors</a></li><li><a href="/reading-rm/doc-collections/nuregs/staff/sr2220/v8/index.html" target="_self">Agency Financial Report</a></li><li><a href="/info-finder/reactors/mont/tritium-and-effluent-release-issue.html#response" target="_self">Monticello Tritium Issue</a></li><li><a href="https://tribal.nrc.gov/" target="_self">Tribal Liaison Program</a></li><li><a href="https://mapx.nrc-gateway.gov/" target="_self">MAP-X</a></li><li><a href="https://nrcoig.oversight.gov/oig-hotline" target="_self">OIG Hotline</a></li><li><a href="/reading-rm/doc-collections/rulemaking-ruleforum/active/ruleindex.html" target="_self">Rulemaking Activity</a></li><li><a href="/reading-rm/doc-collections/commission/recent/index.html" target="_self">Commission Documents</a></li>
</ul>
</div>
<div class="more" style="margin-bottom: 10px ;margin-top:-15px; text-align: center;">
  <a href="/past-key-topics.html">Spotlight Archive </a>
</div>
    </div>
    <div class="col-lg-4 mb-3">
      <h3 class='text-left white primary-background-heading' >Latest News</h3>
      <div class="articles">
<div class="articles-list">
  <a href="/cdn/doc-collection-news/2025/25-002-i.pdf" target="_blank">
    <i class="icon-fontello-doc-1">&nbsp;</i> 
    <span>NRC Proposes $9,000 Civil Penalty Against Hartford Hospital</span> 
  </a>
</div>
<div class="articles-list">
  <a href="/cdn/doc-collection-news/2025/25-012.pdf" target="_blank">
    <i class="icon-fontello-doc-1">&nbsp;</i> 
    <span>NRC Issues Annual Assessments for Nations Nuclear Plants</span> 
  </a>
</div>
<div class="articles-list">
  <a href="/cdn/doc-collection-news/2025/25-011.pdf" target="_blank">
    <i class="icon-fontello-doc-1">&nbsp;</i> 
    <span>Latest Edition of NRC Information Digest Now Available Online</span> 
  </a>
</div>
<div class="articles-list">
  <a href="/cdn/doc-collection-news/2025/25-001-i.pdf" target="_blank">
    <i class="icon-fontello-doc-1">&nbsp;</i> 
    <span>NRC Begins Special Inspection at Hope Creek Nuclear Power Plant</span> 
  </a>
</div>
<div class="articles-list">
  <a href="/cdn/doc-collection-news/2025/25-010.pdf" target="_blank">
    <i class="icon-fontello-doc-1">&nbsp;</i> 
    <span>NRC Proposes to Amend Licensing, Inspection, and Annual Fees for Fiscal Year 2025</span> 
  </a>
</div>
<div class="articles-list">
  <a href="/cdn/doc-collection-news/2025/25-002-iii.pdf" target="_blank">
    <i class="icon-fontello-doc-1">&nbsp;</i> 
    <span>NRC Proposes $9,000 Civil Penalty to Materials Testing Consultants, Inc.</span> 
  </a>
</div>

<div class="articles-list-button"><a href="/reading-rm/doc-collections/news/2025/index.html" class="btn">View All</a></div>
</div>

    </div>
    <div class="col-lg-4 mb-3">
      <h3 class='text-left white primary-background-heading' >Public Meetings</h3><div class='text-center'><div align="left" style="border:thin solid;"><i class="icon-fontello-signal" style="float: left;font-size: 1.75em;">&nbsp;</i> <a href="https://video.nrc.gov/">Next Commission Webcast</a><br />
<strong>[April 8, 2025 at 10:00 a.m. (EDT)]</strong></div>
</div>
      <div id="calendar" class="pmc"></div>
<script type="text/javascript">
  
  var calendardata = {
    editable: false,
    eventLimit: true,
    showNonCurrentDates: false,
    fixedWeekCount: false,
    eventRender: function(event, element) {
      makeTodaybtnActive();
    },
    events: [
      {
title: '19',
url: 'https://www.nrc.gov/pmns/mtg?do=search.results&pageno=1&StartDate=12/19/2024&EndDate=12/19/2024',
start: '2024-12-19'
},{
title: '20',
url: 'https://www.nrc.gov/pmns/mtg?do=search.results&pageno=1&StartDate=12/20/2024&EndDate=12/20/2024',
start: '2024-12-20'
},{
title: '21',
url: 'https://www.nrc.gov/pmns/mtg?do=search.results&pageno=1&StartDate=12/21/2024&EndDate=12/21/2024',
start: '2024-12-21'
},{
title: '22',
url: 'https://www.nrc.gov/pmns/mtg?do=search.results&pageno=1&StartDate=12/22/2024&EndDate=12/22/2024',
start: '2024-12-22'
},{
title: '23',
url: 'https://www.nrc.gov/pmns/mtg?do=search.results&pageno=1&StartDate=12/23/2024&EndDate=12/23/2024',
start: '2024-12-23'
},{
title: '24',
url: 'https://www.nrc.gov/pmns/mtg?do=search.results&pageno=1&StartDate=12/24/2024&EndDate=12/24/2024',
start: '2024-12-24'
},{
title: '25',
url: 'https://www.nrc.gov/pmns/mtg?do=search.results&pageno=1&StartDate=12/25/2024&EndDate=12/25/2024',
start: '2024-12-25'
},{
title: '26',
url: 'https://www.nrc.gov/pmns/mtg?do=search.results&pageno=1&StartDate=12/26/2024&EndDate=12/26/2024',
start: '2024-12-26'
},{
title: '27',
url: 'https://www.nrc.gov/pmns/mtg?do=search.results&pageno=1&StartDate=12/27/2024&EndDate=12/27/2024',
start: '2024-12-27'
},{
title: '28',
url: 'https://www.nrc.gov/pmns/mtg?do=search.results&pageno=1&StartDate=12/28/2024&EndDate=12/28/2024',
start: '2024-12-28'
},{
title: '29',
url: 'https://www.nrc.gov/pmns/mtg?do=search.results&pageno=1&StartDate=12/29/2024&EndDate=12/29/2024',
start: '2024-12-29'
},{
title: '30',
url: 'https://www.nrc.gov/pmns/mtg?do=search.results&pageno=1&StartDate=12/30/2024&EndDate=12/30/2024',
start: '2024-12-30'
},{
title: '31',
url: 'https://www.nrc.gov/pmns/mtg?do=search.results&pageno=1&StartDate=12/31/2024&EndDate=12/31/2024',
start: '2024-12-31'
},{
title: '01',
url: 'https://www.nrc.gov/pmns/mtg?do=search.results&pageno=1&StartDate=1/01/2025&EndDate=1/01/2025',
start: '2025-01-01'
},{
title: '02',
url: 'https://www.nrc.gov/pmns/mtg?do=search.results&pageno=1&StartDate=1/02/2025&EndDate=1/02/2025',
start: '2025-01-02'
},{
title: '03',
url: 'https://www.nrc.gov/pmns/mtg?do=search.results&pageno=1&StartDate=1/03/2025&EndDate=1/03/2025',
start: '2025-01-03'
},{
title: '04',
url: 'https://www.nrc.gov/pmns/mtg?do=search.results&pageno=1&StartDate=1/04/2025&EndDate=1/04/2025',
start: '2025-01-04'
},{
title: '05',
url: 'https://www.nrc.gov/pmns/mtg?do=search.results&pageno=1&StartDate=1/05/2025&EndDate=1/05/2025',
start: '2025-01-05'
},{
title: '06',
url: 'https://www.nrc.gov/pmns/mtg?do=search.results&pageno=1&StartDate=1/06/2025&EndDate=1/06/2025',
start: '2025-01-06'
},{
title: '07',
url: 'https://www.nrc.gov/pmns/mtg?do=search.results&pageno=1&StartDate=1/07/2025&EndDate=1/07/2025',
start: '2025-01-07'
},{
title: '08',
url: 'https://www.nrc.gov/pmns/mtg?do=search.results&pageno=1&StartDate=1/08/2025&EndDate=1/08/2025',
start: '2025-01-08'
},{
title: '09',
url: 'https://www.nrc.gov/pmns/mtg?do=search.results&pageno=1&StartDate=1/09/2025&EndDate=1/09/2025',
start: '2025-01-09'
},{
title: '10',
url: 'https://www.nrc.gov/pmns/mtg?do=search.results&pageno=1&StartDate=1/10/2025&EndDate=1/10/2025',
start: '2025-01-10'
},{
title: '11',
url: 'https://www.nrc.gov/pmns/mtg?do=search.results&pageno=1&StartDate=1/11/2025&EndDate=1/11/2025',
start: '2025-01-11'
},{
title: '12',
url: 'https://www.nrc.gov/pmns/mtg?do=search.results&pageno=1&StartDate=1/12/2025&EndDate=1/12/2025',
start: '2025-01-12'
},{
title: '13',
url: 'https://www.nrc.gov/pmns/mtg?do=search.results&pageno=1&StartDate=1/13/2025&EndDate=1/13/2025',
start: '2025-01-13'
},{
title: '14',
url: 'https://www.nrc.gov/pmns/mtg?do=search.results&pageno=1&StartDate=1/14/2025&EndDate=1/14/2025',
start: '2025-01-14'
},{
title: '15',
url: 'https://www.nrc.gov/pmns/mtg?do=search.results&pageno=1&StartDate=1/15/2025&EndDate=1/15/2025',
start: '2025-01-15'
},{
title: '16',
url: 'https://www.nrc.gov/pmns/mtg?do=search.results&pageno=1&StartDate=1/16/2025&EndDate=1/16/2025',
start: '2025-01-16'
},{
title: '17',
url: 'https://www.nrc.gov/pmns/mtg?do=search.results&pageno=1&StartDate=1/17/2025&EndDate=1/17/2025',
start: '2025-01-17'
},{
title: '18',
url: 'https://www.nrc.gov/pmns/mtg?do=search.results&pageno=1&StartDate=1/18/2025&EndDate=1/18/2025',
start: '2025-01-18'
},{
title: '19',
url: 'https://www.nrc.gov/pmns/mtg?do=search.results&pageno=1&StartDate=1/19/2025&EndDate=1/19/2025',
start: '2025-01-19'
},{
title: '20',
url: 'https://www.nrc.gov/pmns/mtg?do=search.results&pageno=1&StartDate=1/20/2025&EndDate=1/20/2025',
start: '2025-01-20'
},{
title: '21',
url: 'https://www.nrc.gov/pmns/mtg?do=search.results&pageno=1&StartDate=1/21/2025&EndDate=1/21/2025',
start: '2025-01-21'
},{
title: '22',
url: 'https://www.nrc.gov/pmns/mtg?do=search.results&pageno=1&StartDate=1/22/2025&EndDate=1/22/2025',
start: '2025-01-22'
},{
title: '23',
url: 'https://www.nrc.gov/pmns/mtg?do=search.results&pageno=1&StartDate=1/23/2025&EndDate=1/23/2025',
start: '2025-01-23'
},{
title: '24',
url: 'https://www.nrc.gov/pmns/mtg?do=search.results&pageno=1&StartDate=1/24/2025&EndDate=1/24/2025',
start: '2025-01-24'
},{
title: '25',
url: 'https://www.nrc.gov/pmns/mtg?do=search.results&pageno=1&StartDate=1/25/2025&EndDate=1/25/2025',
start: '2025-01-25'
},{
title: '26',
url: 'https://www.nrc.gov/pmns/mtg?do=search.results&pageno=1&StartDate=1/26/2025&EndDate=1/26/2025',
start: '2025-01-26'
},{
title: '27',
url: 'https://www.nrc.gov/pmns/mtg?do=search.results&pageno=1&StartDate=1/27/2025&EndDate=1/27/2025',
start: '2025-01-27'
},{
title: '28',
url: 'https://www.nrc.gov/pmns/mtg?do=search.results&pageno=1&StartDate=1/28/2025&EndDate=1/28/2025',
start: '2025-01-28'
},{
title: '29',
url: 'https://www.nrc.gov/pmns/mtg?do=search.results&pageno=1&StartDate=1/29/2025&EndDate=1/29/2025',
start: '2025-01-29'
},{
title: '30',
url: 'https://www.nrc.gov/pmns/mtg?do=search.results&pageno=1&StartDate=1/30/2025&EndDate=1/30/2025',
start: '2025-01-30'
},{
title: '31',
url: 'https://www.nrc.gov/pmns/mtg?do=search.results&pageno=1&StartDate=1/31/2025&EndDate=1/31/2025',
start: '2025-01-31'
},{
title: '01',
url: 'https://www.nrc.gov/pmns/mtg?do=search.results&pageno=1&StartDate=2/01/2025&EndDate=2/01/2025',
start: '2025-02-01'
},{
title: '02',
url: 'https://www.nrc.gov/pmns/mtg?do=search.results&pageno=1&StartDate=2/02/2025&EndDate=2/02/2025',
start: '2025-02-02'
},{
title: '03',
url: 'https://www.nrc.gov/pmns/mtg?do=search.results&pageno=1&StartDate=2/03/2025&EndDate=2/03/2025',
start: '2025-02-03'
},{
title: '04',
url: 'https://www.nrc.gov/pmns/mtg?do=search.results&pageno=1&StartDate=2/04/2025&EndDate=2/04/2025',
start: '2025-02-04'
},{
title: '05',
url: 'https://www.nrc.gov/pmns/mtg?do=search.results&pageno=1&StartDate=2/05/2025&EndDate=2/05/2025',
start: '2025-02-05'
},{
title: '06',
url: 'https://www.nrc.gov/pmns/mtg?do=search.results&pageno=1&StartDate=2/06/2025&EndDate=2/06/2025',
start: '2025-02-06'
},{
title: '07',
url: 'https://www.nrc.gov/pmns/mtg?do=search.results&pageno=1&StartDate=2/07/2025&EndDate=2/07/2025',
start: '2025-02-07'
},{
title: '08',
url: 'https://www.nrc.gov/pmns/mtg?do=search.results&pageno=1&StartDate=2/08/2025&EndDate=2/08/2025',
start: '2025-02-08'
},{
title: '09',
url: 'https://www.nrc.gov/pmns/mtg?do=search.results&pageno=1&StartDate=2/09/2025&EndDate=2/09/2025',
start: '2025-02-09'
},{
title: '10',
url: 'https://www.nrc.gov/pmns/mtg?do=search.results&pageno=1&StartDate=2/10/2025&EndDate=2/10/2025',
start: '2025-02-10'
},{
title: '11',
url: 'https://www.nrc.gov/pmns/mtg?do=search.results&pageno=1&StartDate=2/11/2025&EndDate=2/11/2025',
start: '2025-02-11'
},{
title: '12',
url: 'https://www.nrc.gov/pmns/mtg?do=search.results&pageno=1&StartDate=2/12/2025&EndDate=2/12/2025',
start: '2025-02-12'
},{
title: '13',
url: 'https://www.nrc.gov/pmns/mtg?do=search.results&pageno=1&StartDate=2/13/2025&EndDate=2/13/2025',
start: '2025-02-13'
},{
title: '14',
url: 'https://www.nrc.gov/pmns/mtg?do=search.results&pageno=1&StartDate=2/14/2025&EndDate=2/14/2025',
start: '2025-02-14'
},{
title: '15',
url: 'https://www.nrc.gov/pmns/mtg?do=search.results&pageno=1&StartDate=2/15/2025&EndDate=2/15/2025',
start: '2025-02-15'
},{
title: '16',
url: 'https://www.nrc.gov/pmns/mtg?do=search.results&pageno=1&StartDate=2/16/2025&EndDate=2/16/2025',
start: '2025-02-16'
},{
title: '17',
url: 'https://www.nrc.gov/pmns/mtg?do=search.results&pageno=1&StartDate=2/17/2025&EndDate=2/17/2025',
start: '2025-02-17'
},{
title: '18',
url: 'https://www.nrc.gov/pmns/mtg?do=search.results&pageno=1&StartDate=2/18/2025&EndDate=2/18/2025',
start: '2025-02-18'
},{
title: '19',
url: 'https://www.nrc.gov/pmns/mtg?do=search.results&pageno=1&StartDate=2/19/2025&EndDate=2/19/2025',
start: '2025-02-19'
},{
title: '20',
url: 'https://www.nrc.gov/pmns/mtg?do=search.results&pageno=1&StartDate=2/20/2025&EndDate=2/20/2025',
start: '2025-02-20'
},{
title: '21',
url: 'https://www.nrc.gov/pmns/mtg?do=search.results&pageno=1&StartDate=2/21/2025&EndDate=2/21/2025',
start: '2025-02-21'
},{
title: '22',
url: 'https://www.nrc.gov/pmns/mtg?do=search.results&pageno=1&StartDate=2/22/2025&EndDate=2/22/2025',
start: '2025-02-22'
},{
title: '23',
url: 'https://www.nrc.gov/pmns/mtg?do=search.results&pageno=1&StartDate=2/23/2025&EndDate=2/23/2025',
start: '2025-02-23'
},{
title: '24',
url: 'https://www.nrc.gov/pmns/mtg?do=search.results&pageno=1&StartDate=2/24/2025&EndDate=2/24/2025',
start: '2025-02-24'
},{
title: '25',
url: 'https://www.nrc.gov/pmns/mtg?do=search.results&pageno=1&StartDate=2/25/2025&EndDate=2/25/2025',
start: '2025-02-25'
},{
title: '26',
url: 'https://www.nrc.gov/pmns/mtg?do=search.results&pageno=1&StartDate=2/26/2025&EndDate=2/26/2025',
start: '2025-02-26'
},{
title: '27',
url: 'https://www.nrc.gov/pmns/mtg?do=search.results&pageno=1&StartDate=2/27/2025&EndDate=2/27/2025',
start: '2025-02-27'
},{
title: '28',
url: 'https://www.nrc.gov/pmns/mtg?do=search.results&pageno=1&StartDate=2/28/2025&EndDate=2/28/2025',
start: '2025-02-28'
},{
title: '01',
url: 'https://www.nrc.gov/pmns/mtg?do=search.results&pageno=1&StartDate=3/01/2025&EndDate=3/01/2025',
start: '2025-03-01'
},{
title: '02',
url: 'https://www.nrc.gov/pmns/mtg?do=search.results&pageno=1&StartDate=3/02/2025&EndDate=3/02/2025',
start: '2025-03-02'
},{
title: '03',
url: 'https://www.nrc.gov/pmns/mtg?do=search.results&pageno=1&StartDate=3/03/2025&EndDate=3/03/2025',
start: '2025-03-03'
},{
title: '04',
url: 'https://www.nrc.gov/pmns/mtg?do=search.results&pageno=1&StartDate=3/04/2025&EndDate=3/04/2025',
start: '2025-03-04'
},{
title: '05',
url: 'https://www.nrc.gov/pmns/mtg?do=search.results&pageno=1&StartDate=3/05/2025&EndDate=3/05/2025',
start: '2025-03-05'
},{
title: '06',
url: 'https://www.nrc.gov/pmns/mtg?do=search.results&pageno=1&StartDate=3/06/2025&EndDate=3/06/2025',
start: '2025-03-06'
},{
title: '07',
url: 'https://www.nrc.gov/pmns/mtg?do=search.results&pageno=1&StartDate=3/07/2025&EndDate=3/07/2025',
start: '2025-03-07'
},{
title: '08',
url: 'https://www.nrc.gov/pmns/mtg?do=search.results&pageno=1&StartDate=3/08/2025&EndDate=3/08/2025',
start: '2025-03-08'
},{
title: '09',
url: 'https://www.nrc.gov/pmns/mtg?do=search.results&pageno=1&StartDate=3/09/2025&EndDate=3/09/2025',
start: '2025-03-09'
},{
title: '10',
url: 'https://www.nrc.gov/pmns/mtg?do=search.results&pageno=1&StartDate=3/10/2025&EndDate=3/10/2025',
start: '2025-03-10'
},{
title: '11',
url: 'https://www.nrc.gov/pmns/mtg?do=search.results&pageno=1&StartDate=3/11/2025&EndDate=3/11/2025',
start: '2025-03-11'
},{
title: '12',
url: 'https://www.nrc.gov/pmns/mtg?do=search.results&pageno=1&StartDate=3/12/2025&EndDate=3/12/2025',
start: '2025-03-12'
},{
title: '13',
url: 'https://www.nrc.gov/pmns/mtg?do=search.results&pageno=1&StartDate=3/13/2025&EndDate=3/13/2025',
start: '2025-03-13'
},{
title: '14',
url: 'https://www.nrc.gov/pmns/mtg?do=search.results&pageno=1&StartDate=3/14/2025&EndDate=3/14/2025',
start: '2025-03-14'
},{
title: '15',
url: 'https://www.nrc.gov/pmns/mtg?do=search.results&pageno=1&StartDate=3/15/2025&EndDate=3/15/2025',
start: '2025-03-15'
},{
title: '16',
url: 'https://www.nrc.gov/pmns/mtg?do=search.results&pageno=1&StartDate=3/16/2025&EndDate=3/16/2025',
start: '2025-03-16'
},{
title: '17',
url: 'https://www.nrc.gov/pmns/mtg?do=search.results&pageno=1&StartDate=3/17/2025&EndDate=3/17/2025',
start: '2025-03-17'
},{
title: '18',
url: 'https://www.nrc.gov/pmns/mtg?do=search.results&pageno=1&StartDate=3/18/2025&EndDate=3/18/2025',
start: '2025-03-18'
},{
title: '19',
url: 'https://www.nrc.gov/pmns/mtg?do=search.results&pageno=1&StartDate=3/19/2025&EndDate=3/19/2025',
start: '2025-03-19'
},{
title: '20',
url: 'https://www.nrc.gov/pmns/mtg?do=search.results&pageno=1&StartDate=3/20/2025&EndDate=3/20/2025',
start: '2025-03-20'
},{
title: '21',
url: 'https://www.nrc.gov/pmns/mtg?do=search.results&pageno=1&StartDate=3/21/2025&EndDate=3/21/2025',
start: '2025-03-21'
},{
title: '22',
url: 'https://www.nrc.gov/pmns/mtg?do=search.results&pageno=1&StartDate=3/22/2025&EndDate=3/22/2025',
start: '2025-03-22'
},{
title: '23',
url: 'https://www.nrc.gov/pmns/mtg?do=search.results&pageno=1&StartDate=3/23/2025&EndDate=3/23/2025',
start: '2025-03-23'
},{
title: '24',
url: 'https://www.nrc.gov/pmns/mtg?do=search.results&pageno=1&StartDate=3/24/2025&EndDate=3/24/2025',
start: '2025-03-24'
},{
title: '25',
url: 'https://www.nrc.gov/pmns/mtg?do=search.results&pageno=1&StartDate=3/25/2025&EndDate=3/25/2025',
start: '2025-03-25'
},{
title: '26',
url: 'https://www.nrc.gov/pmns/mtg?do=search.results&pageno=1&StartDate=3/26/2025&EndDate=3/26/2025',
start: '2025-03-26'
},{
title: '27',
url: 'https://www.nrc.gov/pmns/mtg?do=search.results&pageno=1&StartDate=3/27/2025&EndDate=3/27/2025',
start: '2025-03-27'
},{
title: '28',
url: 'https://www.nrc.gov/pmns/mtg?do=search.results&pageno=1&StartDate=3/28/2025&EndDate=3/28/2025',
start: '2025-03-28'
},{
title: '29',
url: 'https://www.nrc.gov/pmns/mtg?do=search.results&pageno=1&StartDate=3/29/2025&EndDate=3/29/2025',
start: '2025-03-29'
},{
title: '30',
url: 'https://www.nrc.gov/pmns/mtg?do=search.results&pageno=1&StartDate=3/30/2025&EndDate=3/30/2025',
start: '2025-03-30'
},{
title: '31',
url: 'https://www.nrc.gov/pmns/mtg?do=search.results&pageno=1&StartDate=3/31/2025&EndDate=3/31/2025',
start: '2025-03-31'
},{
title: '01',
url: 'https://www.nrc.gov/pmns/mtg?do=search.results&pageno=1&StartDate=4/01/2025&EndDate=4/01/2025',
start: '2025-04-01'
},{
title: '02',
url: 'https://www.nrc.gov/pmns/mtg?do=search.results&pageno=1&StartDate=4/02/2025&EndDate=4/02/2025',
start: '2025-04-02'
},{
title: '03',
url: 'https://www.nrc.gov/pmns/mtg?do=search.results&pageno=1&StartDate=4/03/2025&EndDate=4/03/2025',
start: '2025-04-03'
},{
title: '04',
url: 'https://www.nrc.gov/pmns/mtg?do=search.results&pageno=1&StartDate=4/04/2025&EndDate=4/04/2025',
start: '2025-04-04'
},{
title: '05',
url: 'https://www.nrc.gov/pmns/mtg?do=search.results&pageno=1&StartDate=4/05/2025&EndDate=4/05/2025',
start: '2025-04-05'
},{
title: '06',
url: 'https://www.nrc.gov/pmns/mtg?do=search.results&pageno=1&StartDate=4/06/2025&EndDate=4/06/2025',
start: '2025-04-06'
},{
title: '07',
url: 'https://www.nrc.gov/pmns/mtg?do=search.results&pageno=1&StartDate=4/07/2025&EndDate=4/07/2025',
start: '2025-04-07'
},{
title: '08',
url: 'https://www.nrc.gov/pmns/mtg?do=search.results&pageno=1&StartDate=4/08/2025&EndDate=4/08/2025',
start: '2025-04-08'
},{
title: '09',
url: 'https://www.nrc.gov/pmns/mtg?do=search.results&pageno=1&StartDate=4/09/2025&EndDate=4/09/2025',
start: '2025-04-09'
},{
title: '10',
url: 'https://www.nrc.gov/pmns/mtg?do=search.results&pageno=1&StartDate=4/10/2025&EndDate=4/10/2025',
start: '2025-04-10'
},{
title: '11',
url: 'https://www.nrc.gov/pmns/mtg?do=search.results&pageno=1&StartDate=4/11/2025&EndDate=4/11/2025',
start: '2025-04-11'
},{
title: '12',
url: 'https://www.nrc.gov/pmns/mtg?do=search.results&pageno=1&StartDate=4/12/2025&EndDate=4/12/2025',
start: '2025-04-12'
},{
title: '13',
url: 'https://www.nrc.gov/pmns/mtg?do=search.results&pageno=1&StartDate=4/13/2025&EndDate=4/13/2025',
start: '2025-04-13'
},{
title: '14',
url: 'https://www.nrc.gov/pmns/mtg?do=search.results&pageno=1&StartDate=4/14/2025&EndDate=4/14/2025',
start: '2025-04-14'
},{
title: '15',
url: 'https://www.nrc.gov/pmns/mtg?do=search.results&pageno=1&StartDate=4/15/2025&EndDate=4/15/2025',
start: '2025-04-15'
},{
title: '16',
url: 'https://www.nrc.gov/pmns/mtg?do=search.results&pageno=1&StartDate=4/16/2025&EndDate=4/16/2025',
start: '2025-04-16'
},{
title: '17',
url: 'https://www.nrc.gov/pmns/mtg?do=search.results&pageno=1&StartDate=4/17/2025&EndDate=4/17/2025',
start: '2025-04-17'
},{
title: '18',
url: 'https://www.nrc.gov/pmns/mtg?do=search.results&pageno=1&StartDate=4/18/2025&EndDate=4/18/2025',
start: '2025-04-18'
},{
title: '19',
url: 'https://www.nrc.gov/pmns/mtg?do=search.results&pageno=1&StartDate=4/19/2025&EndDate=4/19/2025',
start: '2025-04-19'
},{
title: '20',
url: 'https://www.nrc.gov/pmns/mtg?do=search.results&pageno=1&StartDate=4/20/2025&EndDate=4/20/2025',
start: '2025-04-20'
},{
title: '21',
url: 'https://www.nrc.gov/pmns/mtg?do=search.results&pageno=1&StartDate=4/21/2025&EndDate=4/21/2025',
start: '2025-04-21'
},{
title: '22',
url: 'https://www.nrc.gov/pmns/mtg?do=search.results&pageno=1&StartDate=4/22/2025&EndDate=4/22/2025',
start: '2025-04-22'
},{
title: '23',
url: 'https://www.nrc.gov/pmns/mtg?do=search.results&pageno=1&StartDate=4/23/2025&EndDate=4/23/2025',
start: '2025-04-23'
},{
title: '24',
url: 'https://www.nrc.gov/pmns/mtg?do=search.results&pageno=1&StartDate=4/24/2025&EndDate=4/24/2025',
start: '2025-04-24'
},{
title: '25',
url: 'https://www.nrc.gov/pmns/mtg?do=search.results&pageno=1&StartDate=4/25/2025&EndDate=4/25/2025',
start: '2025-04-25'
},{
title: '26',
url: 'https://www.nrc.gov/pmns/mtg?do=search.results&pageno=1&StartDate=4/26/2025&EndDate=4/26/2025',
start: '2025-04-26'
},{
title: '27',
url: 'https://www.nrc.gov/pmns/mtg?do=search.results&pageno=1&StartDate=4/27/2025&EndDate=4/27/2025',
start: '2025-04-27'
},{
title: '28',
url: 'https://www.nrc.gov/pmns/mtg?do=search.results&pageno=1&StartDate=4/28/2025&EndDate=4/28/2025',
start: '2025-04-28'
},{
title: '29',
url: 'https://www.nrc.gov/pmns/mtg?do=search.results&pageno=1&StartDate=4/29/2025&EndDate=4/29/2025',
start: '2025-04-29'
},{
title: '30',
url: 'https://www.nrc.gov/pmns/mtg?do=search.results&pageno=1&StartDate=4/30/2025&EndDate=4/30/2025',
start: '2025-04-30'
},{
title: '01',
url: 'https://www.nrc.gov/pmns/mtg?do=search.results&pageno=1&StartDate=5/01/2025&EndDate=5/01/2025',
start: '2025-05-01'
},{
title: '02',
url: 'https://www.nrc.gov/pmns/mtg?do=search.results&pageno=1&StartDate=5/02/2025&EndDate=5/02/2025',
start: '2025-05-02'
},{
title: '03',
url: 'https://www.nrc.gov/pmns/mtg?do=search.results&pageno=1&StartDate=5/03/2025&EndDate=5/03/2025',
start: '2025-05-03'
},{
title: '04',
url: 'https://www.nrc.gov/pmns/mtg?do=search.results&pageno=1&StartDate=5/04/2025&EndDate=5/04/2025',
start: '2025-05-04'
},{
title: '05',
url: 'https://www.nrc.gov/pmns/mtg?do=search.results&pageno=1&StartDate=5/05/2025&EndDate=5/05/2025',
start: '2025-05-05'
},{
title: '06',
url: 'https://www.nrc.gov/pmns/mtg?do=search.results&pageno=1&StartDate=5/06/2025&EndDate=5/06/2025',
start: '2025-05-06'
},{
title: '07',
url: 'https://www.nrc.gov/pmns/mtg?do=search.results&pageno=1&StartDate=5/07/2025&EndDate=5/07/2025',
start: '2025-05-07'
},{
title: '08',
url: 'https://www.nrc.gov/pmns/mtg?do=search.results&pageno=1&StartDate=5/08/2025&EndDate=5/08/2025',
start: '2025-05-08'
},{
title: '09',
url: 'https://www.nrc.gov/pmns/mtg?do=search.results&pageno=1&StartDate=5/09/2025&EndDate=5/09/2025',
start: '2025-05-09'
},{
title: '10',
url: 'https://www.nrc.gov/pmns/mtg?do=search.results&pageno=1&StartDate=5/10/2025&EndDate=5/10/2025',
start: '2025-05-10'
},{
title: '11',
url: 'https://www.nrc.gov/pmns/mtg?do=search.results&pageno=1&StartDate=5/11/2025&EndDate=5/11/2025',
start: '2025-05-11'
},{
title: '12',
url: 'https://www.nrc.gov/pmns/mtg?do=search.results&pageno=1&StartDate=5/12/2025&EndDate=5/12/2025',
start: '2025-05-12'
},{
title: '13',
url: 'https://www.nrc.gov/pmns/mtg?do=search.results&pageno=1&StartDate=5/13/2025&EndDate=5/13/2025',
start: '2025-05-13'
},{
title: '14',
url: 'https://www.nrc.gov/pmns/mtg?do=search.results&pageno=1&StartDate=5/14/2025&EndDate=5/14/2025',
start: '2025-05-14'
},{
title: '15',
url: 'https://www.nrc.gov/pmns/mtg?do=search.results&pageno=1&StartDate=5/15/2025&EndDate=5/15/2025',
start: '2025-05-15'
},{
title: '16',
url: 'https://www.nrc.gov/pmns/mtg?do=search.results&pageno=1&StartDate=5/16/2025&EndDate=5/16/2025',
start: '2025-05-16'
},{
title: '17',
url: 'https://www.nrc.gov/pmns/mtg?do=search.results&pageno=1&StartDate=5/17/2025&EndDate=5/17/2025',
start: '2025-05-17'
},{
title: '18',
url: 'https://www.nrc.gov/pmns/mtg?do=search.results&pageno=1&StartDate=5/18/2025&EndDate=5/18/2025',
start: '2025-05-18'
},{
title: '19',
url: 'https://www.nrc.gov/pmns/mtg?do=search.results&pageno=1&StartDate=5/19/2025&EndDate=5/19/2025',
start: '2025-05-19'
},{
title: '20',
url: 'https://www.nrc.gov/pmns/mtg?do=search.results&pageno=1&StartDate=5/20/2025&EndDate=5/20/2025',
start: '2025-05-20'
},{
title: '21',
url: 'https://www.nrc.gov/pmns/mtg?do=search.results&pageno=1&StartDate=5/21/2025&EndDate=5/21/2025',
start: '2025-05-21'
},{
title: '22',
url: 'https://www.nrc.gov/pmns/mtg?do=search.results&pageno=1&StartDate=5/22/2025&EndDate=5/22/2025',
start: '2025-05-22'
},{
title: '23',
url: 'https://www.nrc.gov/pmns/mtg?do=search.results&pageno=1&StartDate=5/23/2025&EndDate=5/23/2025',
start: '2025-05-23'
},{
title: '24',
url: 'https://www.nrc.gov/pmns/mtg?do=search.results&pageno=1&StartDate=5/24/2025&EndDate=5/24/2025',
start: '2025-05-24'
},{
title: '25',
url: 'https://www.nrc.gov/pmns/mtg?do=search.results&pageno=1&StartDate=5/25/2025&EndDate=5/25/2025',
start: '2025-05-25'
},{
title: '26',
url: 'https://www.nrc.gov/pmns/mtg?do=search.results&pageno=1&StartDate=5/26/2025&EndDate=5/26/2025',
start: '2025-05-26'
},{
title: '27',
url: 'https://www.nrc.gov/pmns/mtg?do=search.results&pageno=1&StartDate=5/27/2025&EndDate=5/27/2025',
start: '2025-05-27'
},{
title: '28',
url: 'https://www.nrc.gov/pmns/mtg?do=search.results&pageno=1&StartDate=5/28/2025&EndDate=5/28/2025',
start: '2025-05-28'
},{
title: '29',
url: 'https://www.nrc.gov/pmns/mtg?do=search.results&pageno=1&StartDate=5/29/2025&EndDate=5/29/2025',
start: '2025-05-29'
},{
title: '30',
url: 'https://www.nrc.gov/pmns/mtg?do=search.results&pageno=1&StartDate=5/30/2025&EndDate=5/30/2025',
start: '2025-05-30'
},{
title: '31',
url: 'https://www.nrc.gov/pmns/mtg?do=search.results&pageno=1&StartDate=5/31/2025&EndDate=5/31/2025',
start: '2025-05-31'
},{
title: '01',
url: 'https://www.nrc.gov/pmns/mtg?do=search.results&pageno=1&StartDate=6/01/2025&EndDate=6/01/2025',
start: '2025-06-01'
},{
title: '02',
url: 'https://www.nrc.gov/pmns/mtg?do=search.results&pageno=1&StartDate=6/02/2025&EndDate=6/02/2025',
start: '2025-06-02'
},{
title: '03',
url: 'https://www.nrc.gov/pmns/mtg?do=search.results&pageno=1&StartDate=6/03/2025&EndDate=6/03/2025',
start: '2025-06-03'
},{
title: '04',
url: 'https://www.nrc.gov/pmns/mtg?do=search.results&pageno=1&StartDate=6/04/2025&EndDate=6/04/2025',
start: '2025-06-04'
},{
title: '05',
url: 'https://www.nrc.gov/pmns/mtg?do=search.results&pageno=1&StartDate=6/05/2025&EndDate=6/05/2025',
start: '2025-06-05'
},{
title: '06',
url: 'https://www.nrc.gov/pmns/mtg?do=search.results&pageno=1&StartDate=6/06/2025&EndDate=6/06/2025',
start: '2025-06-06'
},{
title: '07',
url: 'https://www.nrc.gov/pmns/mtg?do=search.results&pageno=1&StartDate=6/07/2025&EndDate=6/07/2025',
start: '2025-06-07'
},{
title: '08',
url: 'https://www.nrc.gov/pmns/mtg?do=search.results&pageno=1&StartDate=6/08/2025&EndDate=6/08/2025',
start: '2025-06-08'
},{
title: '09',
url: 'https://www.nrc.gov/pmns/mtg?do=search.results&pageno=1&StartDate=6/09/2025&EndDate=6/09/2025',
start: '2025-06-09'
},{
title: '10',
url: 'https://www.nrc.gov/pmns/mtg?do=search.results&pageno=1&StartDate=6/10/2025&EndDate=6/10/2025',
start: '2025-06-10'
},{
title: '11',
url: 'https://www.nrc.gov/pmns/mtg?do=search.results&pageno=1&StartDate=6/11/2025&EndDate=6/11/2025',
start: '2025-06-11'
},{
title: '12',
url: 'https://www.nrc.gov/pmns/mtg?do=search.results&pageno=1&StartDate=6/12/2025&EndDate=6/12/2025',
start: '2025-06-12'
},{
title: '13',
url: 'https://www.nrc.gov/pmns/mtg?do=search.results&pageno=1&StartDate=6/13/2025&EndDate=6/13/2025',
start: '2025-06-13'
},{
title: '14',
url: 'https://www.nrc.gov/pmns/mtg?do=search.results&pageno=1&StartDate=6/14/2025&EndDate=6/14/2025',
start: '2025-06-14'
},{
title: '15',
url: 'https://www.nrc.gov/pmns/mtg?do=search.results&pageno=1&StartDate=6/15/2025&EndDate=6/15/2025',
start: '2025-06-15'
},{
title: '16',
url: 'https://www.nrc.gov/pmns/mtg?do=search.results&pageno=1&StartDate=6/16/2025&EndDate=6/16/2025',
start: '2025-06-16'
},{
title: '17',
url: 'https://www.nrc.gov/pmns/mtg?do=search.results&pageno=1&StartDate=6/17/2025&EndDate=6/17/2025',
start: '2025-06-17'
},{
title: '18',
url: 'https://www.nrc.gov/pmns/mtg?do=search.results&pageno=1&StartDate=6/18/2025&EndDate=6/18/2025',
start: '2025-06-18'
},{
title: '19',
url: 'https://www.nrc.gov/pmns/mtg?do=search.results&pageno=1&StartDate=6/19/2025&EndDate=6/19/2025',
start: '2025-06-19'
}, 
      
    ]
  }
</script>
    </div>
  </div>
</div>
<style type="text/css">div.scbwwbt-content-button a
{
  padding:14px 26px 16px 26px;
}
</style>




<div class="container">
<div class="row inner-top-xs">
<div class="col-lg-3 col-md-6">
  <div class="tile-card mg-trigger" id="tile141310">
    <a href="/reading-rm/doc-collections/event-status/index.html"><img class="img-responsive" src="/cdn/site/home-page/generic-event-report2.jpg" alt="Image of person typing on a laptop sitting at a table with a smartphone on the left side and a cup of coffee on the right side of the table." title=""></a>
    <div class="tile-card-content">
      <span class="tile-card-title">Event Reports</span>
      <span class="tile-card-name">Reports associated with events</span>
    </div>
    <a href="/reading-rm/doc-collections/event-status/index.html" class="tile-card-button btn btn-small quaternary-background black">Read More</a>
  </div>
</div><div class="col-lg-3 col-md-6">
  <div class="tile-card mg-trigger" id="tile141311">
    <a href="/reading-rm/adams.html"><img class="img-responsive" src="/cdn/site/home-page/adams2.jpg" alt="Image of computer server room with twelve large tall black servers with small blue lights sitting on a grey floor." title=""></a>
    <div class="tile-card-content">
      <span class="tile-card-title">ADAMS Public Documents</span>
      <span class="tile-card-name">Search and view NRC&#39;s public documents</span>
    </div>
    <a href="/reading-rm/adams.html" class="tile-card-button btn btn-small quaternary-background black">Read More</a>
  </div>
</div><div class="col-lg-3 col-md-6">
  <div class="tile-card mg-trigger" id="tile141312">
    <a href="/public-involve/open.html"><img class="img-responsive" src="/cdn/site/home-page/open-government.jpg" alt="Image of the Nuclear Regulatory Commission's outdoor building signage at their headquarters in Maryland with an American Flag flying next to it." title=""></a>
    <div class="tile-card-content">
      <span class="tile-card-title">Open Government</span>
      <span class="tile-card-name">NRC approach to open/digital government</span>
    </div>
    <a href="/public-involve/open.html" class="tile-card-button btn btn-small quaternary-background black">Read More</a>
  </div>
</div><div class="col-lg-3 col-md-6">
  <div class="tile-card mg-trigger" id="tile141313">
    <a href="/about-nrc/regulatory/licensing/fees.html#ebilling"><img class="img-responsive" src="/cdn/site/home-page/new-reactor-license.jpg" alt="Image of person holding a tablet computer in their left hand and a credit card in their right hand." title=""></a>
    <div class="tile-card-content">
      <span class="tile-card-title">eBilling</span>
      <span class="tile-card-name">Invoices available online</span>
    </div>
