< !doctype html><html lang="en-us"><head id="head"><title>nuclear regulatory commission </title><meta name="description" content="nuclear regulatory commission" /><meta charset="utf-8" /><meta name="robots" content="noindex,nofollow" /><script async type="text/javascript" id="_fed_an_ua_tag" src="https://dap.digitalgov.gov/universal-federated-analytics-min.js?agency=nrc"></script><meta name="apple-mobile-web-app-title" content="nrc web"><meta name="application-name" content="nrc web"><meta name="msapplication-tilecolor" content="#ffffff"><meta name="theme-color" content="#ffffff"><meta http-equiv="x-ua-compatible" content="ie=edge"><meta name="viewport" content="width=device-width, initial-scale=1.0"><meta property="og:image:width" content="279"><meta property="og:image:height" content="279"><meta property="og:title" content="home"><meta property="og:image" content='/cdn/site/logo/og-image.jpg'><meta property="og:description" content="home"><meta property="og:url" content="https://www.nrc.gov/"><meta property="og:image:alt" content="u.s. nuclear regulatory commission web site banner"><meta property="og:site_name" content='nrc web'><meta name="twitter:card" content="summary"><meta name="twitter:creator" content="@nrc"><meta name="twitter:site" content="@nrcgov"><meta property="og:type" content="website"><meta property="og:locale" content="en-us" /><meta name="msapplication-config" content="/cdn/site/logo/browserconfig.xml"><link rel="apple-touch-icon" sizes="180x180" href="/cdn/site/logo/apple-touch-icon.png"><link rel="shortcut icon" href="/cdn/site/logo/favicon.ico"><link rel="icon" type="image/png" sizes="32x32" href="/cdn/site/logo/favicon-32x32.png"><link rel="icon" type="image/png" sizes="16x16" href="/cdn/site/logo/favicon-16x16.png"><link rel="manifest" href="/cdn/site/logo/manifest.json"><link rel="mask-icon" href="/cdn/site/logo/safari-pinned-tab.svg" color="#ffffff"><script>(function() {
        var a=document.createelement('script'); a.type='text/javascript'; a.async=true; a.src='https://cdn.gov.cfigroup.com/webmon/s/source/webmon/9de8b1c6db1117/webmon.js'; ; var b=document.getelementsbytagname('script')[0]; b.parentnode.insertbefore(a, b)
    })();

</script>< !-- core css --><link href="/working/nrcweb/css/bundler.2e4b1eeff01525f32233ddcd7b9b4a2d.css" rel="stylesheet" type="text/css" /><link rel="canonical" href='https://www.nrc.gov/' /><script> !function(e) {
    var n="https://s.go-mpulse.net/boomerang/";

    if("true"=="true")e.boomr_config=e.boomr_config|| {}

    ,
    e.boomr_config.pageparams=e.boomr_config.pageparams|| {}

    ,
    e.boomr_config.pageparams.pci= !0,
    n="https://s2.go-mpulse.net/boomerang/";

    if(window.boomr_api_key="ny72w-pc7ac-ahrew-9tavj-vgmaw", function() {
            function e() {
                if( !r) {
                    var e=document.createelement("script"); e.id="boomr-scr-as", e.src=window.boomr.url, e.async= !0, o.appendchild(e), r= !0
                }
            }

            function t(e) {
                r= !0; var n, t, a, i, d=document, o=window; if(window.boomr.snippetmethod=e?"if":"i", t=function(e, n) {
                        var t=d.createelement("script"); t.id=n||"boomr-if-as", t.src=window.boomr.url, boomr_lstart=(new date).gettime(), e=e||d.body, e.appendchild(t)
                    }

                    , !window.addeventlistener&&window.attachevent&&navigator.useragent.match(/msie [67]\./))return window.boomr.snippetmethod="s", void t(o, "boomr-async"); a=document.createelement("iframe"), a.src="about:blank", a.title="", a.role="presentation", a.loading="eager", i=(a.frameelement||a).style, i.width=0, i.height=0, i.border=0, i.display="none", o.appendchild(a); try {
                    o=a.contentwindow, d=o.document.open()
                }

                catch(_) {
                    n=document.domain, a.src="javascript:var d=document.open();d.domain='" +n+"';void 0;", o=a.contentwindow, d=o.document.open()
                }

                if(n)d._boomrl=function() {
                    this.domain=n, t()
                }

                , d.write("<bo" +"dy onload='document._boomrl();'>"); else if(o._boomrl=function() {
                        t()
                    }

                    , o.addeventlistener)o.addeventlistener("load", o._boomrl, !1); else if(o.attachevent)o.attachevent("onload", o._boomrl); d.close()
            }

            function a(e) {
                window.boomr_onload=e&&e.timestamp||(new date).gettime()
            }

            if( !window.boomr|| !window.boomr.version&& !window.boomr.snippetexecuted) {
                window.boomr=window.boomr|| {}

                , window.boomr.snippetstart=(new date).gettime(), window.boomr.snippetexecuted= !0, window.boomr.snippetversion=14, window.boomr.url=n+"ny72w-pc7ac-ahrew-9tavj-vgmaw"; var i=document.currentscript||document.getelementsbytagname("script")[0], o=i.parentnode, r= !1, d=document.createelement("link"); if(d.rellist&&"function"==typeof d.rellist.supports&&d.rellist.supports("preload")&&"as" in d)window.boomr.snippetmethod="p", d.href=window.boomr.url, d.rel="preload", d.as="script", d.addeventlistener("load", e), d.addeventlistener("error", function() {
                        t( !0)

                    }), settimeout(function() {
                        if( !r)t( !0)
                    }

                    , 3e3), boomr_lstart=(new date).gettime(), o.appendchild(d); else t( !1); if(window.addeventlistener)window.addeventlistener("load", a, !1); else if(window.attachevent)window.attachevent("onload", a)
            }
        }

        (), "" .length>0)if(e&&"performance" in e&&e.performance&&"function"==typeof e.performance.setresourcetimingbuffersize)e.performance.setresourcetimingbuffersize();

    !function() {
        if(boomr=e.boomr|| {}

            , boomr.plugins=boomr.plugins|| {}

            , !boomr.plugins.ak) {

            var n=""=="true" ?1:0,
            t="",
            a="eptzex5yk4qbgz62xzia-f-bb0703ca9-clientnsv4-s.akamaihd.net",
            i="false"=="true" ?2:1,
            o= {
                "ak.v": "39", "ak.cp":"1135018", "ak.ai":parseint("670380", 10), "ak.ol":"0", "ak.cr":11, "ak.ipv":4, "ak.proto":"http/1.1", "ak.rid":"1751f31d", "ak.r":40932, "ak.a2":n, "ak.m":"dsca", "ak.n":"essl", "ak.bpcip":"35.231.146.0", "ak.cport":57802, "ak.gh":"23.56.236.59", "ak.quicv":"", "ak.tlsv":"tls1.3", "ak.0rtt":"", "ak.0rtt.ed":"", "ak.csrc":"-", "ak.acc":"reno", "ak.t":"1742388816", "ak.ak":"hobiqwzuyzcg5vsafclimq==d1vcerwguytikcytrcpwwtz6uo0mjxhxtwjwk1kpiwpkhamxmlcjr/yk3vzfvqld2vjpccrkqv8g/f+iuvg8rmd/tnahxxnvyludrgjehv1aiagvpwfvuo3hnjucszzggb8ooadi3gyrmhyveu5lwh6vhz9qv+gtu92cp8ms+sygxcwdg8b/qnckfulkfnhi3ar6m4pkrt26a7jjsc8ochtcskl/r7u6zzkgw+mz960hvqee4o9zcoarx0gltaf8hy/euqchkad/xx59s2u7gwfcmvun+r96qdial0kmnwqhjzq0hvkqcjgsk9ozcdjenvbt8qdgg7u9bbn3/ydakm0mvtonvc5gufg20humzof6pc7bi6hzywwvfnmr4cfimuiebgr1ntyx8nikzlduesjnmpmrzamgt0hu1gvqpom=", "ak.pv":"149", "ak.dpoabenc":"", "ak.tf":i
            }

            ;
            if("" !==t)o["ak.ruds"]=t;

            var r= {

                i: !1,
                av:function(n) {
                    var t="http.initiator";
                    if(n&&( !n[t]||"spa_hard"===n[t]))o["ak.feo"]=void 0 !==e.afeoapplied?1: 0, boomr.addvar(o)
                }

                ,
                rv:function() {
                    var e=["ak.bpcip",
                    "ak.cport",
                    "ak.cr",
                    "ak.csrc",
                    "ak.gh",
                    "ak.ipv",
                    "ak.m",
                    "ak.n",
                    "ak.ol",
                    "ak.proto",
                    "ak.quicv",
                    "ak.tlsv",
                    "ak.0rtt",
                    "ak.0rtt.ed",
                    "ak.r",
                    "ak.acc",
                    "ak.t",
                    "ak.tf"];
                    boomr.removevar(e)
                }
            }

            ;

            boomr.plugins.ak= {

                akvars:o,
                akdnsprefetchdomain:a,
                init:function() {
                    if( !r.i) {
                        var e=boomr.subscribe;
                        e("before_beacon", r.av, null, null),
                        e("onbeacon", r.rv, null, null),
                        r.i= !0
                    }

                    return this
                }

                ,
                is_complete:function() {
                    return !0
                }
            }
        }
    }

    ()
}

(window);
</script></head><body class="ltr chrome enus contentbody"><form method="post" action="/" id="form"><div class="aspnethidden"><input type="hidden" name="__eventtarget" id="__eventtarget" value="" /><input type="hidden" name="__eventargument" id="__eventargument" value="" /></div><script type="text/javascript"> //<![cdata[ var theform = document.forms['form']; if (!theform){theform = document.form}function __dopostback(eventtarget, eventargument){if (!theform.onsubmit || (theform.onsubmit() != false)){theform.__eventtarget.value = eventtarget; theform.__eventargument.value = eventargument; theform.submit()}}//]]> </script> <script src="/webresource.axd?d=pyngkmcfuv13he1qd6_tznyrqktfblvh56uyecomauyay9bsm0av9vynhtxjo91fwpabbsu-rkhbufrdwulw4q2&amp;t=638628224627334853" type="text/javascript"></script> <input type="hidden" name="lng" id="lng" value="en-us" /> <script type="text/javascript"> //<![cdata[ function pm_postback(param){if (window.top.hidescreenlockwarningandsync){window.top.hidescreenlockwarningandsync(1080)}if(window.cmscontentmanager){cmscontentmanager.allowsubmit = true}; __dopostback('m$am',param)}function pm_callback(param, callback, ctx){if (window.top.hidescreenlockwarningandsync){window.top.hidescreenlockwarningandsync(1080)}if (window.cmscontentmanager){cmscontentmanager.storecontentchangedstatus()};webform_docallback('m$am',param,callback,ctx,null,true)}//]]> </script> <script type="text/javascript"> //<![cdata[ var cms = cms ||{}; cms.application ={"language": "en", "imagesurl": "/cmspages/getresource.ashx?image=%5bimages.zip%5d%2f", "isdebuggingenabled": false, "applicationurl": "/", "isdialog": false, "isrtl": "false"}; //]]> </script> <div class="aspnethidden"> <input type="hidden" name="__viewstategenerator" id="__viewstategenerator" value="a5343185" /> <input type="hidden" name="__scrollpositionx" id="__scrollpositionx" value="0" /> <input type="hidden" name="__scrollpositiony" id="__scrollpositiony" value="0" /> </div> <div id="ctxm"> </div> <a href="#" class="scrolltotop" title="back to top"> <i class="icon-fontello-up-open-mini"></i> </a> <div class="main-header"> <div class="container"> <div class="row"> <div class="col-12"> <button id="top-links-button" role="button" type="button" class="main-header-top-links-toggle btn d-lg-none">other links</button> <div id="top-links" class="main-header-top-links d-none d-lg-block"> <ul> <li><a href="/reading-rm/doc-collections/faq/index.html" rel="noopener noreferrer" target="_self">faq</a></li><li><a href="/agreement-states.html" rel="noopener noreferrer" target="_self">agreement states</a></li><li><a href="/info-finder.html" rel="noopener noreferrer" target="_self">facility locator</a></li><li><a href="/site-help/new-content.html" rel="noopener noreferrer" target="_self">what's new</a></li><li><a href="/site-help.html" rel="noopener noreferrer" target="_self">site help</a></li><li><a href="/site-help/index-az.html" rel="noopener noreferrer" target="_self">index a-z</a></li><li><a href="/about-nrc/contactus.html" rel="noopener noreferrer" target="_self">contact us</a></li><li><a href="/public-involve/listserver.html" rel="noopener noreferrer" target="_self">email updates</a></li> </ul> </div> </div> </div> <div class="row"> <div class="col-12"> <button class="navbar-toggler collapsed" type="button" data-bs-toggle="collapse" data-bs-target="#main_nav" data-bs-target="#main_nav" aria-label="mobile navigation trigger" role="button"> <div class="hamburger-toggle"> <div class="hamburger"> <i class="icon-fontello-menu-1"></i> </div> </div> </button> <a href="/" rel="noopener noreferrer" class="main-header-logo" title="united states nuclear regulatory commission home page"> <img class="img-responsive" src="https://nrcgovsamediadev.blob.core.windows.net/dev/libraries/media/nrcweb/site/logo/logo.png" alt="united states nuclear regulatory commission logo"> </a> <div class="main-header-content"> <a href="/about-nrc/regulatory/allegations/safety-concern.html" class="btn quaternary-bg" rel="noopener noreferrer" title="report a safety concern">report a safety concern</a> <div class="content"> <input type="search" id="master-search" class="search-input form-control" aria-label="master site search"> <a href="/site-help/search-results?site=allsites" id="master-search-btn" class="search-btn btn" aria-label="master site search">search</a> </div> <div class="main-header-content-social-media"> <ul> <!--twitter--> <li><a class='header-twitter' href='https://twitter.com/nrcgov' target='_blank' title='nrc x feed' rel='noopener noreferrer'><svg xmlns=https://www.w3.org/2000/svg height='1em' viewbox='0 0 512 512'><path d='m389.2 48h70.6l305.6 224.2 487 464h345l233.7 318.6 106.5 464h35.8l200.7 275.5 26.8 48h172.4l272.9 180.9 389.2 48zm364.4 421.8h39.1l151.1 88h-42l364.4 421.8z'/></svg></a></li> <!--instagram--> <li><a href='https://www.instagram.com/nrcgov' target='_blank' title='nrc instagram' rel='noopener noreferrer'><i class='icon-fontello-s-instagram'></i></a></li> <!--facebook--> <li><a href='https://www.facebook.com/nrcgov/' target='_blank' title='nrc facebook' rel='noopener noreferrer'><i class='icon-fontello-s-facebook'></i></a></li> <!-- youtube --> <li><a href='https://www.youtube.com/user/nrcgov' target='_blank' title='nrc youtube channel' rel='noopener noreferrer'><i class='icon-fontello-s-youtube'></i></a></li> <!--linkedin--> <li><a href='https://www.linkedin.com/company/u-s--nuclear-regulatory-commission/' target='_blank' title='nrc linkedin' rel='noopener noreferrer'><i class='icon-fontello-s-linkedin'></i></a></li> <!--flickr--> <li><a href='https://www.flickr.com/photos/nrcgov/sets' target='_blank' title='nrc flickr gallery' rel='noopener noreferrer'><i class='icon-fontello-s-flickr'></i></a></li> <!--subscribe--> <li><a href='https://service.govdelivery.com/service/multi_subscribe.html?code=usnrc' target='_blank' title='nrc email subscriptions - govdelivery' rel='noopener noreferrer'><i class='icon-fontello-comment'></i></a></li> <!--rss--> <li><a href='/public-involve/rss-feeds.html' target='_self' title='nrc rss feed'><i class='icon-fontello-rss'></i></a></li> <!--pinterest--> </ul> </div> </div> </div> </div> </div> </div> <nav class="navbar navbar-expand-lg bg-primary" role="menu"> <div class="collapse navbar-collapse" id="main_nav"> <ul class="navbar-nav"> <li class="nav-item dropdown has-megamenu"> <a class="nav-link dropdown-toggle" href="#" data-bs-toggle="dropdown" aria-expanded="false">nuclear reactors</a> <div class="dropdown-menu megamenu"> <div class="container"> <div class="row"> <div class="col-12"> <h5><a href="/reactors.html">nuclear reactors</a></h5> </div> </div> <div class="container"><div class="row inner-top-xs general-content "><div class="mb-pd-btm col-sm-4"><a id="p_lt_webpartzone3_zmainnav_core_v1_megamenuplaceholder_p_lt_webpartzone1_zc_core_v1_three_column_layout_core_v1_three_column_layout_1_core_v1_inpagelink_btnelem_hyperlink" href="/reactors/power.html" target="_self"><span id="p_lt_webpartzone3_zmainnav_core_v1_megamenuplaceholder_p_lt_webpartzone1_zc_core_v1_three_column_layout_core_v1_three_column_layout_1_core_v1_inpagelink_btnelem_lbltext">power reactors</span></a> <a id="p_lt_webpartzone3_zmainnav_core_v1_megamenuplaceholder_p_lt_webpartzone1_zc_core_v1_three_column_layout_core_v1_three_column_layout_1_core_v1_inpagelink1_btnelem_hyperlink" href="/reactors/non-power.html" target="_self"><span id="p_lt_webpartzone3_zmainnav_core_v1_megamenuplaceholder_p_lt_webpartzone1_zc_core_v1_three_column_layout_core_v1_three_column_layout_1_core_v1_inpagelink1_btnelem_lbltext">research &amp; test reactors</span></a> </div><div class="mb-pd-btm col-sm-4"><a id="p_lt_webpartzone3_zmainnav_core_v1_megamenuplaceholder_p_lt_webpartzone1_zc_core_v1_three_column_layout_core_v1_three_column_layout_2_core_v1_inpagelink2_btnelem_hyperlink" href="/reactors/operating.html" target="_self"><span id="p_lt_webpartzone3_zmainnav_core_v1_megamenuplaceholder_p_lt_webpartzone1_zc_core_v1_three_column_layout_core_v1_three_column_layout_2_core_v1_inpagelink2_btnelem_lbltext">operating reactors</span></a> <a id="p_lt_webpartzone3_zmainnav_core_v1_megamenuplaceholder_p_lt_webpartzone1_zc_core_v1_three_column_layout_core_v1_three_column_layout_2_core_v1_inpagelink3_btnelem_hyperlink" href="/reactors/new-reactors.html" target="_self"><span id="p_lt_webpartzone3_zmainnav_core_v1_megamenuplaceholder_p_lt_webpartzone1_zc_core_v1_three_column_layout_core_v1_three_column_layout_2_core_v1_inpagelink3_btnelem_lbltext">new reactors</span></a> </div><div class="mb-pd-btm col-sm-4"><a id="p_lt_webpartzone3_zmainnav_core_v1_megamenuplaceholder_p_lt_webpartzone1_zc_core_v1_three_column_layout_core_v1_three_column_layout_3_core_v1_inpagelink4_btnelem_hyperlink" href="/reactors/operator-licensing.html" target="_self"><span id="p_lt_webpartzone3_zmainnav_core_v1_megamenuplaceholder_p_lt_webpartzone1_zc_core_v1_three_column_layout_core_v1_three_column_layout_3_core_v1_inpagelink4_btnelem_lbltext">operator licensing</span></a> <a id="p_lt_webpartzone3_zmainnav_core_v1_megamenuplaceholder_p_lt_webpartzone1_zc_core_v1_three_column_layout_core_v1_three_column_layout_3_core_v1_inpagelink5_btnelem_hyperlink" href="/about-nrc/regulatory/research.html" target="_self"><span id="p_lt_webpartzone3_zmainnav_core_v1_megamenuplaceholder_p_lt_webpartzone1_zc_core_v1_three_column_layout_core_v1_three_column_layout_3_core_v1_inpagelink5_btnelem_lbltext">research activities</span></a> </div></div></div><div class="container"><div class="row inner-top-xs general-content "><div class="col-md-12"><hr class="line dashed-line-brand-color-yellow"/><a id="p_lt_webpartzone3_zmainnav_core_v1_megamenuplaceholder_p_lt_webpartzone1_zc_core_v1_single_column_layout_core_v1_single_column_layout_1_core_v1_inpagelink6_btnelem_hyperlink" class="quick-link" href="/reactors/ql-reactors.html" target="_self"><span id="p_lt_webpartzone3_zmainnav_core_v1_megamenuplaceholder_p_lt_webpartzone1_zc_core_v1_single_column_layout_core_v1_single_column_layout_1_core_v1_inpagelink6_btnelem_lbltext">nuclear reactor quick links</span></a> </div></div></div></div> </div> </li><li class="nav-item dropdown has-megamenu"> <a class="nav-link dropdown-toggle" href="#" data-bs-toggle="dropdown" aria-expanded="false">nuclear materials</a> <div class="dropdown-menu megamenu"> <div class="container"> <div class="row"> <div class="col-12"> <h5><a href="/materials.html">nuclear materials</a></h5> </div> </div> <div class="container"><div class="row inner-top-xs general-content "><div class="mb-pd-btm col-sm-4"><a id="p_lt_webpartzone3_zmainnav_core_v1_megamenuplaceholder1_p_lt_webpartzone1_zc_core_v1_three_column_layout_core_v1_three_column_layout_1_core_v1_inpagelink_btnelem_hyperlink" href="/materials/types.html" target="_self"><span id="p_lt_webpartzone3_zmainnav_core_v1_megamenuplaceholder1_p_lt_webpartzone1_zc_core_v1_three_column_layout_core_v1_three_column_layout_1_core_v1_inpagelink_btnelem_lbltext">types of nuclear materials</span></a> <a id="p_lt_webpartzone3_zmainnav_core_v1_megamenuplaceholder1_p_lt_webpartzone1_zc_core_v1_three_column_layout_core_v1_three_column_layout_1_core_v1_inpagelink4_btnelem_hyperlink" href="/materials/fuel-cycle-fac.html" target="_self"><span id="p_lt_webpartzone3_zmainnav_core_v1_megamenuplaceholder1_p_lt_webpartzone1_zc_core_v1_three_column_layout_core_v1_three_column_layout_1_core_v1_inpagelink4_btnelem_lbltext">fuel cycle facilities</span></a> <a id="p_lt_webpartzone3_zmainnav_core_v1_megamenuplaceholder1_p_lt_webpartzone1_zc_core_v1_three_column_layout_core_v1_three_column_layout_1_core_v1_inpagelink2_btnelem_hyperlink" href="/materials/medical.html" target="_self"><span id="p_lt_webpartzone3_zmainnav_core_v1_megamenuplaceholder1_p_lt_webpartzone1_zc_core_v1_three_column_layout_core_v1_three_column_layout_1_core_v1_inpagelink2_btnelem_lbltext">medical, industrial, &amp; academic uses</span></a> </div><div class="mb-pd-btm col-sm-4"><a id="p_lt_webpartzone3_zmainnav_core_v1_megamenuplaceholder1_p_lt_webpartzone1_zc_core_v1_three_column_layout_core_v1_three_column_layout_2_core_v1_inpagelink7_btnelem_hyperlink" href="/materials/uranium-recovery.html" target="_self"><span id="p_lt_webpartzone3_zmainnav_core_v1_megamenuplaceholder1_p_lt_webpartzone1_zc_core_v1_three_column_layout_core_v1_three_column_layout_2_core_v1_inpagelink7_btnelem_lbltext">uranium recovery</span></a> <a id="p_lt_webpartzone3_zmainnav_core_v1_megamenuplaceholder1_p_lt_webpartzone1_zc_core_v1_three_column_layout_core_v1_three_column_layout_2_core_v1_inpagelink5_btnelem_hyperlink" href="/materials/transportation.html" target="_self"><span id="p_lt_webpartzone3_zmainnav_core_v1_megamenuplaceholder1_p_lt_webpartzone1_zc_core_v1_three_column_layout_core_v1_three_column_layout_2_core_v1_inpagelink5_btnelem_lbltext">materials transportation</span></a> </div><div class="mb-pd-btm col-sm-4"><a id="p_lt_webpartzone3_zmainnav_core_v1_megamenuplaceholder1_p_lt_webpartzone1_zc_core_v1_three_column_layout_core_v1_three_column_layout_3_core_v1_inpagelink1_btnelem_hyperlink" href="/materials/active-nepa-reviews.html" target="_self"><span id="p_lt_webpartzone3_zmainnav_core_v1_megamenuplaceholder1_p_lt_webpartzone1_zc_core_v1_three_column_layout_core_v1_three_column_layout_3_core_v1_inpagelink1_btnelem_lbltext">materials environmental reviews</span></a> <a id="p_lt_webpartzone3_zmainnav_core_v1_megamenuplaceholder1_p_lt_webpartzone1_zc_core_v1_three_column_layout_core_v1_three_column_layout_3_core_v1_inpagelink3_btnelem_hyperlink" href="/materials/nmp.html" target="_self"><span id="p_lt_webpartzone3_zmainnav_core_v1_megamenuplaceholder1_p_lt_webpartzone1_zc_core_v1_three_column_layout_core_v1_three_column_layout_3_core_v1_inpagelink3_btnelem_lbltext">national materials program</span></a> </div></div></div><div class="container"><div class="row inner-top-xs general-content "><div class="col-md-12"><hr class="line dashed-line-brand-color-yellow"/><a id="p_lt_webpartzone3_zmainnav_core_v1_megamenuplaceholder1_p_lt_webpartzone1_zc_core_v1_single_column_layout_core_v1_single_column_layout_1_core_v1_inpagelink9_btnelem_hyperlink" class="quick-link" href="/materials/ql-materials.html" target="_self"><span id="p_lt_webpartzone3_zmainnav_core_v1_megamenuplaceholder1_p_lt_webpartzone1_zc_core_v1_single_column_layout_core_v1_single_column_layout_1_core_v1_inpagelink9_btnelem_lbltext">nuclear materials quick links</span></a> </div></div></div></div> </div> </li><li class="nav-item dropdown has-megamenu"> <a class="nav-link dropdown-toggle" href="#" data-bs-toggle="dropdown" aria-expanded="false">radioactive waste</a> <div class="dropdown-menu megamenu"> <div class="container"> <div class="row"> <div class="col-12"> <h5><a href="/waste.html">radioactive waste</a></h5> </div> </div> <div class="container"><div class="row inner-top-xs general-content "><div class="mb-pd-btm col-sm-4"><a id="p_lt_webpartzone3_zmainnav_core_v1_megamenuplaceholder2_p_lt_webpartzone1_zc_core_v1_three_column_layout_core_v1_three_column_layout_1_core_v1_inpagelink_btnelem_hyperlink" href="/waste/decommissioning.html" target="_self"><span id="p_lt_webpartzone3_zmainnav_core_v1_megamenuplaceholder2_p_lt_webpartzone1_zc_core_v1_three_column_layout_core_v1_three_column_layout_1_core_v1_inpagelink_btnelem_lbltext">decommissioning of nuclear facilities</span></a> <a id="p_lt_webpartzone3_zmainnav_core_v1_megamenuplaceholder2_p_lt_webpartzone1_zc_core_v1_three_column_layout_core_v1_three_column_layout_1_core_v1_inpagelink1_btnelem_hyperlink" href="/waste/low-level-waste.html" target="_self"><span id="p_lt_webpartzone3_zmainnav_core_v1_megamenuplaceholder2_p_lt_webpartzone1_zc_core_v1_three_column_layout_core_v1_three_column_layout_1_core_v1_inpagelink1_btnelem_lbltext">low-level waste</span></a> <a id="p_lt_webpartzone3_zmainnav_core_v1_megamenuplaceholder2_p_lt_webpartzone1_zc_core_v1_three_column_layout_core_v1_three_column_layout_1_core_v1_inpagelink6_btnelem_hyperlink" href="/waste/incidental-waste.html" target="_self"><span id="p_lt_webpartzone3_zmainnav_core_v1_megamenuplaceholder2_p_lt_webpartzone1_zc_core_v1_three_column_layout_core_v1_three_column_layout_1_core_v1_inpagelink6_btnelem_lbltext">waste incidental to reprocessing</span></a> <a id="p_lt_webpartzone3_zmainnav_core_v1_megamenuplaceholder2_p_lt_webpartzone1_zc_core_v1_three_column_layout_core_v1_three_column_layout_1_core_v1_inpagelink7_btnelem_hyperlink" href="/waste/high-level-waste.html" target="_self"><span id="p_lt_webpartzone3_zmainnav_core_v1_megamenuplaceholder2_p_lt_webpartzone1_zc_core_v1_three_column_layout_core_v1_three_column_layout_1_core_v1_inpagelink7_btnelem_lbltext">high-level waste</span></a> </div><div class="mb-pd-btm col-sm-4"><a id="p_lt_webpartzone3_zmainnav_core_v1_megamenuplaceholder2_p_lt_webpartzone1_zc_core_v1_three_column_layout_core_v1_three_column_layout_2_core_v1_inpagelink2_btnelem_hyperlink" href="/waste/mill-tailings.html" target="_self"><span id="p_lt_webpartzone3_zmainnav_core_v1_megamenuplaceholder2_p_lt_webpartzone1_zc_core_v1_three_column_layout_core_v1_three_column_layout_2_core_v1_inpagelink2_btnelem_lbltext">uranium mill tailings</span></a> <a id="p_lt_webpartzone3_zmainnav_core_v1_megamenuplaceholder2_p_lt_webpartzone1_zc_core_v1_three_column_layout_core_v1_three_column_layout_2_core_v1_inpagelink3_btnelem_hyperlink" href="/waste/llw-disposal.html" target="_self"><span id="p_lt_webpartzone3_zmainnav_core_v1_megamenuplaceholder2_p_lt_webpartzone1_zc_core_v1_three_column_layout_core_v1_three_column_layout_2_core_v1_inpagelink3_btnelem_lbltext">low-level waste disposal</span></a> <a id="p_lt_webpartzone3_zmainnav_core_v1_megamenuplaceholder2_p_lt_webpartzone1_zc_core_v1_three_column_layout_core_v1_three_column_layout_2_core_v1_inpagelink9_btnelem_hyperlink" href="/waste/hlw-disposal.html" target="_self"><span id="p_lt_webpartzone3_zmainnav_core_v1_megamenuplaceholder2_p_lt_webpartzone1_zc_core_v1_three_column_layout_core_v1_three_column_layout_2_core_v1_inpagelink9_btnelem_lbltext">high-level waste disposal</span></a> </div><div class="mb-pd-btm col-sm-4"><a id="p_lt_webpartzone3_zmainnav_core_v1_megamenuplaceholder2_p_lt_webpartzone1_zc_core_v1_three_column_layout_core_v1_three_column_layout_3_core_v1_inpagelink8_btnelem_hyperlink" href="/waste/spent-fuel-storage.html" target="_self"><span id="p_lt_webpartzone3_zmainnav_core_v1_megamenuplaceholder2_p_lt_webpartzone1_zc_core_v1_three_column_layout_core_v1_three_column_layout_3_core_v1_inpagelink8_btnelem_lbltext">storage of spent nuclear fuel</span></a> <a id="p_lt_webpartzone3_zmainnav_core_v1_megamenuplaceholder2_p_lt_webpartzone1_zc_core_v1_three_column_layout_core_v1_three_column_layout_3_core_v1_inpagelink4_btnelem_hyperlink" href="/waste/spent-fuel-transp.html" target="_self"><span id="p_lt_webpartzone3_zmainnav_core_v1_megamenuplaceholder2_p_lt_webpartzone1_zc_core_v1_three_column_layout_core_v1_three_column_layout_3_core_v1_inpagelink4_btnelem_lbltext">transportation of spent nuclear fuel</span></a> <a id="p_lt_webpartzone3_zmainnav_core_v1_megamenuplaceholder2_p_lt_webpartzone1_zc_core_v1_three_column_layout_core_v1_three_column_layout_3_core_v1_inpagelink5_btnelem_hyperlink" href="/about-nrc/regulatory/research.html" target="_self"><span id="p_lt_webpartzone3_zmainnav_core_v1_megamenuplaceholder2_p_lt_webpartzone1_zc_core_v1_three_column_layout_core_v1_three_column_layout_3_core_v1_inpagelink5_btnelem_lbltext">research activities</span></a> </div></div></div><div class="container"><div class="row inner-top-xs general-content "><div class="col-md-12"><hr class="line dashed-line-brand-color-yellow"/><a id="p_lt_webpartzone3_zmainnav_core_v1_megamenuplaceholder2_p_lt_webpartzone1_zc_core_v1_single_column_layout_core_v1_single_column_layout_1_core_v1_inpagelink10_btnelem_hyperlink" class="quick-link" href="/waste/ql-waste.html" target="_self"><span id="p_lt_webpartzone3_zmainnav_core_v1_megamenuplaceholder2_p_lt_webpartzone1_zc_core_v1_single_column_layout_core_v1_single_column_layout_1_core_v1_inpagelink10_btnelem_lbltext">radioactive waste quick links</span></a> </div></div></div></div> </div> </li><li class="nav-item dropdown has-megamenu"> <a class="nav-link dropdown-toggle" href="#" data-bs-toggle="dropdown" aria-expanded="false">nuclear security</a> <div class="dropdown-menu megamenu"> <div class="container"> <div class="row"> <div class="col-12"> <h5><a href="/security.html">nuclear security</a></h5> </div> </div> <div class="container"><div class="row inner-top-xs general-content "><div class="mb-pd-btm col-sm-4"><a id="p_lt_webpartzone3_zmainnav_core_v1_megamenuplaceholder3_p_lt_webpartzone1_zc_core_v1_three_column_layout_core_v1_three_column_layout_1_core_v1_inpagelink_btnelem_hyperlink" href="/security/domestic.html" target="_self"><span id="p_lt_webpartzone3_zmainnav_core_v1_megamenuplaceholder3_p_lt_webpartzone1_zc_core_v1_three_column_layout_core_v1_three_column_layout_1_core_v1_inpagelink_btnelem_lbltext">domestic safeguards</span></a> <a id="p_lt_webpartzone3_zmainnav_core_v1_megamenuplaceholder3_p_lt_webpartzone1_zc_core_v1_three_column_layout_core_v1_three_column_layout_1_core_v1_inpagelink1_btnelem_hyperlink" href="/security/info-security.html" target="_self"><span id="p_lt_webpartzone3_zmainnav_core_v1_megamenuplaceholder3_p_lt_webpartzone1_zc_core_v1_three_column_layout_core_v1_three_column_layout_1_core_v1_inpagelink1_btnelem_lbltext">information security</span></a> <a id="p_lt_webpartzone3_zmainnav_core_v1_megamenuplaceholder3_p_lt_webpartzone1_zc_core_v1_three_column_layout_core_v1_three_column_layout_1_core_v1_inpagelink6_btnelem_hyperlink" href="/security/byproduct.html" target="_self"><span id="p_lt_webpartzone3_zmainnav_core_v1_megamenuplaceholder3_p_lt_webpartzone1_zc_core_v1_three_column_layout_core_v1_three_column_layout_1_core_v1_inpagelink6_btnelem_lbltext">radioactive material security</span></a> </div><div class="mb-pd-btm col-sm-4"><a id="p_lt_webpartzone3_zmainnav_core_v1_megamenuplaceholder3_p_lt_webpartzone1_zc_core_v1_three_column_layout_core_v1_three_column_layout_2_core_v1_inpagelink2_btnelem_hyperlink" href="/security/required-reporting-for-clearance-holders.html" target="_self"><span id="p_lt_webpartzone3_zmainnav_core_v1_megamenuplaceholder3_p_lt_webpartzone1_zc_core_v1_three_column_layout_core_v1_three_column_layout_2_core_v1_inpagelink2_btnelem_lbltext">required reporting for clearance holders</span></a> <a id="p_lt_webpartzone3_zmainnav_core_v1_megamenuplaceholder3_p_lt_webpartzone1_zc_core_v1_three_column_layout_core_v1_three_column_layout_2_core_v1_inpagelink3_btnelem_hyperlink" href="/security/insider-threat-program-for-licensees.html" target="_self"><span id="p_lt_webpartzone3_zmainnav_core_v1_megamenuplaceholder3_p_lt_webpartzone1_zc_core_v1_three_column_layout_core_v1_three_column_layout_2_core_v1_inpagelink3_btnelem_lbltext">insider threat program for licensees</span></a> <a id="p_lt_webpartzone3_zmainnav_core_v1_megamenuplaceholder3_p_lt_webpartzone1_zc_core_v1_three_column_layout_core_v1_three_column_layout_2_core_v1_inpagelink7_btnelem_hyperlink" href="/security/cybersecurity.html" target="_self"><span id="p_lt_webpartzone3_zmainnav_core_v1_megamenuplaceholder3_p_lt_webpartzone1_zc_core_v1_three_column_layout_core_v1_three_column_layout_2_core_v1_inpagelink7_btnelem_lbltext">cybersecurity</span></a> </div><div class="mb-pd-btm col-sm-4"><a id="p_lt_webpartzone3_zmainnav_core_v1_megamenuplaceholder3_p_lt_webpartzone1_zc_core_v1_three_column_layout_core_v1_three_column_layout_3_core_v1_inpagelink4_btnelem_hyperlink" href="/security/chp.html" target="_self"><span id="p_lt_webpartzone3_zmainnav_core_v1_megamenuplaceholder3_p_lt_webpartzone1_zc_core_v1_three_column_layout_core_v1_three_column_layout_3_core_v1_inpagelink4_btnelem_lbltext">criminal history &amp; firearms checks</span></a> <a id="p_lt_webpartzone3_zmainnav_core_v1_megamenuplaceholder3_p_lt_webpartzone1_zc_core_v1_three_column_layout_core_v1_three_column_layout_3_core_v1_inpagelink5_btnelem_hyperlink" href="/security/contactus.html" target="_self"><span id="p_lt_webpartzone3_zmainnav_core_v1_megamenuplaceholder3_p_lt_webpartzone1_zc_core_v1_three_column_layout_core_v1_three_column_layout_3_core_v1_inpagelink5_btnelem_lbltext">contact us</span></a> </div></div></div></div> </div> </li><li class="nav-item dropdown has-megamenu"> <a class="nav-link dropdown-toggle" href="#" data-bs-toggle="dropdown" aria-expanded="false">public meetings & involvement</a> <div class="dropdown-menu megamenu"> <div class="container"> <div class="row"> <div class="col-12"> <h5><a href="/public-involve.html">public meetings & involvement</a></h5> </div> </div> <div class="container"><div class="row inner-top-xs general-content "><div class="mb-pd-btm col-sm-4"><a id="p_lt_webpartzone3_zmainnav_core_v1_megamenuplaceholder4_p_lt_webpartzone1_zc_core_v1_three_column_layout_core_v1_three_column_layout_1_core_v1_inpagelink_btnelem_hyperlink" href="/public-involve/open.html" target="_self"><span id="p_lt_webpartzone3_zmainnav_core_v1_megamenuplaceholder4_p_lt_webpartzone1_zc_core_v1_three_column_layout_core_v1_three_column_layout_1_core_v1_inpagelink_btnelem_lbltext">the nrc approach to open government</span></a> <a id="p_lt_webpartzone3_zmainnav_core_v1_megamenuplaceholder4_p_lt_webpartzone1_zc_core_v1_three_column_layout_core_v1_three_column_layout_1_core_v1_inpagelink1_btnelem_hyperlink" href="/public-involve/public-meetings.html" target="_self"><span id="p_lt_webpartzone3_zmainnav_core_v1_megamenuplaceholder4_p_lt_webpartzone1_zc_core_v1_three_column_layout_core_v1_three_column_layout_1_core_v1_inpagelink1_btnelem_lbltext">about meetings open to the public</span></a> <a id="p_lt_webpartzone3_zmainnav_core_v1_megamenuplaceholder4_p_lt_webpartzone1_zc_core_v1_three_column_layout_core_v1_three_column_layout_1_core_v1_inpagelink6_btnelem_hyperlink" href="/public-involve/conferences.html" target="_self"><span id="p_lt_webpartzone3_zmainnav_core_v1_megamenuplaceholder4_p_lt_webpartzone1_zc_core_v1_three_column_layout_core_v1_three_column_layout_1_core_v1_inpagelink6_btnelem_lbltext">conferences &amp; symposia</span></a> </div><div class="mb-pd-btm col-sm-4"><a id="p_lt_webpartzone3_zmainnav_core_v1_megamenuplaceholder4_p_lt_webpartzone1_zc_core_v1_three_column_layout_core_v1_three_column_layout_2_core_v1_inpagelink7_btnelem_hyperlink" href="/public-involve/doc-comment.html" target="_self"><span id="p_lt_webpartzone3_zmainnav_core_v1_megamenuplaceholder4_p_lt_webpartzone1_zc_core_v1_three_column_layout_core_v1_three_column_layout_2_core_v1_inpagelink7_btnelem_lbltext">documents for comment</span></a> <a id="p_lt_webpartzone3_zmainnav_core_v1_megamenuplaceholder4_p_lt_webpartzone1_zc_core_v1_three_column_layout_core_v1_three_column_layout_2_core_v1_inpagelink8_btnelem_hyperlink" href="/public-involve/info-quality.html" target="_self"><span id="p_lt_webpartzone3_zmainnav_core_v1_megamenuplaceholder4_p_lt_webpartzone1_zc_core_v1_three_column_layout_core_v1_three_column_layout_2_core_v1_inpagelink8_btnelem_lbltext">nrc information quality guidelines</span></a> </div><div class="mb-pd-btm col-sm-4"><a id="p_lt_webpartzone3_zmainnav_core_v1_megamenuplaceholder4_p_lt_webpartzone1_zc_core_v1_three_column_layout_core_v1_three_column_layout_3_core_v1_inpagelink9_btnelem_hyperlink" href="/public-involve/listserver.html" target="_self"><span id="p_lt_webpartzone3_zmainnav_core_v1_megamenuplaceholder4_p_lt_webpartzone1_zc_core_v1_three_column_layout_core_v1_three_column_layout_3_core_v1_inpagelink9_btnelem_lbltext">subscribe to e-mail updates</span></a> <a id="p_lt_webpartzone3_zmainnav_core_v1_megamenuplaceholder4_p_lt_webpartzone1_zc_core_v1_three_column_layout_core_v1_three_column_layout_3_core_v1_inpagelink3_btnelem_hyperlink" href="/public-involve/rss-feeds.html" target="_self"><span id="p_lt_webpartzone3_zmainnav_core_v1_megamenuplaceholder4_p_lt_webpartzone1_zc_core_v1_three_column_layout_core_v1_three_column_layout_3_core_v1_inpagelink3_btnelem_lbltext">really simple syndication (rss) feeds</span></a> </div></div></div><div class="container"><div class="row inner-top-xs general-content "><div class="col-md-12"><hr class="line dashed-line-brand-color-yellow"/></div></div></div><div class="container"><div class="row inner-top-xs general-content "><div class="mb-pd-btm col-md-4"><a id="p_lt_webpartzone3_zmainnav_core_v1_megamenuplaceholder4_p_lt_webpartzone1_zc_core_v1_three_column_layout1_core_v1_three_column_layout1_1_core_v1_inpagelink4_btnelem_hyperlink" class="quick-link" href="/public-involve/public-meetings/schedule.html" target="_self"><span id="p_lt_webpartzone3_zmainnav_core_v1_megamenuplaceholder4_p_lt_webpartzone1_zc_core_v1_three_column_layout1_core_v1_three_column_layout1_1_core_v1_inpagelink4_btnelem_lbltext">commission schedule</span></a> <a id="p_lt_webpartzone3_zmainnav_core_v1_megamenuplaceholder4_p_lt_webpartzone1_zc_core_v1_three_column_layout1_core_v1_three_column_layout1_1_core_v1_inpagelink5_btnelem_hyperlink" class="quick-link" href="/pmns/mtg" target="_self"><span id="p_lt_webpartzone3_zmainnav_core_v1_megamenuplaceholder4_p_lt_webpartzone1_zc_core_v1_three_column_layout1_core_v1_three_column_layout1_1_core_v1_inpagelink5_btnelem_lbltext">public meeting schedule</span></a> </div><div class="mb-pd-btm col-md-4"><a id="p_lt_webpartzone3_zmainnav_core_v1_megamenuplaceholder4_p_lt_webpartzone1_zc_core_v1_three_column_layout1_core_v1_three_column_layout1_2_core_v1_inpagelink10_btnelem_hyperlink" class="quick-link" href="/about-nrc/regulatory/adjudicatory.html" target="_self"><span id="p_lt_webpartzone3_zmainnav_core_v1_megamenuplaceholder4_p_lt_webpartzone1_zc_core_v1_three_column_layout1_core_v1_three_column_layout1_2_core_v1_inpagelink10_btnelem_lbltext">adjudications (hearings)</span></a> <a id="p_lt_webpartzone3_zmainnav_core_v1_megamenuplaceholder4_p_lt_webpartzone1_zc_core_v1_three_column_layout1_core_v1_three_column_layout1_2_core_v1_inpagelink11_btnelem_hyperlink" class="quick-link" href="/site-help/e-submittals/adjudicatory-sub.html" target="_self"><span id="p_lt_webpartzone3_zmainnav_core_v1_megamenuplaceholder4_p_lt_webpartzone1_zc_core_v1_three_column_layout1_core_v1_three_column_layout1_2_core_v1_inpagelink11_btnelem_lbltext">adjudicatory submissions</span></a> </div><div class="mb-pd-btm col-md-4"><a id="p_lt_webpartzone3_zmainnav_core_v1_megamenuplaceholder4_p_lt_webpartzone1_zc_core_v1_three_column_layout1_core_v1_three_column_layout1_3_core_v1_inpagelink12_btnelem_hyperlink" class="quick-link" href="/about-nrc/regulatory/rulemaking/rules-petitions.html" target="_self"><span id="p_lt_webpartzone3_zmainnav_core_v1_megamenuplaceholder4_p_lt_webpartzone1_zc_core_v1_three_column_layout1_core_v1_three_column_layout1_3_core_v1_inpagelink12_btnelem_lbltext">nrc rules and petitions</span></a> </div></div></div></div> </div> </li><li class="nav-item dropdown has-megamenu"> <a class="nav-link dropdown-toggle" href="#" data-bs-toggle="dropdown" aria-expanded="false">nrc library</a> <div class="dropdown-menu megamenu"> <div class="container"> <div class="row"> <div class="col-12"> <h5><a href="/reading-rm.html">nrc library</a></h5> </div> </div> <div class="container"><div class="row inner-top-xs general-content "><div class="mb-pd-btm col-sm-4"><a id="p_lt_webpartzone3_zmainnav_core_v1_megamenuplaceholder5_p_lt_webpartzone1_zc_core_v1_three_column_layout_core_v1_three_column_layout_1_core_v1_inpagelink_btnelem_hyperlink" href="/reading-rm/basic-ref.html" target="_self"><span id="p_lt_webpartzone3_zmainnav_core_v1_megamenuplaceholder5_p_lt_webpartzone1_zc_core_v1_three_column_layout_core_v1_three_column_layout_1_core_v1_inpagelink_btnelem_lbltext">basic references</span></a> <a id="p_lt_webpartzone3_zmainnav_core_v1_megamenuplaceholder5_p_lt_webpartzone1_zc_core_v1_three_column_layout_core_v1_three_column_layout_1_core_v1_inpagelink1_btnelem_hyperlink" href="/reading-rm/doc-collections/index.html" target="_self"><span id="p_lt_webpartzone3_zmainnav_core_v1_megamenuplaceholder5_p_lt_webpartzone1_zc_core_v1_three_column_layout_core_v1_three_column_layout_1_core_v1_inpagelink1_btnelem_lbltext">document collections</span></a> <a id="p_lt_webpartzone3_zmainnav_core_v1_megamenuplaceholder5_p_lt_webpartzone1_zc_core_v1_three_column_layout_core_v1_three_column_layout_1_core_v1_inpagelink6_btnelem_hyperlink" href="/reading-rm/adams.html" target="_self"><span id="p_lt_webpartzone3_zmainnav_core_v1_megamenuplaceholder5_p_lt_webpartzone1_zc_core_v1_three_column_layout_core_v1_three_column_layout_1_core_v1_inpagelink6_btnelem_lbltext">adams public documents</span></a> <a id="p_lt_webpartzone3_zmainnav_core_v1_megamenuplaceholder5_p_lt_webpartzone1_zc_core_v1_three_column_layout_core_v1_three_column_layout_1_core_v1_inpagelink8_btnelem_hyperlink" href="/reading-rm/pdr.html" target="_self"><span id="p_lt_webpartzone3_zmainnav_core_v1_megamenuplaceholder5_p_lt_webpartzone1_zc_core_v1_three_column_layout_core_v1_three_column_layout_1_core_v1_inpagelink8_btnelem_lbltext">public document room</span></a> <a id="p_lt_webpartzone3_zmainnav_core_v1_megamenuplaceholder5_p_lt_webpartzone1_zc_core_v1_three_column_layout_core_v1_three_column_layout_1_core_v1_inpagelink7_btnelem_hyperlink" href="/reading-rm/lsn/index.html" target="_self"><span id="p_lt_webpartzone3_zmainnav_core_v1_megamenuplaceholder5_p_lt_webpartzone1_zc_core_v1_three_column_layout_core_v1_three_column_layout_1_core_v1_inpagelink7_btnelem_lbltext">lsn library</span></a> </div><div class="mb-pd-btm col-sm-4"><a id="p_lt_webpartzone3_zmainnav_core_v1_megamenuplaceholder5_p_lt_webpartzone1_zc_core_v1_three_column_layout_core_v1_three_column_layout_2_core_v1_inpagelink2_btnelem_hyperlink" href="/reading-rm/foia/foia-privacy.html" target="_self"><span id="p_lt_webpartzone3_zmainnav_core_v1_megamenuplaceholder5_p_lt_webpartzone1_zc_core_v1_three_column_layout_core_v1_three_column_layout_2_core_v1_inpagelink2_btnelem_lbltext">foia &amp; privacy act</span></a> <a id="p_lt_webpartzone3_zmainnav_core_v1_megamenuplaceholder5_p_lt_webpartzone1_zc_core_v1_three_column_layout_core_v1_three_column_layout_2_core_v1_inpagelink3_btnelem_hyperlink" href="/reading-rm/photo-gallery/index.html" target="_self"><span id="p_lt_webpartzone3_zmainnav_core_v1_megamenuplaceholder5_p_lt_webpartzone1_zc_core_v1_three_column_layout_core_v1_three_column_layout_2_core_v1_inpagelink3_btnelem_lbltext">photos &amp; videos</span></a> <a id="p_lt_webpartzone3_zmainnav_core_v1_megamenuplaceholder5_p_lt_webpartzone1_zc_core_v1_three_column_layout_core_v1_three_column_layout_2_core_v1_inpagelink9_btnelem_hyperlink" href="/reading-rm/records-mgmt.html" target="_self"><span id="p_lt_webpartzone3_zmainnav_core_v1_megamenuplaceholder5_p_lt_webpartzone1_zc_core_v1_three_column_layout_core_v1_three_column_layout_2_core_v1_inpagelink9_btnelem_lbltext">records management</span></a> <a id="p_lt_webpartzone3_zmainnav_core_v1_megamenuplaceholder5_p_lt_webpartzone1_zc_core_v1_three_column_layout_core_v1_three_column_layout_2_core_v1_inpagelink10_btnelem_hyperlink" href="/reading-rm/training.html" target="_self"><span id="p_lt_webpartzone3_zmainnav_core_v1_megamenuplaceholder5_p_lt_webpartzone1_zc_core_v1_three_column_layout_core_v1_three_column_layout_2_core_v1_inpagelink10_btnelem_lbltext">training courses</span></a> </div><div class="mb-pd-btm col-sm-4"><a id="p_lt_webpartzone3_zmainnav_core_v1_megamenuplaceholder5_p_lt_webpartzone1_zc_core_v1_three_column_layout_core_v1_three_column_layout_3_core_v1_inpagelink11_btnelem_hyperlink" href="/reading-rm/faqlist.html" target="_self"><span id="p_lt_webpartzone3_zmainnav_core_v1_megamenuplaceholder5_p_lt_webpartzone1_zc_core_v1_three_column_layout_core_v1_three_column_layout_3_core_v1_inpagelink11_btnelem_lbltext">faq index</span></a> <a id="p_lt_webpartzone3_zmainnav_core_v1_megamenuplaceholder5_p_lt_webpartzone1_zc_core_v1_three_column_layout_core_v1_three_column_layout_3_core_v1_inpagelink4_btnelem_hyperlink" href="/reading-rm/copies-docs.html" target="_self"><span id="p_lt_webpartzone3_zmainnav_core_v1_megamenuplaceholder5_p_lt_webpartzone1_zc_core_v1_three_column_layout_core_v1_three_column_layout_3_core_v1_inpagelink4_btnelem_lbltext">get copies of documents</span></a> <a id="p_lt_webpartzone3_zmainnav_core_v1_megamenuplaceholder5_p_lt_webpartzone1_zc_core_v1_three_column_layout_core_v1_three_column_layout_3_core_v1_inpagelink5_btnelem_hyperlink" href="/reading-rm/sensitive-info.html" target="_self"><span id="p_lt_webpartzone3_zmainnav_core_v1_megamenuplaceholder5_p_lt_webpartzone1_zc_core_v1_three_column_layout_core_v1_three_column_layout_3_core_v1_inpagelink5_btnelem_lbltext">withholding of sensitive information</span></a> <a id="p_lt_webpartzone3_zmainnav_core_v1_megamenuplaceholder5_p_lt_webpartzone1_zc_core_v1_three_column_layout_core_v1_three_column_layout_3_core_v1_inpagelink12_btnelem_hyperlink" href="/reading-rm/cui.html" target="_self"><span id="p_lt_webpartzone3_zmainnav_core_v1_megamenuplaceholder5_p_lt_webpartzone1_zc_core_v1_three_column_layout_core_v1_three_column_layout_3_core_v1_inpagelink12_btnelem_lbltext">controlled unclassified information program (cui)</span></a> </div></div></div><div class="container"><div class="row inner-top-xs general-content "><div class="col-md-12"><hr class="line dashed-line-brand-color-yellow"/><a id="p_lt_webpartzone3_zmainnav_core_v1_megamenuplaceholder5_p_lt_webpartzone1_zc_core_v1_single_column_layout_core_v1_single_column_layout_1_core_v1_inpagelink13_btnelem_hyperlink" class="quick-link" href="/about-nrc/regulatory/adjudicatory.html#ehd" target="_self"><span id="p_lt_webpartzone3_zmainnav_core_v1_megamenuplaceholder5_p_lt_webpartzone1_zc_core_v1_single_column_layout_core_v1_single_column_layout_1_core_v1_inpagelink13_btnelem_lbltext">electronic hearing docket</span></a> </div></div></div></div> </div> </li><li class="nav-item dropdown has-megamenu"> <a class="nav-link dropdown-toggle" href="#" data-bs-toggle="dropdown" aria-expanded="false">about nrc</a> <div class="dropdown-menu megamenu"> <div class="container"> <div class="row"> <div class="col-12"> <h5><a href="/about-nrc.html">about nrc</a></h5> </div> </div> <div class="container"><div class="row inner-top-xs general-content "><div class="mb-pd-btm col-sm-4"><a id="p_lt_webpartzone3_zmainnav_core_v1_megamenuplaceholder6_p_lt_webpartzone1_zc_core_v1_three_column_layout_core_v1_three_column_layout_1_core_v1_inpagelink_btnelem_hyperlink" href="/about-nrc/organization/commfuncdesc.html" target="_self"><span id="p_lt_webpartzone3_zmainnav_core_v1_megamenuplaceholder6_p_lt_webpartzone1_zc_core_v1_three_column_layout_core_v1_three_column_layout_1_core_v1_inpagelink_btnelem_lbltext">the commission</span></a> <a id="p_lt_webpartzone3_zmainnav_core_v1_megamenuplaceholder6_p_lt_webpartzone1_zc_core_v1_three_column_layout_core_v1_three_column_layout_1_core_v1_inpagelink1_btnelem_hyperlink" href="/about-nrc/organization.html" target="_self"><span id="p_lt_webpartzone3_zmainnav_core_v1_megamenuplaceholder6_p_lt_webpartzone1_zc_core_v1_three_column_layout_core_v1_three_column_layout_1_core_v1_inpagelink1_btnelem_lbltext">organization &amp; functions</span></a> <a id="p_lt_webpartzone3_zmainnav_core_v1_megamenuplaceholder6_p_lt_webpartzone1_zc_core_v1_three_column_layout_core_v1_three_column_layout_1_core_v1_inpagelink6_btnelem_hyperlink" href="/ai.html" target="_self"><span id="p_lt_webpartzone3_zmainnav_core_v1_megamenuplaceholder6_p_lt_webpartzone1_zc_core_v1_three_column_layout_core_v1_three_column_layout_1_core_v1_inpagelink6_btnelem_lbltext">artificial intelligence</span></a> <a id="p_lt_webpartzone3_zmainnav_core_v1_megamenuplaceholder6_p_lt_webpartzone1_zc_core_v1_three_column_layout_core_v1_three_column_layout_1_core_v1_inpagelink4_btnelem_hyperlink" href="/about-nrc/governing-laws.html" target="_self"><span id="p_lt_webpartzone3_zmainnav_core_v1_megamenuplaceholder6_p_lt_webpartzone1_zc_core_v1_three_column_layout_core_v1_three_column_layout_1_core_v1_inpagelink4_btnelem_lbltext">governing legislation</span></a> <a id="p_lt_webpartzone3_zmainnav_core_v1_megamenuplaceholder6_p_lt_webpartzone1_zc_core_v1_three_column_layout_core_v1_three_column_layout_1_core_v1_inpagelink7_btnelem_hyperlink" href="/about-nrc/plans-performance.html" target="_self"><span id="p_lt_webpartzone3_zmainnav_core_v1_megamenuplaceholder6_p_lt_webpartzone1_zc_core_v1_three_column_layout_core_v1_three_column_layout_1_core_v1_inpagelink7_btnelem_lbltext">plans, budget, &amp; performance</span></a> <a id="p_lt_webpartzone3_zmainnav_core_v1_megamenuplaceholder6_p_lt_webpartzone1_zc_core_v1_three_column_layout_core_v1_three_column_layout_1_core_v1_inpagelink8_btnelem_hyperlink" href="/about-nrc/locations.html" target="_self"><span id="p_lt_webpartzone3_zmainnav_core_v1_megamenuplaceholder6_p_lt_webpartzone1_zc_core_v1_three_column_layout_core_v1_three_column_layout_1_core_v1_inpagelink8_btnelem_lbltext">locations</span></a> <a id="p_lt_webpartzone3_zmainnav_core_v1_megamenuplaceholder6_p_lt_webpartzone1_zc_core_v1_three_column_layout_core_v1_three_column_layout_1_core_v1_inpagelink9_btnelem_hyperlink" href="/about-nrc/history.html" target="_self"><span id="p_lt_webpartzone3_zmainnav_core_v1_megamenuplaceholder6_p_lt_webpartzone1_zc_core_v1_three_column_layout_core_v1_three_column_layout_1_core_v1_inpagelink9_btnelem_lbltext">history</span></a> <a id="p_lt_webpartzone3_zmainnav_core_v1_megamenuplaceholder6_p_lt_webpartzone1_zc_core_v1_three_column_layout_core_v1_three_column_layout_1_core_v1_inpagelink10_btnelem_hyperlink" href="/about-nrc/values.html" target="_self"><span id="p_lt_webpartzone3_zmainnav_core_v1_megamenuplaceholder6_p_lt_webpartzone1_zc_core_v1_three_column_layout_core_v1_three_column_layout_1_core_v1_inpagelink10_btnelem_lbltext">values</span></a> <a id="p_lt_webpartzone3_zmainnav_core_v1_megamenuplaceholder6_p_lt_webpartzone1_zc_core_v1_three_column_layout_core_v1_three_column_layout_1_core_v1_inpagelink2_btnelem_hyperlink" href="/about-nrc/policymaking.html" target="_self"><span id="p_lt_webpartzone3_zmainnav_core_v1_megamenuplaceholder6_p_lt_webpartzone1_zc_core_v1_three_column_layout_core_v1_three_column_layout_1_core_v1_inpagelink2_btnelem_lbltext">direction-setting &amp; policymaking</span></a> <a id="p_lt_webpartzone3_zmainnav_core_v1_megamenuplaceholder6_p_lt_webpartzone1_zc_core_v1_three_column_layout_core_v1_three_column_layout_1_core_v1_inpagelink3_btnelem_hyperlink" href="/about-nrc/regulatory/research.html" target="_self"><span id="p_lt_webpartzone3_zmainnav_core_v1_megamenuplaceholder6_p_lt_webpartzone1_zc_core_v1_three_column_layout_core_v1_three_column_layout_1_core_v1_inpagelink3_btnelem_lbltext">research activities</span></a> </div><div class="mb-pd-btm col-sm-4"><a id="p_lt_webpartzone3_zmainnav_core_v1_megamenuplaceholder6_p_lt_webpartzone1_zc_core_v1_three_column_layout_core_v1_three_column_layout_2_core_v1_inpagelink11_btnelem_hyperlink" href="/about-nrc/radiation.html" target="_self"><span id="p_lt_webpartzone3_zmainnav_core_v1_megamenuplaceholder6_p_lt_webpartzone1_zc_core_v1_three_column_layout_core_v1_three_column_layout_2_core_v1_inpagelink11_btnelem_lbltext">radiation protection</span></a> <a id="p_lt_webpartzone3_zmainnav_core_v1_megamenuplaceholder6_p_lt_webpartzone1_zc_core_v1_three_column_layout_core_v1_three_column_layout_2_core_v1_inpagelink12_btnelem_hyperlink" href="/about-nrc/fire-protection.html" target="_self"><span id="p_lt_webpartzone3_zmainnav_core_v1_megamenuplaceholder6_p_lt_webpartzone1_zc_core_v1_three_column_layout_core_v1_three_column_layout_2_core_v1_inpagelink12_btnelem_lbltext">fire protection</span></a> <a id="p_lt_webpartzone3_zmainnav_core_v1_megamenuplaceholder6_p_lt_webpartzone1_zc_core_v1_three_column_layout_core_v1_three_column_layout_2_core_v1_inpagelink13_btnelem_hyperlink" href="/about-nrc/safety-culture.html" target="_self"><span id="p_lt_webpartzone3_zmainnav_core_v1_megamenuplaceholder6_p_lt_webpartzone1_zc_core_v1_three_column_layout_core_v1_three_column_layout_2_core_v1_inpagelink13_btnelem_lbltext">safety culture</span></a> <a id="p_lt_webpartzone3_zmainnav_core_v1_megamenuplaceholder6_p_lt_webpartzone1_zc_core_v1_three_column_layout_core_v1_three_column_layout_2_core_v1_inpagelink14_btnelem_hyperlink" href="/about-nrc/regulatory.html" target="_self"><span id="p_lt_webpartzone3_zmainnav_core_v1_megamenuplaceholder6_p_lt_webpartzone1_zc_core_v1_three_column_layout_core_v1_three_column_layout_2_core_v1_inpagelink14_btnelem_lbltext">how we regulate</span></a> <a id="p_lt_webpartzone3_zmainnav_core_v1_megamenuplaceholder6_p_lt_webpartzone1_zc_core_v1_three_column_layout_core_v1_three_column_layout_2_core_v1_inpagelink15_btnelem_hyperlink" href="/about-nrc/emerg-preparedness.html" target="_self"><span id="p_lt_webpartzone3_zmainnav_core_v1_megamenuplaceholder6_p_lt_webpartzone1_zc_core_v1_three_column_layout_core_v1_three_column_layout_2_core_v1_inpagelink15_btnelem_lbltext">emergency preparedness &amp; response</span></a> <a id="p_lt_webpartzone3_zmainnav_core_v1_megamenuplaceholder6_p_lt_webpartzone1_zc_core_v1_three_column_layout_core_v1_three_column_layout_2_core_v1_inpagelink5_btnelem_hyperlink" href="/about-nrc/congress-affairs.html" target="_self"><span id="p_lt_webpartzone3_zmainnav_core_v1_megamenuplaceholder6_p_lt_webpartzone1_zc_core_v1_three_column_layout_core_v1_three_column_layout_2_core_v1_inpagelink5_btnelem_lbltext">congressional affairs</span></a> <a id="p_lt_webpartzone3_zmainnav_core_v1_megamenuplaceholder6_p_lt_webpartzone1_zc_core_v1_three_column_layout_core_v1_three_column_layout_2_core_v1_inpagelink16_btnelem_hyperlink" href="/about-nrc/regulatory/enforcement.html" target="_self"><span id="p_lt_webpartzone3_zmainnav_core_v1_megamenuplaceholder6_p_lt_webpartzone1_zc_core_v1_three_column_layout_core_v1_three_column_layout_2_core_v1_inpagelink16_btnelem_lbltext">enforcement</span></a> <a id="p_lt_webpartzone3_zmainnav_core_v1_megamenuplaceholder6_p_lt_webpartzone1_zc_core_v1_three_column_layout_core_v1_three_column_layout_2_core_v1_inpagelink17_btnelem_hyperlink" href="/about-nrc/international.html" target="_self"><span id="p_lt_webpartzone3_zmainnav_core_v1_megamenuplaceholder6_p_lt_webpartzone1_zc_core_v1_three_column_layout_core_v1_three_column_layout_2_core_v1_inpagelink17_btnelem_lbltext">international programs</span></a> <a id="p_lt_webpartzone3_zmainnav_core_v1_megamenuplaceholder6_p_lt_webpartzone1_zc_core_v1_three_column_layout_core_v1_three_column_layout_2_core_v1_inpagelink18_btnelem_hyperlink" href="/about-nrc/state-tribal.html" target="_self"><span id="p_lt_webpartzone3_zmainnav_core_v1_megamenuplaceholder6_p_lt_webpartzone1_zc_core_v1_three_column_layout_core_v1_three_column_layout_2_core_v1_inpagelink18_btnelem_lbltext">state &amp; tribal programs</span></a> </div><div class="mb-pd-btm col-sm-4"><a id="p_lt_webpartzone3_zmainnav_core_v1_megamenuplaceholder6_p_lt_webpartzone1_zc_core_v1_three_column_layout_core_v1_three_column_layout_3_core_v1_inpagelink19_btnelem_hyperlink" href="/about-nrc/alt-dispute-resolution.html" target="_self"><span id="p_lt_webpartzone3_zmainnav_core_v1_megamenuplaceholder6_p_lt_webpartzone1_zc_core_v1_three_column_layout_core_v1_three_column_layout_3_core_v1_inpagelink19_btnelem_lbltext">alternative dispute resolution programs</span></a> <a id="p_lt_webpartzone3_zmainnav_core_v1_megamenuplaceholder6_p_lt_webpartzone1_zc_core_v1_three_column_layout_core_v1_three_column_layout_3_core_v1_inpagelink20_btnelem_hyperlink" href="/privacy/index.html" target="_self"><span id="p_lt_webpartzone3_zmainnav_core_v1_megamenuplaceholder6_p_lt_webpartzone1_zc_core_v1_three_column_layout_core_v1_three_column_layout_3_core_v1_inpagelink20_btnelem_lbltext">privacy program</span></a> <a id="p_lt_webpartzone3_zmainnav_core_v1_megamenuplaceholder6_p_lt_webpartzone1_zc_core_v1_three_column_layout_core_v1_three_column_layout_3_core_v1_inpagelink21_btnelem_hyperlink" href="/about-nrc/civil-rights.html" target="_self"><span id="p_lt_webpartzone3_zmainnav_core_v1_megamenuplaceholder6_p_lt_webpartzone1_zc_core_v1_three_column_layout_core_v1_three_column_layout_3_core_v1_inpagelink21_btnelem_lbltext">civil rights program</span></a> <a id="p_lt_webpartzone3_zmainnav_core_v1_megamenuplaceholder6_p_lt_webpartzone1_zc_core_v1_three_column_layout_core_v1_three_column_layout_3_core_v1_inpagelink22_btnelem_hyperlink" href="/about-nrc/contactus.html" target="_self"><span id="p_lt_webpartzone3_zmainnav_core_v1_megamenuplaceholder6_p_lt_webpartzone1_zc_core_v1_three_column_layout_core_v1_three_column_layout_3_core_v1_inpagelink22_btnelem_lbltext">contact us</span></a> <a id="p_lt_webpartzone3_zmainnav_core_v1_megamenuplaceholder6_p_lt_webpartzone1_zc_core_v1_three_column_layout_core_v1_three_column_layout_3_core_v1_inpagelink23_btnelem_hyperlink" href="/about-nrc/employment.html" target="_self"><span id="p_lt_webpartzone3_zmainnav_core_v1_megamenuplaceholder6_p_lt_webpartzone1_zc_core_v1_three_column_layout_core_v1_three_column_layout_3_core_v1_inpagelink23_btnelem_lbltext">career opportunities</span></a> <a id="p_lt_webpartzone3_zmainnav_core_v1_megamenuplaceholder6_p_lt_webpartzone1_zc_core_v1_three_column_layout_core_v1_three_column_layout_3_core_v1_inpagelink24_btnelem_hyperlink" href="/about-nrc/contracting.html" target="_self"><span id="p_lt_webpartzone3_zmainnav_core_v1_megamenuplaceholder6_p_lt_webpartzone1_zc_core_v1_three_column_layout_core_v1_three_column_layout_3_core_v1_inpagelink24_btnelem_lbltext">contracting opportunities</span></a> <a id="p_lt_webpartzone3_zmainnav_core_v1_megamenuplaceholder6_p_lt_webpartzone1_zc_core_v1_three_column_layout_core_v1_three_column_layout_3_core_v1_inpagelink25_btnelem_hyperlink" href="/about-nrc/contracting/small-business.html" target="_self"><span id="p_lt_webpartzone3_zmainnav_core_v1_megamenuplaceholder6_p_lt_webpartzone1_zc_core_v1_three_column_layout_core_v1_three_column_layout_3_core_v1_inpagelink25_btnelem_lbltext">small businesses</span></a> <a id="p_lt_webpartzone3_zmainnav_core_v1_megamenuplaceholder6_p_lt_webpartzone1_zc_core_v1_three_column_layout_core_v1_three_column_layout_3_core_v1_inpagelink26_btnelem_hyperlink" href="/about-nrc/grants.html" target="_self"><span id="p_lt_webpartzone3_zmainnav_core_v1_megamenuplaceholder6_p_lt_webpartzone1_zc_core_v1_three_column_layout_core_v1_three_column_layout_3_core_v1_inpagelink26_btnelem_lbltext">grant opportunities</span></a> <a id="p_lt_webpartzone3_zmainnav_core_v1_megamenuplaceholder6_p_lt_webpartzone1_zc_core_v1_three_column_layout_core_v1_three_column_layout_3_core_v1_inpagelink27_btnelem_hyperlink" href="/about-nrc/generic-schedules.html" target="_self"><span id="p_lt_webpartzone3_zmainnav_core_v1_megamenuplaceholder6_p_lt_webpartzone1_zc_core_v1_three_column_layout_core_v1_three_column_layout_3_core_v1_inpagelink27_btnelem_lbltext">generic schedules</span></a> </div></div></div></div> </div> </li> </ul> </div> </nav> <main> <p style="margin:15px;"><em>the u.s. nuclear regulatory commission is in the process of rescinding or revising guidance and policies posted on this webpage in accordance with executive order 14151 <a href="https://www.federalregister.gov/documents/2025/01/29/2025-01953/ending-radical-and-wasteful-government-dei-programs-and-preferencing">ending radical and wasteful government dei programs and preferencing</a>, and executive order 14168 <a href="https://www.federalregister.gov/documents/2025/01/30/2025-02090/defending-women-from-gender-ideology-extremism-and-restoring-biological-truth-to-the-federal">defending women from gender ideology extremism and restoring biological truth to the federal government</a>. in the interim, any previously issued diversity, equity, inclusion, or gender-related guidance on this webpage should be considered rescinded that is inconsistent with these executive orders.</em></p> <section id="hero" class="content-width-hero-slider primary-background height-sm"> <div class="container"> <div id="owl-main" class="owl-carousel height-sm owl-inner-nav owl-ui-lg"> <div class="item herobackground-59 img-bg img-bg-soft"> <span role='img' aria-label='the words: &#39;protecting people and the environment&#39; on a light blue background, over a silhouette image of a city park with trees, a park bench and people walking, shown participating in activities, i.e., a person walking a dog, a family - parents and child walking together, a person reading book sitting nearby tree and a person feeding birds; the trees in the foreground are dark silhouettes, and the trees in the background are green silhouettes'></span> <style type="text/css"> .herobackground-59{background: url(/cdn/opa-homepage-images/seasonal/q1-mobile.png); background-repeat: no-repeat !important}@media only screen and (min-width: 62.5em){.herobackground-59{background: url(/cdn/opa-homepage-images/seasonal/q1-hero.png)}}</style> <div class="container"> <div class="caption vertical-center text-center"> <h1 class="fadeindown-1 white"></h1> <p class="fadeindown-2 white"><div style="background-color: rgba(238, 238, 238, 0.75); position: absolute; bottom: 1em; left: 0px; padding: 6px 20px 6px 20px; width: 100%;text-align:center;"><!-- <p style="color:#425e71!important;font-weight:bold; font-size:1.6em; line-height:1.1;">nrc mission:</p> --> <p style="color:#333!important;font-size:2em;font-weight:bold;"><u><em>updated</em></u> nrc mission</p> </div> </p> <div class="fadeindown-3"> <a href='/about-nrc.html#142873' class='btn btn-medium primary-background'>learn more</a> </div> </div> </div> </div> <div class="item herobackground-402 img-bg img-bg-soft"> <span role='img' aria-label='nrc commissioner christopher hanson and nrc staff member get a briefing in the hq operations center during cobalt magnet 2025, and interagency radiological exercise based on a simulated accident at a fictional nuclear power plant.'></span> <style type="text/css"> .herobackground-402{background: url(/cdn/opa-homepage-images/2025-homepage/homepage-03182025-mobile.jpg); background-repeat: no-repeat !important}@media only screen and (min-width: 62.5em){.herobackground-402{background: url(/cdn/opa-homepage-images/2025-homepage/homepage-03182025.jpg)}}</style> <div class="container"> <div class="caption vertical-center text-center"> <h1 class="fadeindown-1 black"></h1> <div class="fadeindown-3"> <a href='/homepage/features.html#150590' class='btn btn-medium primary-background'>learn more</a> </div> </div> </div> </div> <div class="item herobackground-382 img-bg img-bg-soft"> <span role='img' aria-label='nrc staff who volunteered throughout the 2025 regulatory information conference pause from their activities for a photo. the hybrid conference featured three days of presentations, plenary sessions and discussions among some 3,300 registrants. the 2026 conference is slated for march 10-12.'></span> <style type="text/css"> .herobackground-382{background: url(/cdn/opa-homepage-images/2025-homepage/homepage-03132025-mobile.jpg); background-repeat: no-repeat !important}@media only screen and (min-width: 62.5em){.herobackground-382{background: url(/cdn/opa-homepage-images/2025-homepage/homepage-03142025.jpg)}}</style> <div class="container"> <div class="caption vertical-center text-center"> <h1 class="fadeindown-1 black"></h1> <div class="fadeindown-3"> <a href='/homepage/features.html#149694' class='btn btn-medium primary-background'>learn more</a> </div> </div> </div> </div> <div class="item herobackground-356 img-bg img-bg-soft"> <span role='img' aria-label='an audience of nrc staff and stakeholders listen as a panel discusses aspects of restarting decommissioning nuclear power plants during the nrcs regulatory information conference.'></span> <style type="text/css"> .herobackground-356{background: url(/cdn/opa-homepage-images/2025-homepage/homepage-03122025-mobile.jpg); background-repeat: no-repeat !important}@media only screen and (min-width: 62.5em){.herobackground-356{background: url(/cdn/opa-homepage-images/2025-homepage/homepage-03122025.jpg)}}</style> <div class="container"> <div class="caption vertical-center text-center"> <h1 class="fadeindown-1 black"></h1> <div class="fadeindown-3"> <a href='/homepage/features.html#148412' class='btn btn-medium primary-background'>learn more</a> </div> </div> </div> </div> <div class="item herobackground-347 img-bg img-bg-soft"> <span role='img' aria-label='nrc chairman david wright shares a light moment with u.s. sen. shelley moore capito during the q&amp;a portion of her special plenary session at the 37th annual regulatory information conference.'></span> <style type="text/css"> .herobackground-347{background: url(/cdn/opa-homepage-images/2025-homepage/homepage-03112025a-mobile.jpg); background-repeat: no-repeat !important}@media only screen and (min-width: 62.5em){.herobackground-347{background: url(/cdn/opa-homepage-images/2025-homepage/homepage-03112025a.jpg)}}</style> <div class="container"> <div class="caption vertical-center text-center"> <h1 class="fadeindown-1 black"></h1> <div class="fadeindown-3"> <a href='/homepage/features.html#148293' class='btn btn-medium primary-background'>learn more</a> </div> </div> </div> </div> <div class="item herobackground-393 img-bg img-bg-soft"> <span role='img' aria-label='nrc chairman david wright shares a light moment with u.s. sen. shelley moore capito during the q&amp;a portion of her special plenary session at the 37th annual regulatory information conference.'></span> <style type="text/css"> .herobackground-393{background: url(/cdn/opa-homepage-images/2025-homepage/homepage-03112025b-mobile.jpg); background-repeat: no-repeat !important}@media only screen and (min-width: 62.5em){.herobackground-393{background: url(/cdn/opa-homepage-images/2025-homepage/homepage-03112025b.jpg)}}</style> <div class="container"> <div class="caption vertical-center text-center"> <h1 class="fadeindown-1 black"></h1> <div class="fadeindown-3"> <a href='/homepage/features.html#150159' class='btn btn-medium primary-background'>learn more</a> </div> </div> </div> </div> <div class="item herobackground-387 img-bg img-bg-soft"> <span role='img' aria-label='nrc commissioner annie caputo, center left, stands with panelists, including nrc staff and industry officials, who explored the topic elevating nrc safety and efficiency through risk-informed decision-making during a technical session she chaired at the nrcs regulatory information conference. '></span> <style type="text/css"> .herobackground-387{background: url(/cdn/opa-homepage-images/2025-homepage/homepage-03132025-mobile.jpg); background-repeat: no-repeat !important}@media only screen and (min-width: 62.5em){.herobackground-387{background: url(/cdn/opa-homepage-images/2025-homepage/homepage-03132025.jpg)}}</style> <div class="container"> <div class="caption vertical-center text-center"> <h1 class="fadeindown-1 black"></h1> <div class="fadeindown-3"> <a href='/homepage/features.html#150063' class='btn btn-medium primary-background'>learn more</a> </div> </div> </div> </div> </div> </div> </section> <div class="container inner-top-xs"> <div class="row"> <div class="col-lg-4 mb-3"> <h3 class='text-left white primary-background-heading' >spotlight</h3> <div class="sidenav list home"> <ul > <li><a href="/about-nrc/organization/commfuncdesc.html" target="_self">the commission</a></li><li><a href="/about-nrc/governing-laws/advance-act.html" target="_self">advance act</a></li><li><a href="/info-finder/decommissioning/index.html#restart" target="_self">plant restarts</a></li><li><a href="/ai.html" target="_self">artificial intelligence</a></li><li><a href="/reactors/new-reactors/advanced.html" target="_self">advanced reactors</a></li><li><a href="/reading-rm/doc-collections/nuregs/staff/sr2220/v8/index.html" target="_self">agency financial report</a></li><li><a href="/info-finder/reactors/mont/tritium-and-effluent-release-issue.html#response" target="_self">monticello tritium issue</a></li><li><a href="https://tribal.nrc.gov/" target="_self">tribal liaison program</a></li><li><a href="https://mapx.nrc-gateway.gov/" target="_self">map-x</a></li><li><a href="https://nrcoig.oversight.gov/oig-hotline" target="_self">oig hotline</a></li><li><a href="/reading-rm/doc-collections/rulemaking-ruleforum/active/ruleindex.html" target="_self">rulemaking activity</a></li><li><a href="/reading-rm/doc-collections/commission/recent/index.html" target="_self">commission documents</a></li> </ul> </div> <div class="more" style="margin-bottom: 10px ;margin-top:-15px; text-align: center;"> <a href="/past-key-topics.html">spotlight archive </a> </div> </div> <div class="col-lg-4 mb-3"> <h3 class='text-left white primary-background-heading' >latest news</h3> <div class="articles"> <div class="articles-list"> <a href="/cdn/doc-collection-news/2025/25-002-i.pdf" target="_blank"> <i class="icon-fontello-doc-1">&nbsp;</i> <span>nrc proposes $9,000 civil penalty against hartford hospital</span> </a> </div> <div class="articles-list"> <a href="/cdn/doc-collection-news/2025/25-012.pdf" target="_blank"> <i class="icon-fontello-doc-1">&nbsp;</i> <span>nrc issues annual assessments for nations nuclear plants</span> </a> </div> <div class="articles-list"> <a href="/cdn/doc-collection-news/2025/25-011.pdf" target="_blank"> <i class="icon-fontello-doc-1">&nbsp;</i> <span>latest edition of nrc information digest now available online</span> </a> </div> <div class="articles-list"> <a href="/cdn/doc-collection-news/2025/25-001-i.pdf" target="_blank"> <i class="icon-fontello-doc-1">&nbsp;</i> <span>nrc begins special inspection at hope creek nuclear power plant</span> </a> </div> <div class="articles-list"> <a href="/cdn/doc-collection-news/2025/25-010.pdf" target="_blank"> <i class="icon-fontello-doc-1">&nbsp;</i> <span>nrc proposes to amend licensing, inspection, and annual fees for fiscal year 2025</span> </a> </div> <div class="articles-list"> <a href="/cdn/doc-collection-news/2025/25-002-iii.pdf" target="_blank"> <i class="icon-fontello-doc-1">&nbsp;</i> <span>nrc proposes $9,000 civil penalty to materials testing consultants, inc.</span> </a> </div> <div class="articles-list-button"><a href="/reading-rm/doc-collections/news/2025/index.html" class="btn">view all</a></div> </div> </div> <div class="col-lg-4 mb-3"> <h3 class='text-left white primary-background-heading' >public meetings</h3><div class='text-center'><div align="left" style="border:thin solid;"><i class="icon-fontello-signal" style="float: left;font-size: 1.75em;">&nbsp;</i> <a href="https://video.nrc.gov/">next commission webcast</a><br /> <strong>[april 8, 2025 at 10:00 a.m. (edt)]</strong></div> </div> <div id="calendar" class="pmc"></div> <script type="text/javascript"> var calendardata ={editable: false, eventlimit: true, shownoncurrentdates: false, fixedweekcount: false, eventrender: function(event, element){maketodaybtnactive()}, events: [{title: '19', url: 'https://www.nrc.gov/pmns/mtg?do=search.results&pageno=1&startdate=12/19/2024&enddate=12/19/2024', start: '2024-12-19'},{title: '20', url: 'https://www.nrc.gov/pmns/mtg?do=search.results&pageno=1&startdate=12/20/2024&enddate=12/20/2024', start: '2024-12-20'},{title: '21', url: 'https://www.nrc.gov/pmns/mtg?do=search.results&pageno=1&startdate=12/21/2024&enddate=12/21/2024', start: '2024-12-21'},{title: '22', url: 'https://www.nrc.gov/pmns/mtg?do=search.results&pageno=1&startdate=12/22/2024&enddate=12/22/2024', start: '2024-12-22'},{title: '23', url: 'https://www.nrc.gov/pmns/mtg?do=search.results&pageno=1&startdate=12/23/2024&enddate=12/23/2024', start: '2024-12-23'},{title: '24', url: 'https://www.nrc.gov/pmns/mtg?do=search.results&pageno=1&startdate=12/24/2024&enddate=12/24/2024', start: '2024-12-24'},{title: '25', url: 'https://www.nrc.gov/pmns/mtg?do=search.results&pageno=1&startdate=12/25/2024&enddate=12/25/2024', start: '2024-12-25'},{title: '26', url: 'https://www.nrc.gov/pmns/mtg?do=search.results&pageno=1&startdate=12/26/2024&enddate=12/26/2024', start: '2024-12-26'},{title: '27', url: 'https://www.nrc.gov/pmns/mtg?do=search.results&pageno=1&startdate=12/27/2024&enddate=12/27/2024', start: '2024-12-27'},{title: '28', url: 'https://www.nrc.gov/pmns/mtg?do=search.results&pageno=1&startdate=12/28/2024&enddate=12/28/2024', start: '2024-12-28'},{title: '29', url: 'https://www.nrc.gov/pmns/mtg?do=search.results&pageno=1&startdate=12/29/2024&enddate=12/29/2024', start: '2024-12-29'},{title: '30', url: 'https://www.nrc.gov/pmns/mtg?do=search.results&pageno=1&startdate=12/30/2024&enddate=12/30/2024', start: '2024-12-30'},{title: '31', url: 'https://www.nrc.gov/pmns/mtg?do=search.results&pageno=1&startdate=12/31/2024&enddate=12/31/2024', start: '2024-12-31'},{title: '01', url: 'https://www.nrc.gov/pmns/mtg?do=search.results&pageno=1&startdate=1/01/2025&enddate=1/01/2025', start: '2025-01-01'},{title: '02', url: 'https://www.nrc.gov/pmns/mtg?do=search.results&pageno=1&startdate=1/02/2025&enddate=1/02/2025', start: '2025-01-02'},{title: '03', url: 'https://www.nrc.gov/pmns/mtg?do=search.results&pageno=1&startdate=1/03/2025&enddate=1/03/2025', start: '2025-01-03'},{title: '04', url: 'https://www.nrc.gov/pmns/mtg?do=search.results&pageno=1&startdate=1/04/2025&enddate=1/04/2025', start: '2025-01-04'},{title: '05', url: 'https://www.nrc.gov/pmns/mtg?do=search.results&pageno=1&startdate=1/05/2025&enddate=1/05/2025', start: '2025-01-05'},{title: '06', url: 'https://www.nrc.gov/pmns/mtg?do=search.results&pageno=1&startdate=1/06/2025&enddate=1/06/2025', start: '2025-01-06'},{title: '07', url: 'https://www.nrc.gov/pmns/mtg?do=search.results&pageno=1&startdate=1/07/2025&enddate=1/07/2025', start: '2025-01-07'},{title: '08', url: 'https://www.nrc.gov/pmns/mtg?do=search.results&pageno=1&startdate=1/08/2025&enddate=1/08/2025', start: '2025-01-08'},{title: '09', url: 'https://www.nrc.gov/pmns/mtg?do=search.results&pageno=1&startdate=1/09/2025&enddate=1/09/2025', start: '2025-01-09'},{title: '10', url: 'https://www.nrc.gov/pmns/mtg?do=search.results&pageno=1&startdate=1/10/2025&enddate=1/10/2025', start: '2025-01-10'},{title: '11', url: 'https://www.nrc.gov/pmns/mtg?do=search.results&pageno=1&startdate=1/11/2025&enddate=1/11/2025', start: '2025-01-11'},{title: '12', url: 'https://www.nrc.gov/pmns/mtg?do=search.results&pageno=1&startdate=1/12/2025&enddate=1/12/2025', start: '2025-01-12'},{title: '13', url: 'https://www.nrc.gov/pmns/mtg?do=search.results&pageno=1&startdate=1/13/2025&enddate=1/13/2025', start: '2025-01-13'},{title: '14', url: 'https://www.nrc.gov/pmns/mtg?do=search.results&pageno=1&startdate=1/14/2025&enddate=1/14/2025', start: '2025-01-14'},{title: '15', url: 'https://www.nrc.gov/pmns/mtg?do=search.results&pageno=1&startdate=1/15/2025&enddate=1/15/2025', start: '2025-01-15'},{title: '16', url: 'https://www.nrc.gov/pmns/mtg?do=search.results&pageno=1&startdate=1/16/2025&enddate=1/16/2025', start: '2025-01-16'},{title: '17', url: 'https://www.nrc.gov/pmns/mtg?do=search.results&pageno=1&startdate=1/17/2025&enddate=1/17/2025', start: '2025-01-17'},{title: '18', url: 'https://www.nrc.gov/pmns/mtg?do=search.results&pageno=1&startdate=1/18/2025&enddate=1/18/2025', start: '2025-01-18'},{title: '19', url: 'https://www.nrc.gov/pmns/mtg?do=search.results&pageno=1&startdate=1/19/2025&enddate=1/19/2025', start: '2025-01-19'},{title: '20', url: 'https://www.nrc.gov/pmns/mtg?do=search.results&pageno=1&startdate=1/20/2025&enddate=1/20/2025', start: '2025-01-20'},{title: '21', url: 'https://www.nrc.gov/pmns/mtg?do=search.results&pageno=1&startdate=1/21/2025&enddate=1/21/2025', start: '2025-01-21'},{title: '22', url: 'https://www.nrc.gov/pmns/mtg?do=search.results&pageno=1&startdate=1/22/2025&enddate=1/22/2025', start: '2025-01-22'},{title: '23', url: 'https://www.nrc.gov/pmns/mtg?do=search.results&pageno=1&startdate=1/23/2025&enddate=1/23/2025', start: '2025-01-23'},{title: '24', url: 'https://www.nrc.gov/pmns/mtg?do=search.results&pageno=1&startdate=1/24/2025&enddate=1/24/2025', start: '2025-01-24'},{title: '25', url: 'https://www.nrc.gov/pmns/mtg?do=search.results&pageno=1&startdate=1/25/2025&enddate=1/25/2025', start: '2025-01-25'},{title: '26', url: 'https://www.nrc.gov/pmns/mtg?do=search.results&pageno=1&startdate=1/26/2025&enddate=1/26/2025', start: '2025-01-26'},{title: '27', url: 'https://www.nrc.gov/pmns/mtg?do=search.results&pageno=1&startdate=1/27/2025&enddate=1/27/2025', start: '2025-01-27'},{title: '28', url: 'https://www.nrc.gov/pmns/mtg?do=search.results&pageno=1&startdate=1/28/2025&enddate=1/28/2025', start: '2025-01-28'},{title: '29', url: 'https://www.nrc.gov/pmns/mtg?do=search.results&pageno=1&startdate=1/29/2025&enddate=1/29/2025', start: '2025-01-29'},{title: '30', url: 'https://www.nrc.gov/pmns/mtg?do=search.results&pageno=1&startdate=1/30/2025&enddate=1/30/2025', start: '2025-01-30'},{title: '31', url: 'https://www.nrc.gov/pmns/mtg?do=search.results&pageno=1&startdate=1/31/2025&enddate=1/31/2025', start: '2025-01-31'},{title: '01', url: 'https://www.nrc.gov/pmns/mtg?do=search.results&pageno=1&startdate=2/01/2025&enddate=2/01/2025', start: '2025-02-01'},{title: '02', url: 'https://www.nrc.gov/pmns/mtg?do=search.results&pageno=1&startdate=2/02/2025&enddate=2/02/2025', start: '2025-02-02'},{title: '03', url: 'https://www.nrc.gov/pmns/mtg?do=search.results&pageno=1&startdate=2/03/2025&enddate=2/03/2025', start: '2025-02-03'},{title: '04', url: 'https://www.nrc.gov/pmns/mtg?do=search.results&pageno=1&startdate=2/04/2025&enddate=2/04/2025', start: '2025-02-04'},{title: '05', url: 'https://www.nrc.gov/pmns/mtg?do=search.results&pageno=1&startdate=2/05/2025&enddate=2/05/2025', start: '2025-02-05'},{title: '06', url: 'https://www.nrc.gov/pmns/mtg?do=search.results&pageno=1&startdate=2/06/2025&enddate=2/06/2025', start: '2025-02-06'},{title: '07', url: 'https://www.nrc.gov/pmns/mtg?do=search.results&pageno=1&startdate=2/07/2025&enddate=2/07/2025', start: '2025-02-07'},{title: '08', url: 'https://www.nrc.gov/pmns/mtg?do=search.results&pageno=1&startdate=2/08/2025&enddate=2/08/2025', start: '2025-02-08'},{title: '09', url: 'https://www.nrc.gov/pmns/mtg?do=search.results&pageno=1&startdate=2/09/2025&enddate=2/09/2025', start: '2025-02-09'},{title: '10', url: 'https://www.nrc.gov/pmns/mtg?do=search.results&pageno=1&startdate=2/10/2025&enddate=2/10/2025', start: '2025-02-10'},{title: '11', url: 'https://www.nrc.gov/pmns/mtg?do=search.results&pageno=1&startdate=2/11/2025&enddate=2/11/2025', start: '2025-02-11'},{title: '12', url: 'https://www.nrc.gov/pmns/mtg?do=search.results&pageno=1&startdate=2/12/2025&enddate=2/12/2025', start: '2025-02-12'},{title: '13', url: 'https://www.nrc.gov/pmns/mtg?do=search.results&pageno=1&startdate=2/13/2025&enddate=2/13/2025', start: '2025-02-13'},{title: '14', url: 'https://www.nrc.gov/pmns/mtg?do=search.results&pageno=1&startdate=2/14/2025&enddate=2/14/2025', start: '2025-02-14'},{title: '15', url: 'https://www.nrc.gov/pmns/mtg?do=search.results&pageno=1&startdate=2/15/2025&enddate=2/15/2025', start: '2025-02-15'},{title: '16', url: 'https://www.nrc.gov/pmns/mtg?do=search.results&pageno=1&startdate=2/16/2025&enddate=2/16/2025', start: '2025-02-16'},{title: '17', url: 'https://www.nrc.gov/pmns/mtg?do=search.results&pageno=1&startdate=2/17/2025&enddate=2/17/2025', start: '2025-02-17'},{title: '18', url: 'https://www.nrc.gov/pmns/mtg?do=search.results&pageno=1&startdate=2/18/2025&enddate=2/18/2025', start: '2025-02-18'},{title: '19', url: 'https://www.nrc.gov/pmns/mtg?do=search.results&pageno=1&startdate=2/19/2025&enddate=2/19/2025', start: '2025-02-19'},{title: '20', url: 'https://www.nrc.gov/pmns/mtg?do=search.results&pageno=1&startdate=2/20/2025&enddate=2/20/2025', start: '2025-02-20'},{title: '21', url: 'https://www.nrc.gov/pmns/mtg?do=search.results&pageno=1&startdate=2/21/2025&enddate=2/21/2025', start: '2025-02-21'},{title: '22', url: 'https://www.nrc.gov/pmns/mtg?do=search.results&pageno=1&startdate=2/22/2025&enddate=2/22/2025', start: '2025-02-22'},{title: '23', url: 'https://www.nrc.gov/pmns/mtg?do=search.results&pageno=1&startdate=2/23/2025&enddate=2/23/2025', start: '2025-02-23'},{title: '24', url: 'https://www.nrc.gov/pmns/mtg?do=search.results&pageno=1&startdate=2/24/2025&enddate=2/24/2025', start: '2025-02-24'},{title: '25', url: 'https://www.nrc.gov/pmns/mtg?do=search.results&pageno=1&startdate=2/25/2025&enddate=2/25/2025', start: '2025-02-25'},{title: '26', url: 'https://www.nrc.gov/pmns/mtg?do=search.results&pageno=1&startdate=2/26/2025&enddate=2/26/2025', start: '2025-02-26'},{title: '27', url: 'https://www.nrc.gov/pmns/mtg?do=search.results&pageno=1&startdate=2/27/2025&enddate=2/27/2025', start: '2025-02-27'},{title: '28', url: 'https://www.nrc.gov/pmns/mtg?do=search.results&pageno=1&startdate=2/28/2025&enddate=2/28/2025', start: '2025-02-28'},{title: '01', url: 'https://www.nrc.gov/pmns/mtg?do=search.results&pageno=1&startdate=3/01/2025&enddate=3/01/2025', start: '2025-03-01'},{title: '02', url: 'https://www.nrc.gov/pmns/mtg?do=search.results&pageno=1&startdate=3/02/2025&enddate=3/02/2025', start: '2025-03-02'},{title: '03', url: 'https://www.nrc.gov/pmns/mtg?do=search.results&pageno=1&startdate=3/03/2025&enddate=3/03/2025', start: '2025-03-03'},{title: '04', url: 'https://www.nrc.gov/pmns/mtg?do=search.results&pageno=1&startdate=3/04/2025&enddate=3/04/2025', start: '2025-03-04'},{title: '05', url: 'https://www.nrc.gov/pmns/mtg?do=search.results&pageno=1&startdate=3/05/2025&enddate=3/05/2025', start: '2025-03-05'},{title: '06', url: 'https://www.nrc.gov/pmns/mtg?do=search.results&pageno=1&startdate=3/06/2025&enddate=3/06/2025', start: '2025-03-06'},{title: '07', url: 'https://www.nrc.gov/pmns/mtg?do=search.results&pageno=1&startdate=3/07/2025&enddate=3/07/2025', start: '2025-03-07'},{title: '08', url: 'https://www.nrc.gov/pmns/mtg?do=search.results&pageno=1&startdate=3/08/2025&enddate=3/08/2025', start: '2025-03-08'},{title: '09', url: 'https://www.nrc.gov/pmns/mtg?do=search.results&pageno=1&startdate=3/09/2025&enddate=3/09/2025', start: '2025-03-09'},{title: '10', url: 'https://www.nrc.gov/pmns/mtg?do=search.results&pageno=1&startdate=3/10/2025&enddate=3/10/2025', start: '2025-03-10'},{title: '11', url: 'https://www.nrc.gov/pmns/mtg?do=search.results&pageno=1&startdate=3/11/2025&enddate=3/11/2025', start: '2025-03-11'},{title: '12', url: 'https://www.nrc.gov/pmns/mtg?do=search.results&pageno=1&startdate=3/12/2025&enddate=3/12/2025', start: '2025-03-12'},{title: '13', url: 'https://www.nrc.gov/pmns/mtg?do=search.results&pageno=1&startdate=3/13/2025&enddate=3/13/2025', start: '2025-03-13'},{title: '14', url: 'https://www.nrc.gov/pmns/mtg?do=search.results&pageno=1&startdate=3/14/2025&enddate=3/14/2025', start: '2025-03-14'},{title: '15', url: 'https://www.nrc.gov/pmns/mtg?do=search.results&pageno=1&startdate=3/15/2025&enddate=3/15/2025', start: '2025-03-15'},{title: '16', url: 'https://www.nrc.gov/pmns/mtg?do=search.results&pageno=1&startdate=3/16/2025&enddate=3/16/2025', start: '2025-03-16'},{title: '17', url: 'https://www.nrc.gov/pmns/mtg?do=search.results&pageno=1&startdate=3/17/2025&enddate=3/17/2025', start: '2025-03-17'},{title: '18', url: 'https://www.nrc.gov/pmns/mtg?do=search.results&pageno=1&startdate=3/18/2025&enddate=3/18/2025', start: '2025-03-18'},{title: '19', url: 'https://www.nrc.gov/pmns/mtg?do=search.results&pageno=1&startdate=3/19/2025&enddate=3/19/2025', start: '2025-03-19'},{title: '20', url: 'https://www.nrc.gov/pmns/mtg?do=search.results&pageno=1&startdate=3/20/2025&enddate=3/20/2025', start: '2025-03-20'},{title: '21', url: 'https://www.nrc.gov/pmns/mtg?do=search.results&pageno=1&startdate=3/21/2025&enddate=3/21/2025', start: '2025-03-21'},{title: '22', url: 'https://www.nrc.gov/pmns/mtg?do=search.results&pageno=1&startdate=3/22/2025&enddate=3/22/2025', start: '2025-03-22'},{title: '23', url: 'https://www.nrc.gov/pmns/mtg?do=search.results&pageno=1&startdate=3/23/2025&enddate=3/23/2025', start: '2025-03-23'},{title: '24', url: 'https://www.nrc.gov/pmns/mtg?do=search.results&pageno=1&startdate=3/24/2025&enddate=3/24/2025', start: '2025-03-24'},{title: '25', url: 'https://www.nrc.gov/pmns/mtg?do=search.results&pageno=1&startdate=3/25/2025&enddate=3/25/2025', start: '2025-03-25'},{title: '26', url: 'https://www.nrc.gov/pmns/mtg?do=search.results&pageno=1&startdate=3/26/2025&enddate=3/26/2025', start: '2025-03-26'},{title: '27', url: 'https://www.nrc.gov/pmns/mtg?do=search.results&pageno=1&startdate=3/27/2025&enddate=3/27/2025', start: '2025-03-27'},{title: '28', url: 'https://www.nrc.gov/pmns/mtg?do=search.results&pageno=1&startdate=3/28/2025&enddate=3/28/2025', start: '2025-03-28'},{title: '29', url: 'https://www.nrc.gov/pmns/mtg?do=search.results&pageno=1&startdate=3/29/2025&enddate=3/29/2025', start: '2025-03-29'},{title: '30', url: 'https://www.nrc.gov/pmns/mtg?do=search.results&pageno=1&startdate=3/30/2025&enddate=3/30/2025', start: '2025-03-30'},{title: '31', url: 'https://www.nrc.gov/pmns/mtg?do=search.results&pageno=1&startdate=3/31/2025&enddate=3/31/2025', start: '2025-03-31'},{title: '01', url: 'https://www.nrc.gov/pmns/mtg?do=search.results&pageno=1&startdate=4/01/2025&enddate=4/01/2025', start: '2025-04-01'},{title: '02', url: 'https://www.nrc.gov/pmns/mtg?do=search.results&pageno=1&startdate=4/02/2025&enddate=4/02/2025', start: '2025-04-02'},{title: '03', url: 'https://www.nrc.gov/pmns/mtg?do=search.results&pageno=1&startdate=4/03/2025&enddate=4/03/2025', start: '2025-04-03'},{title: '04', url: 'https://www.nrc.gov/pmns/mtg?do=search.results&pageno=1&startdate=4/04/2025&enddate=4/04/2025', start: '2025-04-04'},{title: '05', url: 'https://www.nrc.gov/pmns/mtg?do=search.results&pageno=1&startdate=4/05/2025&enddate=4/05/2025', start: '2025-04-05'},{title: '06', url: 'https://www.nrc.gov/pmns/mtg?do=search.results&pageno=1&startdate=4/06/2025&enddate=4/06/2025', start: '2025-04-06'},{title: '07', url: 'https://www.nrc.gov/pmns/mtg?do=search.results&pageno=1&startdate=4/07/2025&enddate=4/07/2025', start: '2025-04-07'},{title: '08', url: 'https://www.nrc.gov/pmns/mtg?do=search.results&pageno=1&startdate=4/08/2025&enddate=4/08/2025', start: '2025-04-08'},{title: '09', url: 'https://www.nrc.gov/pmns/mtg?do=search.results&pageno=1&startdate=4/09/2025&enddate=4/09/2025', start: '2025-04-09'},{title: '10', url: 'https://www.nrc.gov/pmns/mtg?do=search.results&pageno=1&startdate=4/10/2025&enddate=4/10/2025', start: '2025-04-10'},{title: '11', url: 'https://www.nrc.gov/pmns/mtg?do=search.results&pageno=1&startdate=4/11/2025&enddate=4/11/2025', start: '2025-04-11'},{title: '12', url: 'https://www.nrc.gov/pmns/mtg?do=search.results&pageno=1&startdate=4/12/2025&enddate=4/12/2025', start: '2025-04-12'},{title: '13', url: 'https://www.nrc.gov/pmns/mtg?do=search.results&pageno=1&startdate=4/13/2025&enddate=4/13/2025', start: '2025-04-13'},{title: '14', url: 'https://www.nrc.gov/pmns/mtg?do=search.results&pageno=1&startdate=4/14/2025&enddate=4/14/2025', start: '2025-04-14'},{title: '15', url: 'https://www.nrc.gov/pmns/mtg?do=search.results&pageno=1&startdate=4/15/2025&enddate=4/15/2025', start: '2025-04-15'},{title: '16', url: 'https://www.nrc.gov/pmns/mtg?do=search.results&pageno=1&startdate=4/16/2025&enddate=4/16/2025', start: '2025-04-16'},{title: '17', url: 'https://www.nrc.gov/pmns/mtg?do=search.results&pageno=1&startdate=4/17/2025&enddate=4/17/2025', start: '2025-04-17'},{title: '18', url: 'https://www.nrc.gov/pmns/mtg?do=search.results&pageno=1&startdate=4/18/2025&enddate=4/18/2025', start: '2025-04-18'},{title: '19', url: 'https://www.nrc.gov/pmns/mtg?do=search.results&pageno=1&startdate=4/19/2025&enddate=4/19/2025', start: '2025-04-19'},{title: '20', url: 'https://www.nrc.gov/pmns/mtg?do=search.results&pageno=1&startdate=4/20/2025&enddate=4/20/2025', start: '2025-04-20'},{title: '21', url: 'https://www.nrc.gov/pmns/mtg?do=search.results&pageno=1&startdate=4/21/2025&enddate=4/21/2025', start: '2025-04-21'},{title: '22', url: 'https://www.nrc.gov/pmns/mtg?do=search.results&pageno=1&startdate=4/22/2025&enddate=4/22/2025', start: '2025-04-22'},{title: '23', url: 'https://www.nrc.gov/pmns/mtg?do=search.results&pageno=1&startdate=4/23/2025&enddate=4/23/2025', start: '2025-04-23'},{title: '24', url: 'https://www.nrc.gov/pmns/mtg?do=search.results&pageno=1&startdate=4/24/2025&enddate=4/24/2025', start: '2025-04-24'},{title: '25', url: 'https://www.nrc.gov/pmns/mtg?do=search.results&pageno=1&startdate=4/25/2025&enddate=4/25/2025', start: '2025-04-25'},{title: '26', url: 'https://www.nrc.gov/pmns/mtg?do=search.results&pageno=1&startdate=4/26/2025&enddate=4/26/2025', start: '2025-04-26'},{title: '27', url: 'https://www.nrc.gov/pmns/mtg?do=search.results&pageno=1&startdate=4/27/2025&enddate=4/27/2025', start: '2025-04-27'},{title: '28', url: 'https://www.nrc.gov/pmns/mtg?do=search.results&pageno=1&startdate=4/28/2025&enddate=4/28/2025', start: '2025-04-28'},{title: '29', url: 'https://www.nrc.gov/pmns/mtg?do=search.results&pageno=1&startdate=4/29/2025&enddate=4/29/2025', start: '2025-04-29'},{title: '30', url: 'https://www.nrc.gov/pmns/mtg?do=search.results&pageno=1&startdate=4/30/2025&enddate=4/30/2025', start: '2025-04-30'},{title: '01', url: 'https://www.nrc.gov/pmns/mtg?do=search.results&pageno=1&startdate=5/01/2025&enddate=5/01/2025', start: '2025-05-01'},{title: '02', url: 'https://www.nrc.gov/pmns/mtg?do=search.results&pageno=1&startdate=5/02/2025&enddate=5/02/2025', start: '2025-05-02'},{title: '03', url: 'https://www.nrc.gov/pmns/mtg?do=search.results&pageno=1&startdate=5/03/2025&enddate=5/03/2025', start: '2025-05-03'},{title: '04', url: 'https://www.nrc.gov/pmns/mtg?do=search.results&pageno=1&startdate=5/04/2025&enddate=5/04/2025', start: '2025-05-04'},{title: '05', url: 'https://www.nrc.gov/pmns/mtg?do=search.results&pageno=1&startdate=5/05/2025&enddate=5/05/2025', start: '2025-05-05'},{title: '06', url: 'https://www.nrc.gov/pmns/mtg?do=search.results&pageno=1&startdate=5/06/2025&enddate=5/06/2025', start: '2025-05-06'},{title: '07', url: 'https://www.nrc.gov/pmns/mtg?do=search.results&pageno=1&startdate=5/07/2025&enddate=5/07/2025', start: '2025-05-07'},{title: '08', url: 'https://www.nrc.gov/pmns/mtg?do=search.results&pageno=1&startdate=5/08/2025&enddate=5/08/2025', start: '2025-05-08'},{title: '09', url: 'https://www.nrc.gov/pmns/mtg?do=search.results&pageno=1&startdate=5/09/2025&enddate=5/09/2025', start: '2025-05-09'},{title: '10', url: 'https://www.nrc.gov/pmns/mtg?do=search.results&pageno=1&startdate=5/10/2025&enddate=5/10/2025', start: '2025-05-10'},{title: '11', url: 'https://www.nrc.gov/pmns/mtg?do=search.results&pageno=1&startdate=5/11/2025&enddate=5/11/2025', start: '2025-05-11'},{title: '12', url: 'https://www.nrc.gov/pmns/mtg?do=search.results&pageno=1&startdate=5/12/2025&enddate=5/12/2025', start: '2025-05-12'},{title: '13', url: 'https://www.nrc.gov/pmns/mtg?do=search.results&pageno=1&startdate=5/13/2025&enddate=5/13/2025', start: '2025-05-13'},{title: '14', url: 'https://www.nrc.gov/pmns/mtg?do=search.results&pageno=1&startdate=5/14/2025&enddate=5/14/2025', start: '2025-05-14'},{title: '15', url: 'https://www.nrc.gov/pmns/mtg?do=search.results&pageno=1&startdate=5/15/2025&enddate=5/15/2025', start: '2025-05-15'},{title: '16', url: 'https://www.nrc.gov/pmns/mtg?do=search.results&pageno=1&startdate=5/16/2025&enddate=5/16/2025', start: '2025-05-16'},{title: '17', url: 'https://www.nrc.gov/pmns/mtg?do=search.results&pageno=1&startdate=5/17/2025&enddate=5/17/2025', start: '2025-05-17'},{title: '18', url: 'https://www.nrc.gov/pmns/mtg?do=search.results&pageno=1&startdate=5/18/2025&enddate=5/18/2025', start: '2025-05-18'},{title: '19', url: 'https://www.nrc.gov/pmns/mtg?do=search.results&pageno=1&startdate=5/19/2025&enddate=5/19/2025', start: '2025-05-19'},{title: '20', url: 'https://www.nrc.gov/pmns/mtg?do=search.results&pageno=1&startdate=5/20/2025&enddate=5/20/2025', start: '2025-05-20'},{title: '21', url: 'https://www.nrc.gov/pmns/mtg?do=search.results&pageno=1&startdate=5/21/2025&enddate=5/21/2025', start: '2025-05-21'},{title: '22', url: 'https://www.nrc.gov/pmns/mtg?do=search.results&pageno=1&startdate=5/22/2025&enddate=5/22/2025', start: '2025-05-22'},{title: '23', url: 'https://www.nrc.gov/pmns/mtg?do=search.results&pageno=1&startdate=5/23/2025&enddate=5/23/2025', start: '2025-05-23'},{title: '24', url: 'https://www.nrc.gov/pmns/mtg?do=search.results&pageno=1&startdate=5/24/2025&enddate=5/24/2025', start: '2025-05-24'},{title: '25', url: 'https://www.nrc.gov/pmns/mtg?do=search.results&pageno=1&startdate=5/25/2025&enddate=5/25/2025', start: '2025-05-25'},{title: '26', url: 'https://www.nrc.gov/pmns/mtg?do=search.results&pageno=1&startdate=5/26/2025&enddate=5/26/2025', start: '2025-05-26'},{title: '27', url: 'https://www.nrc.gov/pmns/mtg?do=search.results&pageno=1&startdate=5/27/2025&enddate=5/27/2025', start: '2025-05-27'},{title: '28', url: 'https://www.nrc.gov/pmns/mtg?do=search.results&pageno=1&startdate=5/28/2025&enddate=5/28/2025', start: '2025-05-28'},{title: '29', url: 'https://www.nrc.gov/pmns/mtg?do=search.results&pageno=1&startdate=5/29/2025&enddate=5/29/2025', start: '2025-05-29'},{title: '30', url: 'https://www.nrc.gov/pmns/mtg?do=search.results&pageno=1&startdate=5/30/2025&enddate=5/30/2025', start: '2025-05-30'},{title: '31', url: 'https://www.nrc.gov/pmns/mtg?do=search.results&pageno=1&startdate=5/31/2025&enddate=5/31/2025', start: '2025-05-31'},{title: '01', url: 'https://www.nrc.gov/pmns/mtg?do=search.results&pageno=1&startdate=6/01/2025&enddate=6/01/2025', start: '2025-06-01'},{title: '02', url: 'https://www.nrc.gov/pmns/mtg?do=search.results&pageno=1&startdate=6/02/2025&enddate=6/02/2025', start: '2025-06-02'},{title: '03', url: 'https://www.nrc.gov/pmns/mtg?do=search.results&pageno=1&startdate=6/03/2025&enddate=6/03/2025', start: '2025-06-03'},{title: '04', url: 'https://www.nrc.gov/pmns/mtg?do=search.results&pageno=1&startdate=6/04/2025&enddate=6/04/2025', start: '2025-06-04'},{title: '05', url: 'https://www.nrc.gov/pmns/mtg?do=search.results&pageno=1&startdate=6/05/2025&enddate=6/05/2025', start: '2025-06-05'},{title: '06', url: 'https://www.nrc.gov/pmns/mtg?do=search.results&pageno=1&startdate=6/06/2025&enddate=6/06/2025', start: '2025-06-06'},{title: '07', url: 'https://www.nrc.gov/pmns/mtg?do=search.results&pageno=1&startdate=6/07/2025&enddate=6/07/2025', start: '2025-06-07'},{title: '08', url: 'https://www.nrc.gov/pmns/mtg?do=search.results&pageno=1&startdate=6/08/2025&enddate=6/08/2025', start: '2025-06-08'},{title: '09', url: 'https://www.nrc.gov/pmns/mtg?do=search.results&pageno=1&startdate=6/09/2025&enddate=6/09/2025', start: '2025-06-09'},{title: '10', url: 'https://www.nrc.gov/pmns/mtg?do=search.results&pageno=1&startdate=6/10/2025&enddate=6/10/2025', start: '2025-06-10'},{title: '11', url: 'https://www.nrc.gov/pmns/mtg?do=search.results&pageno=1&startdate=6/11/2025&enddate=6/11/2025', start: '2025-06-11'},{title: '12', url: 'https://www.nrc.gov/pmns/mtg?do=search.results&pageno=1&startdate=6/12/2025&enddate=6/12/2025', start: '2025-06-12'},{title: '13', url: 'https://www.nrc.gov/pmns/mtg?do=search.results&pageno=1&startdate=6/13/2025&enddate=6/13/2025', start: '2025-06-13'},{title: '14', url: 'https://www.nrc.gov/pmns/mtg?do=search.results&pageno=1&startdate=6/14/2025&enddate=6/14/2025', start: '2025-06-14'},{title: '15', url: 'https://www.nrc.gov/pmns/mtg?do=search.results&pageno=1&startdate=6/15/2025&enddate=6/15/2025', start: '2025-06-15'},{title: '16', url: 'https://www.nrc.gov/pmns/mtg?do=search.results&pageno=1&startdate=6/16/2025&enddate=6/16/2025', start: '2025-06-16'},{title: '17', url: 'https://www.nrc.gov/pmns/mtg?do=search.results&pageno=1&startdate=6/17/2025&enddate=6/17/2025', start: '2025-06-17'},{title: '18', url: 'https://www.nrc.gov/pmns/mtg?do=search.results&pageno=1&startdate=6/18/2025&enddate=6/18/2025', start: '2025-06-18'},{title: '19', url: 'https://www.nrc.gov/pmns/mtg?do=search.results&pageno=1&startdate=6/19/2025&enddate=6/19/2025', start: '2025-06-19'}, ]}</script> </div> </div> </div> <style type="text/css">div.scbwwbt-content-button a{padding:14px 26px 16px 26px}</style> <div class="container"> <div class="row inner-top-xs"> <div class="col-lg-3 col-md-6"> <div class="tile-card mg-trigger" id="tile141310"> <a href="/reading-rm/doc-collections/event-status/index.html"><img class="img-responsive" src="/cdn/site/home-page/generic-event-report2.jpg" alt="image of person typing on a laptop sitting at a table with a smartphone on the left side and a cup of coffee on the right side of the table." title=""></a> <div class="tile-card-content"> <span class="tile-card-title">event reports</span> <span class="tile-card-name">reports associated with events</span> </div> <a href="/reading-rm/doc-collections/event-status/index.html" class="tile-card-button btn btn-small quaternary-background black">read more</a> </div> </div><div class="col-lg-3 col-md-6"> <div class="tile-card mg-trigger" id="tile141311"> <a href="/reading-rm/adams.html"><img class="img-responsive" src="/cdn/site/home-page/adams2.jpg" alt="image of computer server room with twelve large tall black servers with small blue lights sitting on a grey floor." title=""></a> <div class="tile-card-content"> <span class="tile-card-title">adams public documents</span> <span class="tile-card-name">search and view nrc&#39;s public documents</span> </div> <a href="/reading-rm/adams.html" class="tile-card-button btn btn-small quaternary-background black">read more</a> </div> </div><div class="col-lg-3 col-md-6"> <div class="tile-card mg-trigger" id="tile141312"> <a href="/public-involve/open.html"><img class="img-responsive" src="/cdn/site/home-page/open-government.jpg" alt="image of the nuclear regulatory commission's outdoor building signage at their headquarters in maryland with an american flag flying next to it." title=""></a> <div class="tile-card-content"> <span class="tile-card-title">open government</span> <span class="tile-card-name">nrc approach to open/digital government</span> </div> <a href="/public-involve/open.html" class="tile-card-button btn btn-small quaternary-background black">read more</a> </div> </div><div class="col-lg-3 col-md-6"> <div class="tile-card mg-trigger" id="tile141313"> <a href="/about-nrc/regulatory/licensing/fees.html#ebilling"><img class="img-responsive" src="/cdn/site/home-page/new-reactor-license.jpg" alt="image of person holding a tablet computer in their left hand and a credit card in their right hand." title=""></a> <div class="tile-card-content"> <span class="tile-card-title">ebilling</span> <span class="tile-card-name">invoices available online</span> </div> <a href="/about-nrc/regulatory/licensing/fees.html#ebilling" class="tile-card-button btn btn-small quaternary-background black">learn more</a> </div> </div><div class="col-lg-3 col-md-6"> <div class="tile-card mg-trigger" id="tile141315"> <a href="/about-nrc/emerg-preparedness/in-radiological-emerg.html"><img class="img-responsive" src="/cdn/site/home-page/nrc-emergency2.jpg" alt="image of a red emergency light on a black background." title=""></a> <div class="tile-card-content"> <span class="tile-card-title">in a nuclear emergency ...</span> <span class="tile-card-name">know what to do</span> </div> <a href="/about-nrc/emerg-preparedness/in-radiological-emer